officer john barne injured shooting santa fe high school get big welcome home neighbor wednesday nig,Y
heart texas hear shooting santa fe high school florida know well feeli,Y
officer john barne injured shooting santa fe high school get big welcome home neighbor,Y
after santa fe fall trench coat,Y
eight student two teacher recently killed shooting santa fe high school billy graham,Y
why conversation damn hard person term couldnt accept,N
good idea just msd la vegas mass shooting trenton santa fe many mo,Y
if think m unfair just keep mind song s big sing-along chorus perspective,N
police record show houston-area high school receive nine threat month lead mass shooting th,N
oof dont know cuz medium bias hes conservative survivor santa fe shooting,N
today school shooting santa fe high school texas th mass school shooting year may text act t,Y
see phenomenum year parkland fl santa fe tx high school shooting anomal,Y
die school shoot hope im last one person shoot killed santa fe high sch,Y
m comepletly honest never hear santa,N
go check new video acknowledge santa fe high school shooting link htt,Y
hey stephen maybe youve hear santa fe tx shooting shooter used revolver,Y
police record show santa fe high school receive nine threat month lead mass shooting l,N
the awful irony death sakiba vibrant active pakistani exchange student santa fe hugh school,Y
post anon qs say anti-q talk go mainstream biggest way q respond https,N
santa fe high school receive nine threat month mass shooting via,N
s month since last covered song sign language honor santa fe shooting today parkland s,N
detective see uptick school threat school shooting santa fe school shoot local law enfor,N
santa fe high school receive nine threat month mass shooting,N
trump show tone deaf indifferent human suffering describe upcoming meeting f,N
parkland teen offer advice survivor texas shoot handling medium professional interv,Y
speaker schwartzkopf meet student santa fe tx discuss gun control legislation student surv,Y
report santa fe high school receive threat month shooting,N
dead shooting santa fe highschool locate texas,Y
fuck gun santa fe high school xxxtentacion now pittsburgh teenager here also list shooting,Y
isd officer confront mass return home jun pm et,N
unsafe everywhere expert say school shooting underscore new normal u s,Y
especially gun accessible many case will like santa fe high schoo,N
native houstonian m deeply saddened shooting santa fe highschool wake call tex,N
in support plan ci campuse full-time dedicate provide mental health s,N
must new twitter thing look profile survivor recent shooting santa fe tx,Y
yesterday office westfield nj call long history oppose commonse,N
go w office tell staff san,Y
when go w office tell staff santa fe high school response,Y
can learn santa fe shooting mindset must change,N
speaker schwartzkopf meet student santa fe tx discuss gun control legislation studen,Y
s horrify folk say horrify child separation horrify ted huh,Y
jj watt raise million hurricane harvey survivor also paid funeral of kid kille,N
absolutely nothing propose far make school safer every single one,Y
mother lose daughter santa fe texas school shooting say talk trump,N
s crazy much ruckus left will make gun doesn t fit narrative haven t hear anythi,N
santa fe shooting trigger rise texas blood donation hour follow school,Y
here link snope attempt debunk phenomenon,Y
snope build algo now track refute claim false,Y
just wonder go kid santa fe school,Y
sad deal heart go everyone affect morning s shooting,N
nfl player j j watt offer pay funeral santa fe high school shooting victim,Y
grief anguish transcend two faith prayer texas school shooting liz hampton santa fe texas reuter,Y
ooooooh burning question thing hear whisper another shooting rather two didnt see sant,N
thank leadership beto visit major valley detention camp throughout father,N
how santa fe high shooting different past school shooting mtp daily msnbc,Y
nbcs pete william join discuss santa fe high school shooting note unusual shoo,Y
case miss gov abbott want put counselor school,Y
feel bad death child kill can say gun control law shoot pe,Y
seem like every breaking news tragedy learn social medium recent school sh,N
santa fe high school get nine threat month houston-area mass shooting threat come,N
latest news santa fe high receive nine threat month mass shooting march el paso,N
new interview houston police chief art acevedo tell us thought problematic gun law texas,Y
bro think democrat used parkland shooting get,Y
devastate hear school shooting santa fe break heart hear another one hope god,N
-year-old sabika sheikh exchange student pakistan killed santa fe high school shooting,Y
sabika sheikh -year-old pakistani exchange student kill santa fe high school shooting bury today,Y
everyone functioning brain know snope run leftist trust already mention,N
little month santa fe high school shooting gun advocate will gather rural city push t,N
visit santa fe school shooting survivor hospital,Y
revolver shotgun used santa fe shooting,Y
much direct current issue parent md il santa fe shooter legal firearm pos,Y
to recap tx republican party set priority measure make potentially easier kid get,Y
santa fe high school baseball player perfectly fine shot head,N
i add video playlist david hogg santa fe shooting s somebody will,N
santa fe high school pitcher rome shubert shot back head friday s mass shooting back,N
from tornillo protest roundtable santa fe shooting survivor beto orourke busy father day,Y
santa fe student hopeless reaction friday shooting eventually go happen,Y
jj watt raise million hurricane harvey survivor also paid funeral of kid wer,N
they tremendous job segment santa fe school shooting every station verify,Y
s massacre become new norm didn t even report school shooting texas santa fe,Y
dont forget questioning ll put danger simply go,N
abc chauncy glover talk sandy hook shooting santa fe shooting life journalist v,N
liked video abc chauncy glover talk sandy hook shooting santa fe shooting,N
none place youre list mile santa fe shoot,Y
shooting article void hope one person think common-sense law like wi,N
q drop link anti q site,Y
amount gun injury second gun injury may st follow santa fe school shootin,Y
breaking news multiple fatality school shooting southeast texas local official say suspect c,N
retweeted beto orourke fortunate spend day many great texan standing,Y
school safety topic arm civilian militia santa fe texas santa fe high school texas freedom fo,Y
the recent mass shooting us one thing common misogyny,Y
after santa fe highschool shooting texas lawmaker focused anything gun,Y
point snope prepare algorithm automatically fact check claim likely make q snop,Y
speaking texas m glad president come little fun santa fe school shooting,N
latest update santa fe high school shooting,Y
today beto rally w oppose policy m,N
victim santa fe school shooting get visited justin timberlake,Y
conspiracy news now full effect let us relent,Y
he go tornillo santa fe talk round table kid school shooting yesterda,N
feel like high school student santa fe hs say wasnt surprised school endure shooting,Y
this real senator look act like can bring respectability back tx elect,Y
best,N
fortunate spend day many great texan standing speaking,Y
fortunate spend day many great texan standing speak critical time f,Y
just read friend mandys boy experience santa fe shooting can say child,Y
i like video abc chauncy glover talk sandy hook shooting santa fe shooting life a,N
good idea just msd la vegas mass shooting trenton santa fe many tragically,Y
abc chauncy glover talk sandy hook shooting santa fe shooting life journalist via,N
s officially month since santa fe shooting killed classmate teacher s still,N
measure stop santa fe shooting assault weapon ban ar- ban stronger background check cu,Y
like texan end night whataburger,N
a little month santa fe high school shooting gun advocate will gather rural city,N
student shooting nobody think cnn video santa fe high school st,Y
it feel like america almost forgotten ten person kill santa fe shooting let happ,Y
bartender overserve customer can hold liable drunk driver kill someone shooter s da,Y
red flag law allow local official take gun away person judge declare danger will texas p,N
dont think time lawsuit snope smoke much,N
soro funded snope buld algorithm track refute q claim false,Y
remember person lose life orlando nightclub shooting two year ago today since w,Y
anonymous jun est qs say anti-q talk go mainstream biggest way jun,N
deserve though santa fe shooting reply,Y
plus none common sense gun law stop santa fe shooting,Y
so much good video come much bad santa fe mass murder talk family alert,N
conspiracy theory immediately appear santa fe school shooting via,Y
rainbow appear texas sky church service honor santa fe shooting victim,Y
congressman meet w voter tx county bid ted cruzs senate seat,Y
i sit w spectrum news austin discuss santa fe select committee study violence school sc,Y
conspiracy news now full effect let us rel,Y
rip poor kid die shoot santa fe today s sad see horrible event ke,N
if law exist shooting santa fe may happen think young peop,Y
re monster have voted dim-witted coward negative press isn t go swa,Y
santa fe high school shooting detail emerge suspect appear court,Y
youre tell survivor santa fe shooting doesnt matter,Y
significant lt gov tell doubt budget writer next year will need make withd,Y
mass shooting georgia day nationally televised mass shooting,Y
born kill here know dimitrio pagourtzi suspect santa fe high school sh,Y
liberal snope now fact check q theory q say anti-q talk go mainstream biggest way,N
and like texan end night whataburger,N
little shooting person die audacity call little msm didnt report,N
little shooting person die audacity call little msm didnt r,N
always know snope fake never feel right -- like infiltrate evil h,Y
santa fe shooting gov greg abbott want put counselor school educator say s enough late,Y
greg abbotts plan improve school safety include allow school shift money toward counsele mental health,N
fact need havent provide zach s -year-old survivor santa,N
qs say anti-q talk go mainstream biggest way snope buildin,N
victim shooting santa fe high school,Y
i add video playlist santa fe shooting jerusalem new whiskey,N
a month ago today stick work bawl eye know person kid teacher love,N
snope build algo now track refute claim false q,Y
friend lose daughter santa fe shooting,Y
im used qdrop - edt https em em snope buildi,Y
cant wait hear take recent shooting incident medium coverage lack,N
open carry activist plan rally santa fe next weekend month deadly shooting town high scho,N
us know us theyve know us contain us lie explain us,N
kim one girl killed school shooting santa fe texas beautiful child now mom de,Y
gov abbott recommend school district find money hire counselor allow focus student mental health,Y
fake news try control narrative yet will idiot learn free will win every time,N
santa fe high school press conference three a-rated lawmaker something must everything possibl,Y
go q lol larp,Y
q respond anon say qs say anti-q talk go mainstream biggest way,N
survivor santa fe high school shooting throw first pitch,Y
larp snope deepstate cover op always always will bring ground w,Y
friend please reread understand happen - pdt q cbbofotczs,N
it s officially month since santa fe shooting killed classmate teacher s,N
new snope build algorithm track refute q claim false,Y
anon comment- qs say anti-q talk go mainstream biggest way,N
photo santa fe hs shooting survivor honor dak zeke show skill dirks hero celebrity baseball gam,Y
prayer go everyone affect santa fe school shooting something need change kid,N
always know snope fake never feel right -- like infiltrate ev,Y
hey might want actually research real q post instead post make garbage curr,Y
minute-by-minute account shooting awful yet read must resp,Y
link,Y
officially lefttesticular snope try go way discredit htt,N
q post b,N
june th link link,Y
time head know heart just catch read,N
riley garcia sacrifice life santa fe shooting holding block door save femal,Y
anon snope build algo now track refute claim false larp s,Y
ya like q say thing ramp bit just larp lol,N
anon snope build algo now track refute claim false lar,Y
infiltrate now theyre building algorithm find n falsely claim everything,Y
this kim one girl killed school shooting santa fe texas beautiful child now mom,Y
today trenton new jersey person shot mass shooting let count sandyho,N
liberal snope now fact check q theory q say anti-q talk go mainstream biggest,N
im used qdrop - edt https em em sno,Y
snope opinion report conspiracy theory immediately appear santa fe school shooting via,Y
dont listen snope controlled control us research q yourse,N
reference q post,N
point snope prepare algorithm automatically fact check claim likely make,Y
my friend please reread understand happen - pdt q cbbofotczs,N
well least snope come closet declare leftist finally word,Y
riley garcia sacrifice life santa fe shooting holding block door save fem,Y
snope fake news conspiracy theory immediately appear santa fe school shooting via,Y
q snope lie full stop,Y
qs say anti-q talk go mainstream biggest way,N
they us know us theyve know us contain us lie explain us,N
conspiracy theory immediately appear santa fe school shooting,Y
q-team snope come us,N
when person go realize snope cover denier-in-cheif deep state cabal conspiracy theori,Y
qs say anti-q talk go mainstream biggest way ```````````````,N
conspiracy theory immediately appear santa fe school shooting inevitably claim friday morning attack wa,Y
new q watch marker,N
conspiracy theory immediately appear santa fe school shooting inevitably claim friday morning,Y
so shooting may detail article date may th shooting conspiracy theory coin,N
literally sound bitter tried article high comedy picture snidely whip,N
be ready msm come q s come qs say anti-q talk,N
dont listen snope controlled control us research q f,N
q watch happen come life enjoy show,Y
q cbbofotczs id new jun est anonymous id d c new jun,Y
how liberal rag fake news onslaught panic msm come full throttle remember usually,Y
see liar,N
all larp snope deepstate cover op always always will bring,Y
snope build algo now track refute claim false tha,Y
new q qs say anti-q talk go mainstream biggest way snope,N
new q qs say anti-q talk go mainstream biggest way,N
anonymous gt gt qs say anti-q talk go mainstream biggest way gt gt,N
q warn us possibility false flag yesterday hour later dead santa fe school shooting,Y
doctor speaking medium outside hospital santa fe tx victim school shooting take today say,Y
click link,Y
q sun pm qs say anti-q talk go mainstream biggest way,N
officially lefttesticular snope try go way discredit yo,N
post,N
from link,Y
wonder ammosexual will propose alternative common-sense restriction gun ownership now every last,Y
dear texas midterm approach keep mind senator ted cruz vote universal background check th,Y
post anon qs say anti-q talk go mainstream biggest way q respond,N
new q ready new proofs future prove past hide truth discredit source,N
the ds go q beware conspiracy theory immediately appear santa fe school shooting via,Y
just quit teddy stop know run senate do nothing flood victi,Y
everyone functioning brain know snope run leftist trust alread,N
- pdt q cbbofotczs larp sure get lot coverage must t,N
pant fire get can t stop,N
- pdt q cbbofotczs snope build algo now track,Y
they go freak go - edt https em em,Y
attack ramp strong never stop fight,N
snope build algo now track refute claim false q view full,Y
santa fe high school shooting helicopter footage scene enhance via,Y
i add video playlist santa fe high school shooting helicopter footage scene enhance,Y
houston manager j hinch another senseless act violence school feel like there something h,Y
houston manager j hinch strong word regard fridays school shooting santa fe high school say t,Y
pitcher recover gunshot santa fe high school shooting high school news visit,Y
so mom santa fe lose kid shooting sh used gain attention sh like rest,N
i feel like high school student santa fe hs say wasnt surprised school endure shooti,Y
i wish say blow mind oppose safe storage law santa fe shooting,N
report plan high school shoot social medium spy cop,Y
an article post may reveal reader santa fe shooting st mass shooting,N
gov abbott want school counselor tx school scs focus counsele issue have mental health,Y
parkland student response santa fe high school shooting impactful,Y
s absolutely disgusting medium put less attention santa fe shooting bc different view gun l,N
i dont know something playing wow make chew santa fe high school shooting,N
after santa fe shooting still resist idea ordinary terrorist,Y
in case miss gov abbott want put counselor school,Y
art show auction hold santa fe hs shooting victim student teacher organized show auction,Y
due new gun law florida just week man plan mass shooting disney wa,N
don t think realistic enough difficulty breaking fight think can take,N
please remember month since santa fe school shooting cost li,N
remember trump talk w reporter left meet family tragic santa fe school shooting trump,Y
trenton just third largest mass shooting one close parkland santa fe s,N
heartbreaking unbearable news santa fe tx latest community tear apart horrific school shooting,N
pass santa fe high school way back work every morning last school shooting happen one helluva gut check,Y
santa fe shooting trigger rise texas blood donation hour follow school massacre texas,Y
last week school shooting santa fe highschool today school shooting noblesville indiana whi,Y
new,N
santa fe school shooting victim story,Y
jimmy kimmel santa fe shooting,Y
texas one state dont require school counselor fifth highest student-to-couns,N
honestly don t know ll feel pistol prolly kill couple student,Y
remember trump talk w reporter left meet family tragic santa fe school shooting tr,Y
president trump always talk keep american person safe let bad person like ms- cross,N
birmingham alabama benton kentucky santa fe texas parkland florida summer death gunfir,Y
retweet think -year-old santa fe high school shooter dimitrio pagourtzi receive death penalty,Y
andrewujifusa birmingham alabama benton kentucky santa fe texas parkland florida summer,Y
superintendent open general session school safety say santa fe isd,Y
full video santa fe isd board discussion school security,Y
another day another camp appearance thank let stay around camp today san,N
these student first bring hope parkland send star santa fe texas t,Y
pro-gun rally santa fe texas person fatally shot high school last month fail draw large au,N
hundred demand action santa fe isd wake school shooting,Y
birmingham alabama benton kentucky santa fe texas parkland florida summer death g,Y
devastate hear santa fe high school morning heart go affected,Y
independiente santa fe school,Y
want wear parkland msd strong need put work msd strong fight school security,Y
left wks missed school shooting may palmdale california may dixon illinois,Y
mean three month viral santa fe high school shooting,Y
the santa fe high school symphony orchestra perform historic run lnydp,N
grieve terrible loss life send support love everyone affect horrible attack,N
month ago person kill santa fe high school don t forget,N
devastate today s tragic news texas heart go family victim everyone san,N
ok do prevent happen future sandyhook,Y
child dead santa fe murder teen high school parkland baby sandy ho,Y
there facebook group two dedicate santa fe school safety that criticism norman,Y
rhonda hart mother santa fe victim kimberly vaughan tonight s school board meeting say one board m,N
flo rice long road recovery like donate love one start gofundme,N
a pro-gun rally santa fe texas person fatally shot high school last month fail draw,N
santa fe produced something entirely different symbol unity wake differ opinion,Y
michael hendrick family dedicate help other unm law school graduate will fight corruption s,N
pto santa fe online school supply fundraiser rjw kubacak,Y
school train see lot deputy santa fe high school here detail,Y
flag parkland santa fe shooter sit home right now like normal year ol,N
santa fe junior high school supply list,Y
michael hendrick family dedicate help other unm law school graduate will fight corrup,Y
student like santa fe parkland shooter exist school can imagine fall,Y
doesnt fake news go santa fe believe nd amendment seek secure,Y
trump pal autograph picture person massacre la vegas parkland santa fe high school t,Y
today grieve santa fe high school must make school safer child start,Y
superintendent open general session school safety say s,Y
aurora ar- orlando ar- parkland ar- la vegas ar- sandy hook ar- umpqua cc ar- waffl,Y
inspired amount compassion pour community near santa fe high school here art piece c,N
least student shoot killed santa fe high school prepare watch nra boast get hig,Y
i m proud go santa fe high education honestly trash now go college boston,N
remember honor american hero christian riley garcia shot door hold shut,N
killed attack santa fe high school may glenda anne perkin teacher cynthia tisdale teacher kim,Y
suppose illegal alien executed carnage santa fe high school marjory stoneman dougla high school,Y
suppose illegal alien executed carnage santa fe high school marjory stoneman dougla,Y
angelique ramirez student santa fe high school family describe compassionate funny loving old,Y
week education news teacher staff kill parkland santa fe shooting remember national memorial w,N
grieve terrible loss life send support lo,N
special salute tha kid santa fe high school get chop game pop supr,Y
record threat month santa fe school death,N
president say undocumented person crime hmm last time checked school shooter parkland,Y
interviewer part like happen school santa fe high school studen,Y
check santa fe high school annual reprint,Y
look like decent turnout santa fe didnt already know facility santa fe indian schoo,Y
trump pal autograph picture person massacre la vegas parkland santa fe high schoo,N
person gather runge park santa fe saturday discuss ongoing effort make school safer event,Y
the fact person santa fe want arm teacher make sick happen kid can t get,N
school year end here look student-led movement call end gun violence accomplish https,Y
sadly santa fe high school isn t first win t last america s time step fix,N
amen santa fe school texas democrat control schoolboard decide t,Y
oh mean sometimes person freeze stressful situati,Y
the president say undocumented person crime hmm last time checked school shooter parkla,Y
whole day just terrible heart go santa fe whole side family live texas m,N
santa fe high school twenty-eight day ago,Y
santa fe high school student break heart little girl say word,Y
this week education news teacher staff kill parkland santa fe shooting remember natio,N
another school another community devastate gun violence heart go santa fe tx santa fe high school s,N
dozen gather gun rally santa fe find solution school safety,Y
we,N
santa fe businessman plan new medical school,Y
ryan friend d c didnt conversation next week didnt month mo,N
but ryan friend d c didnt conversation next week didnt month,N
angel mothers-family slaughter la vegas msd high school santa fe hs etc,Y
school shooting shooting general shouldnt happen much family child santa,Y
attention high school student still opening blue summer academy session santa fe https,Y
one month ago life cut short santa fe high school continue fight mass shooting shouldn t happ,N
chris paul heartfelt message fan game win chris paul mentioned santa fe high school postga,Y
trump minute santa fe high school yesterday didnt visit school town victim,N
trump imply jacky rosen complicit school shooting call santa fe school shooter wac,Y
attention high school student still opening blue summer academy session santa fe,Y
i left la kid away school spend year live square santa fe kid decid,Y
look like decent turnout santa fe didnt already know facility santa fe indian,Y
another day another camp appearance thank let stay around camp toda,N
like one killed white vegas parkland santa fe high school,Y
mention parkland santa fe school la vegas waffle house aurora theater sandy hook tex,Y
santa fe school shooter parkland shooter just break kid right terrorist,N
felicidade lo graduados del diplomado talento en egade business school campus santa f s parte del cambio s p,Y
felicidade lo graduados del diplomado talento en egade business school campus santa f s parte del cambio s,Y
nope paddock trump supporter parkland shooter trump supp,Y
in santa fe innocent high school kid killed legal resident year,Y
culture top violent country world say stoneman dougla high school dead,Y
guess win t serve arm force student parkland re lucky,Y
la vegas orlando sandy hook elementry sutherland spring church stoneman dougla high school santa fe high sc,Y
welcome home confront santa fe high school shooter nearly die now month healing hospital,Y
required read mom student santa fe hs post story fb reprint w permi,Y
recent school shooting parkland fl santa fe tx high school shooting demonstrate time ripe change,Y
stoneman dougla high school santa fe high school forgotten keep good fight support,Y
stoneman dougla high school santa fe high school forgotten keep good fight suppo,Y
pink andrewpollackfl want wear parkland msd strong need put work ms,N
recent school shooting parkland fl santa fe tx high school shooting demonstrate time ripe ch,Y
wal-mart confirm keep proceed sale strong t-shirt proceed will go charity victim,Y
love hear story everyone who survive inspire me- whether,N
accord texas gov greg abbott santa fe shooter illegally possession revolver shotgun h,Y
santa fe center newton be gemini school look fill open t position next year wan,Y
