indiana beautiful sign say remember care,N
new jersey remember care,N
victim let us remember sabika sheikh ann perkin angelique ramirez shan,Y
im gun owner stand mom demand action gun sense america many regulation,N
like person idaho texas hey tell f,Y
dont want crime country really arent anything m,N
why havent hear effect respond watch story,N
crowd mass killing always call universal background check assault weapon ban magazine limit ammo li,Y
excellent question,Y
i just drive past may y rest peace prayer family victim,N
agoraphobia fear situation escape might diffic,Y
btwn shooting gov class collabd w create p,Y
tell student,Y
btwn shooting government class collabd w create,Y
that exit now want eliminate exit whose dumb ss now o,Y
graduation cartoon e,Y
year ago gunman enter dunblane primary school scotland killing kid teacher uk govt responde,N
student demand action minnesota state capitol final hour legislative session just school safet,Y
dear gop house senate member shooting show way working preserve status quo,Y
minute will show definition hypocrisy please retweet convince one m,N
just don t know say need action,N
kid school dyin via,Y
watch political evening https,N
watch political evening,N
less th month just like every school shooting another story take medium immigra,N
less th month just like every school shooting another story take medium,N
know need martyr like lead elimination,N
wash car pour thank god garage sca,N
- - nra gop vote cure,Y
and shooting congress nothing,Y
it s month since shooting one really talk gun control anymore,N
oh joy state just get big red spot one really ho,Y
know cross play yg playlist loud noon,Y
text brother n funny n say anywho,Y
organize community vigil tomorrow downtown la vegas remember lose gun violence s,N
difficult imagine loss student faculty hand another student impossibl,N
ted cruz say kid kill santa fe today make sacrifice dumb fucking asshole murder s,N
this heartbreaking shot,N
take stupid anymore wall accross place can,Y
school prison kid force go freedom move need cant go bathroom learn,N
take stupid anymore wall accross place y,Y
find dislike half ethnicity today nation,Y
always sign study report school,Y
prayer family impact yet another school shooting near houston santa fe high school the,Y
immigrant nikolas cruz- stephen paddock- dimitrio pagoutzis-,Y
heartbroken occur send prayer student family teacher law en,N
love governor way,N
fact kid killed school year member military kill serve fact,N
analysis deadlier schoolchildren service member,N
today sit one-on-one officer john barnes-the officer take bullet shooting,N
news medium play role feedback loop fuel mass shooting here evidence along su,Y
watch re-dedication today emporia ks add ten name include,N
hrs cop kill another black child shooting,Y
want yet another young black child shot back cop,Y
today sit one-on-one officer john barnes-the officer take bullet sh,N
go year sad afraid,Y
get,N
well get ready spark grill n get dinner,Y
just left pretty irate message rep regard lack action gun control putt gun,Y
watch re-dedication today emporia ks add ten name includi,N
just day ago please,N
total loss get terrify,N
pesky attorney general wa state fight good fight,N
number school shooting country past year england greece netherlands,Y
cause,N
grandmother say memorial day labor day,Y
opinion cousin murder school shooting send kill,Y
im serious every last student teacher administrator walk school go back law,Y
shana fisher kim vaughan sabika sheikh kyle mcleod chris stone christian garcia angelique ramirez jare black cynthia ti,Y
listen,N
well thought prayer work kid santa fe today youve already take hund,Y
please keep comment kind constructive must honor precious soul lose sensele,N
strong black female never ever say straight ticket vot,N
gonna loose little girl s alr,N
sabika chris angelique jare ann shana christian cynthia kimberly aaron,Y
disgusting indeed dont fall lie person,N
need know can consider notice take,N
watch nothing else mass shooting high school texas watch name reportedly p,N
rotten lie bastard re go goddamn thing just like parkland win t eve,Y
love everything want contact,Y
multiple medium outlet blatantly omitted information regard shooter attempt t,Y
heart go victim today s shooting santa fe thought prayer friend,N
longer want see tax return want see ancestry d,N
longer want see tax return want see ance,N
strong strong never cruel dont b c strong,N
funny almost never see kind take tho,Y
geez do ppl day already take,Y
s house meet first daughter,N
please stop talk tweeting b c need know,N
ok time folke bad texas shooting instead inacting real,Y
i find disgraceful liberal medium go dead silent happened simply,Y
jon peltier chargethemoundx listen,Y
believe child emily knapp spring tx twitter thing,Y
november millennial will hear vote futur,N
ted cruz pathetic pawn spout potus rhetoric day day cruz clueless,N
emergency petition thought prayer enough via,N
take anymore just stop really stop right,N
beautiful evening warm moon sliver many star,Y
deeply saddened tragedy m also tire see tweet like often,N
fix problem get us electoral college w,Y
really happy really happy see m,N
escap shooting shouldn t go s school daily lif,N
these person die shoot month ago bet country doesnt even rememb,N
go gun deadly problem especially hand risk high school kid picture say,N
bfs dictator war lord surprise,Y
political evening https,N
month shooting host town hall discuss school safety goal,N
a month shooting host town hall discuss school safety thei,N
friend family thought priest prayer need elect official action need,N
continue whether immigrant lock cage ho,N
send everyone affect santa fe hs shoot month ago today love support u,N
send everyone affect santa fe hs shoot month ago today love support th,N
month person killed shooting leader across texas still work,N
airing now,N
part think s still camp part know s go end g,N
new jersey art festival shooting leave dead injured,N
send thought prayer family affect senseless tragedy santa fe high school,Y
tomorrow mark one month since mass shooting watch morning hear,N
can teach count kid can math can teach spelling kid can read write can teach coding kid ca,N
gun confiscation bill,Y
last week follow shooting walk another moment silence floor hous,N
bible verse t-shirt santa fe texas church service attend today truly,Y
here much federal lawmaker represent student receive rep run,N
i still want know s do w,Y
blessing send friend family affect sante fe texas shooting,Y
loved hearing want know support,N
everyone please vote santa fe survivor shot head still play b,N
may almost year columbine high shooting santa fe high daughter die really nee,Y
teen used parent gun crime can mom dad charge,Y
to victim friend family santa fe school shooting haven t forgotten anti-,Y
last night santa fe school district board hold first regular meeting since school shooting kill person,Y
trump re go little fun today thank much hes meeting family santa fe school shoo,Y
everyone please vote santa fe survivor shot head still p,N
teenage ambassador sabika leave two country gloom one among student lose life shooting rampage,Y
kys interim chief say school resource officer can form relationship student adult cant see sro,Y
kys interim chief say school resource officer can form relationship student adult cant se,Y
news-leader autopsy will determine whether santa fe shooting victim kill cross fire,Y
great offer msd student attend conference free hope can offer s,Y
last night santa fe school district board hold first regular meeting since school shooting kill p,Y
santa fe parent express frustration safety first board meeting since school shooting,Y
uh look dont know that fascism mean dont wish harm actually thoug,N
the santa fe isd school district consider spending close part high schoo,Y
santa fe school shooting survivor testify proposed state gun bill yesterday,Y
yesterday officer barne released hospital shot santa fe shooting come home,N
parent santa fe shooting victim weigh campus safety plan,Y
santa fe high school shooting victim mom rail gun classroom,Y
alone know many person affected shooting santa,Y
florida high school student emma gonzalez show moral courage gop nra put together retweet,Y
armed trump supporter near school shooting spark outrage,Y
today person poll support red flag gun law recommend governor abbott follow,Y
after santa fe shooting gov greg abbott want put counselor school educator say s enough,Y
today person poll support red flag gun law recommend governor abbott follow san,Y
teenager whose friend kill santa fe shooting testify red flag law today ter,Y
the santa fe school shooting limit assault weapon ban vox,Y
congress ted cruz s staff didn t know santa fe high school shooting think politician can learn,Y
parent just lose child think putt gun school like fighting fire gasoline,Y
like talk toddler -- mother santa fe high school shooting victim say trump meeting wi,N
santa fe shooting survivor get person believe nd amendment complete ass,Y
oliver north president retired marine convict iran contra scandal man give sultan brun,Y
shoot victim weigh campus plan,Y
know automatic gun illegal semi auto weapon talk ab,N
santa fe high school nd school shooting st mass shooting america year m,Y
deeply saddened hear shooting santa fe high school texas please join us pray peac,N
go w office tell staff santa fe high school response cool,Y
comedian jon stewart dave chapelle take time tour meet survivor santa fe high school shooting h,Y
boston bombing dead sandy hook school dead la vegas shooting dead santa,Y
rip innocent kid santa fe high school s sad s happen none scared life,N
heart go family friend lose santa fe shooting close home,N
multiple person dead santa fe texas high school shooting two law enforcement source say follow update,Y
don t mean compare s almost many shot santa fe shooting parkland shooting combine,N
book survive school shooting base interview school shooting survivor,Y
statement shooting santa fe high school,Y
may almost year columbine high shooting santa fe high daughter die,Y
fire santa fe high school daughter call say love one mom whose daughter miraculously survive,Y
i support,N
weigh campus plan jun pm et,Y
under fire santa fe high school daughter call say love one mom whose daughter miraculously sur,Y
doesnt add santa fe shooting victim mom rail idea place gun teacher hand,N
since santa fe high struck bullet hope okay follow shooting,Y
yeah guy much worse white mass shooter guess nigerian g,Y
high mom rail classroom jun pm et,N
this teenager whose friend kill santa fe shooting testify red flag law today wa,Y
packed house santa fe isds board meeting tonight first regular meeting since may shoot,Y
teenage survivor santa fe mass shooting tell harassment intimidation gun-toting adult,Y
at rally promote arming teacher held santa fe tx site may school shooting kill texas talk ra,N
its packed house santa fe isds board meeting tonight first regular meeting since may shooti,Y
mercede stone sister chris kill santa fe shooting now testify support upping responsib,N
i talk sunday s talk santa fe high school life follow shooting see,N
parent locked gun brother might still today family member,Y
santa fe shooting gov greg abbott want put counselor school educator say s enough https,Y
state d c pass child-access prevention law legislation make crime parent reck,Y
texas governor cancel shotgun giveaway santa fe school shoot governor texas abruptly cancele c,Y
well say other listen really listen jimmy kimmel santa fe,Y
mercede stone sister chris kill santa fe shooting now testify support upping r,N
testify now mercede stone brother chris stone kill santa fe mass shooting may,N
well ya go hope avail ne,Y
next original date oig report mean release may th right around time,N
damn man close school shooting santa fe live mins away shit hit home hard,N
sure nice right much worse think th,Y
justin timberlake paid visit one injured survivor santa fe high school shooting,Y
time talk la vegas mass shooting yet parkland san,N
thought prayer go everyone affect santa fe shooting s sad kid fear life,N
i don t mean compare s almost many shot santa fe shooting parkland shooting combine,N
ice cube gift single mother child kid affect santa fe high scho,N
break new theory just emerge regard horrific shooting santa fe gunman act alone,N
i like video santa fe high school shooting suspect yell surprise opening fire,Y
proud rsvp director ritchie adoue meeting talk work rsvp vol ar,N
the santa fe high school mass shooting texas last month left dead th incident,Y
mother santa fe high school-shooting victim meeting trump like talk toddler can t make stuff,N
my santa fe shooting survivor hero son want see day brithday houston hope can get ban,N
lesson ve learn need us mute noise interest open honest pragmatic d,N
if teen used parent gun crime can mom dad charge,Y
another devastate school shooting community endure still learn fact thought,N
may th shooting santa fe high school leave dead may th royal wedding entire,Y
usa today network feature armoured one scott hare security expert discuss texas lt gov dan patrick comme,Y
perhaps young david illuminate us ubc prevent parkland shooting,Y
perhaps young david illuminate us ubc prevent parkland s,N
today school shooting santa fe high school tx th shooting incident elementary school high school unive,Y
parkland shooting- slaughter santa fe high school texas slaughter waffle house shooting- slaug,Y
think openly carry firearm street community just home horrible senseless tragedy,N
open carry texas group racist gun extremist protested rep jackson lee eating fry chicken outside,N
parkland father rip mcconnell ryan texas shooting spine,Y
santa fe high school shooting texas least th santa fe least,Y
offend maybe support trump twitter la vegas killed pa,N
s one month pass hope okay follow mass shooting survi,N
shooting occur see tweet gun control actual remorse victim shooting ve,N
s one month pass hope okay follow mass shooting su,N
know hasn t last time say,N
gun school,Y
never say shooting santa fe stage say s similarity active shooter drill take place b,N
more gun school,Y
houston police chief address ugly mood america mass shooting santa fe high school wish,Y
mark calendar sunday july th ll playing raise money victim santa fe shooting,N
news drama ice cube gift single mother child kid affect santa,N
i just drive school santa fe shooting break heart,N
bullshit,N
kid must joke lose someone know near santa fe shooting,N
rip kid sadly lose life today santa fe high school s sad think even though,Y
call event carry kid organizer claim way protect kid school mandate texa,Y
heather heyer parkland school shooting la vegas shooting santa fe school shooting waffle hous,Y
view gov mike huckabee tweet contain photo mexican gang member tag tweet nation,N
staff seem odd sen cruz press conference tx g,N
also remember santa fe also gun shooting city get recogniation sympathy prez,Y
in view gov mike huckabee tweet contain photo mexican gang member tag tweet,N
exchange student wv mourn friend kill santa fe shooting --,Y
abc comedian jon stewart dave chapelle take time tour meet survivor santa fe,N
comedian jon stewart dave chapelle take time tour meet survivor santa fe high sch,N
today s shooting santa fe high school happen texas america s gun-friendly state happen despite arm,Y
santa fe texas recent high school mass shooting happen,Y
that insensitive santa fe just tragic shooting arm,Y
texas school shooting suspect s father think bully santa fe texas ap -year-old student accuse,Y
a good use statistic tell story,N
staff seem odd sen cruz press conference wi,N
one speaker hinted student santa fe high recent shooting happen rally sup,Y
justin timberlake surprise texas school shooting survivor hospital,Y
really didn t offer thought prayer santa fe high school shooting victim just say,Y
two biggest comedian past decade take time tour meet survivor santa f,N
really didn t offer thought prayer santa fe high school shooting victim just sa,Y
my book survive school shooting base interview school shooting sur,Y
santa fe senior shut nancy pelosi live cnn town hall face say via,N
president trump texas will meet family member community leader affect tragic,N
true santa fe waffle house shooting etc parkland,Y
comedian take time tour meet survivor santa fe high school,N
play part santa fe high school shooting santa fe tx,Y
there administration santa fe high school shooting washington michigan phony attorney receive,Y
comedian take time tour meet survivor santa fe high sch,N
ve tell child important thing world us let s prove,N
q drop snope build algo now track refute claim false q,Y
congress ted cruz s staff didn t know santa fe high school sho,Y
when congress ted cruz s staff didn t know santa fe high school shooting think politician,Y
santa fe high school nd school shooting america,Y
man allegedly confessed shooting santa fe librarian namb murder case set free judge,Y
all thing nra blame texas school shooting s week since mass shooting santa,N
more gun school texas open-carry group rally near santa fe mass-shooting site,Y
think openly carry firearm street community just home horrible senseless,N
nothing go santa fe high that picture that,N
speak survive santa fe move forward tragedy p,N
santa fe shooting revolver pump action shotgun neither semi automatic,N
can play whataboutism sandy hook pulse columbine vegas parkland santa fe thou,Y
student mckenna bailey help family affected tragedy art read,Y
allow tom fuente say law wont work wake santa fe high school shooting absurd open carry lo,N
the houston police chief address ugly mood america mass shooting santa fe high school wish,Y
think openly carry firearm street community just home horrible senseless traged,N
gun school texas open-carry group rally near santa fe mass-shooting site,Y
santa fe high school shooting texas person kill injured,Y
tomorrow group open carry pro-confederate type go strap visible gun,N
twenty second mass shooting national crisis dont give us thought prayer midterm rati,N
santa fe high school shooting texas person kill injured come,Y
officer wound santa fe shooting talk recovery,N
something add one month santa fe tx high school mass shooting left dead galvest,Y
can t believe ve another school shooting don pedro say entered newsroom one happen,Y
still mexican girl baby pig,N
texas school shooter here know dimitrio pagourtzi suspect santa fe high,Y
thousand attend service exchange student kill santa fe high school shooting via,Y
have trump provide opportunity parent school shooting victim santa fe high school great mill,Y
deepest sympathy prayer victim family member survivor santa fe high school shooting,Y
parent santa fe school shooting,Y
phillip pray family student staff member involved horrific school shooting sant,Y
i like video santa fe high school senior witness aftermath shooting hbo,Y
texas school shooter here know dimitrio pagourtzi suspect santa fe high sch,Y
santa fe school shooting victim,Y
gun school group rally near site,Y
guy say go go houston fun go meet sa,N
i wonder trump autograph picture parkland shooting santa fe shooting trump,N
funny santa fe tx school shooting fall wayside cuz armed school officer st,Y
handful victim crime commit illegal ignore countless victim mass s,N
call event carry kid organizer claim way protect kid school mandate,N
heart already heavy week image traumatize child border hear local story,N
please pray santa fe town long find comfort faith many santa fe past year dra,N
yeah horrible illegal immigrant keep shooting school like parkland santa fe,Y
donald trump go parade family member lose family member white supremacist racist naz,Y
how parent santa fe school shooting,Y
angel family puerto rico flint michigan stoneman dougla santa fe high school pulse nightclub la vegas shooting sandy hook aurora,Y
brought family white house,Y
parkland la vegas orlando nightclub virginia tech sandy hook sutherland spring church fort hood washing,Y
fact meet family school shooting,Y
exactly family victim crime white nationalist c,Y
when donald trump go parade family member lose family member white supremacist racist,Y
donny family permanently separated love one shoot,Y
trump ignore family la vegas orlando virginia tech sandy hook sutherland spring stoneman dougla,Y
trump ignore family la vegas orlando virginia tech sandy hook sutherland spring stone,Y
another hero brave congressional person play audio take sante f,Y
talk moral,N
officer wound texas high school shooting head home officer john barne along officer gary forward rushed t,Y
officer wound texas high school shooting head home officer john barne along officer gary forward,Y
after texas high school shooting community grieve student return santa fe high school collect th,Y
after texas high school shooting community grieve student return santa fe h,Y
hogg smh hopefully tn shooter father will federally prosecut,Y
april vehicle run toronto dead injured day waffle house shooting antioch tennessee,Y
heartbreaking moment santa fe high school student ask thought shooting happen school,Y
support plan ci campuse full-time dedicate provide mental health service,Y
mean target shooting kind land manage taos area office include area blm htt,N
this mean target shooting kind land manage taos area office include area b,N
man show shooting scene pistol trump cap via,Y
more gun school group rally near site,Y
polouse unrelated threat santa fe school shooting,Y
san antonio base hate group will match santa fe wake mass shooting,Y
red flag law allow local official take gun away person judge declare danger will texas pass,N
one speaker hinted student santa fe high recent shooting happen rally,Y
everyone forgotten santa fe tx school shooting course since stude,Y
tomorrow group open carry pro-confederate type go strap visible gun fo,N
gun school texas open-carry group rally near santa fe mass-shooting site openly carry firearm,Y
officer hurt santa fe high shooting release hospital,N
more gun school texas open-carry group rally near santa fe mass-shooting site via,Y
it month since santa fe school shooting month since parkland silence deaf,Y
more gun school texas open-carry group rally near santa fe mass-shooting site openly carry firearm t,Y
fortunate spend day many great texan standing speak critical time,Y
nasro glad learn texas school resource officer return home continue wish full recov,N
rarely msm report hero sacrifice protect other mass shooting christian riley ga,Y
kid shot dead least eight person -- many -- killed santa fe high school shooting,N
active shooting santa fe high school texas police released photo suspect shoote,Y
left moved agenda push santa fe highschool shooting,Y
left moved agenda push santa fe highschool shooting becaus,Y
good news report,N
lady apparently call strong one just win t shut wen,N
come together student line street outside santa fe hs show support return cam,Y
law propose prohibit person gun judge determine th,Y
s month since parkland school shoot month since santa fe nra continue confirm,N
funny santa fe tx school shooting fall wayside cuz armed school officer stop murderer hmm,Y
happened santa fe shooting incident dissapear like fart wind,Y
like say cant keep gun safe person end dead,N
check story many dead father couldnt even keep gun safe,Y
an officer injured santa fe high school shooting kill left hospital meet polic,Y
what happen santa fe shooting incident dissapear like fart wind,Y
law propose prohibit person gun judge determine,Y
no santa fe shooting win t lead stronger gun control,N
dude just show american flag gun santa fe high school kid just murder another scho,Y
-year old santa fe isd police officer among dozen other injured school shooting last month,Y
bree butler survivor recent school shooting santa fe texas come message sen cruz appreci,Y
the -year old santa fe isd police officer among dozen other injured school shooting la,Y
deeply saddened school shooting santa fe texas resulted loss precious life hea,N
trump supporter outside today crime scene santa fe high shooting imagine black man talk polouse like,N
conversation damn hard person term couldnt accept o,N
unite together come tarkington high school flag pole friday may enjoy donut milk pray,Y
re right have canceled vacation plan santa fe shooting weekend,Y
victim homegrown crime just year parkland church shooting,Y
person die school shooting us military year,N
nasro glad learn texas school resource officer return home continue wish fu,N
volunteer weren t invite front door summit school safety santa f,Y
smart gun policy gun can used kill large number unarmed civilian s,N
yesterday officer barne released hospital shot santa fe shooting,N
noticed medium coverage santa fe high school shooting become practically nonexistent,Y
re talk santa fe shooting news wtf talk,Y
april vehicle run toronto dead injured day waffle house shooting antioch tenne,Y
employee support blood drive honor santa fe high school shooting victim katy news,Y
after santa fe greg abbott want counselor texas school enough texas tribune,Y
person care much ten innocent life lose santa fe hs shooting,N
locate manvel tx mile fro santa fe school shoot good facility,Y
leftover santa fe shooting,Y
if person care much ten innocent life lose santa fe hs shooting,N
santa fe shooting boyfriend go santa fe do,Y
something add one month santa fe tx high school mass shooting left dead,N
santa fe high school receive nine threat prior shooting,N
police record show santa fe high school receive nine threat month lead mass shooting kill,N
police record show santa fe high school receive nine threat month lead mass shooting kil,N
new theory just emerge regard horrific shooting santa fe gunman act alone assist,Y
yep youd think medium gun control crowd repeat anothe,Y
polouse unrelated threat texas school shooting,Y
it s month since parkland school shoot month since santa fe nra continue confirm,N
