school safety continue significant issue citizen many lowv league especially recent,N
aurora dead newton dead san bernardino dead la vegas dead sutherland dead parkland dead p,N
santa fe high school senior shut cnn what matter pelosi cant take heat w,Y
sad truth already forget mass killing santa fe high s,N
i dont think weve fully appreciate fact president donald trump describe santa fe high school shoot,N
sure update yet last night santa fe eagle beat deportivo san lui continue hold f,N
pinangunahan nitong biyerne ni congressman emmanuel madrona ni date congressman eleandro jesus madrona ang pa,Y
week since middle schooler target noblesville teenager slaughter santa fe texas mon,N
it week since middle schooler target noblesville teenager slaughter santa fe,N
my school add fall teacher parkland santa fe other passed accident,N
get fired student santa fe win t let moment pass without move change s,N
if want wear parkland msd strong need put work msd strong fight school security,Y
parent whose kid killed school e santa fe parkland etc permanently separate love,Y
know don t go school policy stupid go santa fe shooter come,Y
prepare career acquire skill necessary job working high school equivale,Y
dont forget kid killed school shooting since remember santa fe high school t,N
neither fan acknowledge family person kill la vegas familie,N
tonight santa fe bandstand black pearl band nine-piece new mexico variety band perform r b old school top,Y
uh top global university patent notable campus art piece undergo cleaning campus community come,N
special salute tha kid santa fe high school get chop game pop,Y
can t find republican doesn t take nra money avoid topic gun control,Y
santa fe institute complex system summer school https,Y
didnt gather parent parkland school massacre santa fe school massacre,Y
parent whose kid killed school e santa fe parkland etc permanently separate,Y
culture top violent country world say stoneman dougla high sc,N
be illegal immigrant kill person la vegas church texas parkland sch,Y
try minute santa fe high school last month,N
at santa fe institute complex system summer school,Y
our latest project kick monday june th san marco high school corner san marco blvd,Y
via romblon news madrona lead inauguration new school building odiongan santa fe,Y
columbine thru santa fe ignore elephant room psychotropic drug problem ve ment,N
dear god kid school reach saturation point gun will never set foot school also park,Y
santa fe school superintendent get contract extension,Y
tonight santa fe bandstand black pearl band nine-piece new mexico variety band perform r b old school,Y
oh texas like santa fe child gun school teacher,Y
not sure update yet last night santa fe eagle beat deportivo san lui continue h,N
oh god first santa fe high school now hell pray tonight american fa,Y
two arm guard roam santa fe school s hall deter shooter engage arm go,Y
s sick since majority santa fe student oppose gun control favor school security measure instead th,Y
nice santa fe train standard old school postcard,Y
shouldnt go school say student santa fe high school texas gunman kill,Y
nice debut freshman team vs santa fe high school,Y
dear god kid school reach saturation point gun will never set foot school also,Y
new santa fe high school gunman killed classmate shana fisher turn advance mother tell,Y
sweetie look republican defend school shooter santa f,Y
tomorrow morning give look safety measure santa fe public school look implement,Y
the taco bell santa fe s remodel suck ruin high school memory smh,Y
know don t go school policy stupid go santa fe shooter cam,Y
talk school redesign project excite santa fe center gemini school,N
santa fe school can come,Y
congratulation unm school law graduate erin mcsherry appointment city attorney santa fe mayor w,Y
get little misty read piece thirty three day get shot santa fe high school officer joh,N
mass shooting u s developed country accord study,N
gcu collaborate city santa fes summer program second year row conduct cla,N
if argentina pass next round will run one lap around santa fe high school naked,N
may family pakistan prepared break fast second day ramadan dearest sabika sheikh,N
santa fe high school happen change fly forever happen hundred time nothing c,N
case isnt abundantly clear medium doesnt care school shooting stopping,N
point be suspect correct get shot m,N
victim santa fe high school m sorry go m sorry nothing happen,Y
let s go santa fe school start back see kathy again,Y
everytime drive santa fe high school get chill bad,Y
update record threat month santa fe school death,N
santa fe nuevo m xico deber apuntarte para el o que entra te encantar esto,N
american family nd amendment welcome pakistani girl student invite us us,Y
santa fe public school push mental health service overall safety forefront board disc,Y
hey teacher friend santa fe center still look fill two positions- th grade ela science dear hea,Y
wound texas school resource officer return home,Y
wound texas school resource officer return home santa fe school resource officer john barne rushed e,Y
rip poor kid santa fe high school gun even exist man s sad cause death destruc,Y
y heart dylan roof charleston church shooter dimitrio pagourtzi santa fe high sc,Y
grow graduate santa fe high school btw,Y
santa fe high school may th,Y
similar bill die quickly quietly legislature time idea come straight f,Y
can coincidental link obvious missed opportunity parkland fl santa fe texas high school sho,Y
last red dirt game ever book senior edmond santa fe high school,Y
may family pakistan prepared break fast second day ramadan dearest sabika sheik,N
get little misty read piece thirty three day get shot santa fe high school,N
santa fe high school stop non sense believe stop fanatus,Y
day america shoot mount zion high school graduation georgia shot santa fe high school texa,Y
i wont forgot school shooting parkland santa fe mass shooting since trump innauguratus,Y
look familiar fonda cause anger hate mask ignorance fear ur hat,N
heart grieve santa fe community devastate shooting santa fe high school tx morning p,N
welcome home confront santa fe high school shooter nearly die now month healing ho,Y
way go santa fe high school,Y
threat month record threat month santa fe school death,N
santa fe catholic high school g javon bell class will back action th,N
record month jun pm et,N
santa fe teen plead guilty felony charge threaten school principal,Y
boy killed kid santa fe wear nazi cross boy approach daughter,N
everyone santa fe mock m s something may understand world go past dog tr,N
prepare career acquire skill necessary job working high sch,Y
our view keep veronica garc job good school,Y
santa fe new mexico school grapple cost security upgrade wake school shooting,Y
and santa fe public school large bond capacity state grant amount just percent,Y
visited santa fe high school morning speak student parent teacher staff present first responder,Y
shooting parkland shooting get attention medium santa fe get almost,Y
hey jamie s article remind santa fe hs texas,N
ummmm let see santa fe indian school run northern tribe new mexico s,N
part like isnt real happen school santa fe student s,Y
register now youth basketball camp santa fe indian school weekend,Y
coordination w school principal santa fe central elem school re school visit info-drive,Y
s chance sema-customize jeep wrangler proceed support santa fe nm early college opportuni,Y
here s chance sema-customize jeep wrangler proceed support santa fe nm early college o,Y
co-founder writing speech importance criminal justice research see brea,N
help raise money santa fe texas high school educational fund money go directly victim fami,Y
have see santa fe parkland newtown columbine s important note t,N
santa fe shooter used ar- u s intense gun control debate right now didnt use,N
santa fe school district will first country adopt new anti-intruder tech,Y
yesterday one month since life take away santa fe high school never,N
death santa fe high school gonna able,Y
sure ok ppl kill like santa fe school,Y
case newtown md santa fe school shooting there question,Y
s pic santa fe isd officer john barne rehab month shot arm school also picture,N
aurora ar- orlando ar- parkland ar- la vegas ar- sandy hook ar- texas church ar- san bernardino,Y
m head santa fe school safety committee will meet first time district announce meeting clos,N
here s pic santa fe isd officer john barne rehab month shot arm school also,N
just drive santa fe high school m cry,N
that santa fe closing meeting stand contrast local school district include clear creek,N
i m head santa fe school safety committee will meet first time district announce meetin,N
you know s even younger high school age kid die marjory stoneman dougla san,N
this jeep wrangler unlimited collaboration sema santa fe early college opportunity aut,Y
graduate santa fe high school beacon hope lone star state,Y
after vbx ask architect learn school safety design since,Y
hey teacher friend santa fe center still look fill two positions- th grade ela science dear,Y
tuesday june morning report santa fe pro-gun rally gop unease family separation uh med school,Y
andria june month ago person kill santa fe high school don t forget,N
danika mcleod -year-old senior santa fe high school whose brother,Y
diego dayer arlequin muse oil canvas argentine painter born beginning art locat,N
here play cue david hogg emma tariq nasheed blame white supremacy black liberal assume shooter w,Y
lie student survivor parkland santa fe school shooti,Y
crucial first step federal funding help santa fe high school community recover applaud secretary devos,N
to everyone santa fe mock m s something may understand world go past th,N
we re talk school shooting just zoom houston see santa fe get hit wall gloom doom,Y
dont miss webinar school safety used federal fund aftermath parkland santa fe,Y
rainbow appear santa fe church victim mourn news van set sunday morning church ser,Y
student journalist ask sarah sander school shooting lot school around country there,Y
notice david hogg everywhere play victim home let sink ride bike mile sc,Y
notice david hogg everywhere play victim home let sink ride bike mile t,Y
serve multiple sentence santa fe school shooter didn t get death sentence neither x,Y
can t forget three opposite look spot team opposite school city,Y
name andrew eyster juco santa fe sante fe mascot saint just like alshon jefferys high school,Y
honor santa fe high school athlete baseball game past weekend thank,Y
raffel go win backyard concert money go family fall victim horrific traged,Y
just arrive sing national anthem original write thing program fo,N
paicularly light sutherland sring massacre texas santa fe school massacre reason,N
job list director advancement santa fe preparatory school,Y
event dr brill congress verde valley june water policy arizona- discussion cla,Y
uh top global university patent notable campus art piece undergo cleaning campus commun,N
immigrant shoot columbine immigrant shoot la vegas immigrant d,Y
co-founder writing speech importance criminal justice research see,N
preview next session school security will number one issue patrick say thousand,Y
will soon prevent viewing accessory move come amidst renew focus gun,Y
one month ago life cut short santa fe high school continue fight mass shooting shoul,N
i raffel go win backyard concert money go family fall victim horrif,Y
will soon prevent viewing accessory move come amidst renew focus,Y
follow santa fe high school massacre know child expendable,Y
nicki read s win m student santa fe need two semester do,N
realize also dad shotgun make shoot high school kid,Y
after santa fe lt gov dan patrick say school security will top priority texas senate,Y
dont answer think young person parent force conversation,N
cb johnathan joseph discussed team support andre hal visit santa fe high school football team,Y
dont answer think young person parent force conversatio,N
follow santa fe high school massacre know child expe,Y
santa fe high school,Y
governor greg abbott security plan response santa fe high school attack include place arm veteran texas,Y
student faculty santa fe high school,Y
month since murder school parkland fl month since murder th,Y
so proud young man know dad just turn graduated high school pay hi,Y
santa fe high school suppo gun control,Y
heart heavy friend santa fe high school tonight spring football game wear green gold rib,Y
student santa fe high school just get shot active shooter drill couple week ago accord,Y
tricia english unum magazine background product development business melbourne school,Y
val roberson ap lang eng edmond santa fe high school,Y
i m glad accepted offer help coach baseball santa fe south high school,Y
ay sorry kahiya nga pala sa school mo taga santa fe integrated school ka nga pala nung elem hahahhahah,Y
aurora ar- orlando ar- parkland ar- la vegas ar- sandy hook ar- umpqua cc ar- waffle house ar- texa,Y
new mexico school district will first country adopt new anti-intruder technology,Y
drive past santa fe high school earlier dreadful experience much bad world much negligence change,N
cb johnathan joseph discussed team support andre hal visit santa fe high school football tea,Y
charge lock used kill hurt,Y
bully shooter victim school shooting parkland shooter wo,Y
wmal discuss santa fe high school attack need do wont work,Y
in aftermath tragic shooting recent one santa fe high school texas marjory cont,Y
small varsity jv semi-final santa fe indian school vs newcomb atrisco jv vs los luna jv,Y
go college campus gun back promote second amendment right,Y
im santa fe tx want small reminder tribute kid teacher lose st period art class,N
be santa fe school shooter mk-ultra-cate deep state plan castrate america must away nd ame,Y
the gunshot get louder panic set texas student know really happen us class recently begu,Y
new middle school principal middle,Y
new middle school principal,Y
new middle school principal middle school,Y
re really santa fe reveal danger substitute teacher era school shooting,N
santa fe center newton be gemini school look fill open t position next year,Y
shooter parkland sandy hook aurora charleston sutherland spring nickel m,N
gun control will prevent school shooting one santa fe hs person die t,Y
join campaign support quest make school safe together can make ch,Y
survivor deserve treatment human deserve treatment,N
santa fe southern,Y
need positivity life come support heal community thursday,N
i honestly can t say enough don t ever wanna hear name person try murder two o,N
no survivor deserve treatment human deserve treatment,N
get learn,N
christopher stone s sister cousin speaking red flag law thank bravery hear,N
thank testimony stand,Y
christopher stone s sister cousin speaking red flag law thank bravery h,Y
missing angel,Y
y many wonderful educator one room,N
yes santa fe,N
thank give us opportunity craft truly special glove,Y
just think s hardest job take mass school shooting th,Y
amazing thank share,Y
always,N
charle mckay story reminder grow city follow passion believe,N
great see reason law enforcement call pastor work hand glove together,N
this great see reason law enforcement call pastor work hand glove togethe,N
alumni santa fe strong benefit july th galveston co fairground need volunteer auction item,Y
hitchcock texas,Y
santa fe strong benefit tbl space city tin cup caddyshack,N
standing,N
turn learn fish life good little human cookies raise money provide trainin,N
boom,N
santa fe heart,N
new day come new strength new thought blessing community today whi,N
great game santa fe great time thankful ask us come,Y
thankful ice cube clyde glide student santa fe come game toda,Y
need chris andersen come say hi santa fe section,Y
i just love picture much change will make,N
give shout kiddos game tonight,Y
deposited check fundraiser santa fe today,Y
join national campaign donate,N
officer save life get shot santa fe hs another officer save day later san,N
finally get go home,Y
city,N
m love,N
know may little hard hear santa fe team show us much strength har,N
grateful stand person love love santa fe,N
re always us,Y
spend past night vbs santa fe love serve lord https,N
spend past night vbs santa fe love serve lord,N
santa fe junior high rocking get learn,N
speak volume man s character mom y strength astound,N
this speak volume man s character mom y strength astound,N
great news wish officer barne full recovery thank sir rush toward danger save s,N
this officer save life get shot santa fe hs another officer save day lat,N
yes name include list middle article terrible waste,N
s month since life take away senseless act violence day go,N
region staff proudly wear shirt today support staff member picture make,N
cry passed school,Y
kid make difference world adult can t get together shouldn t hav,N
s month still haven t forgotten will fight,N
one month ago today thank santa fe student trusting past two day tell y,N
senior year hurricane harvey snow storm intruder lockdown school massacre,Y
santa fe hs football team visit today watch practice signi,Y
honor christian chris sabika angelique shana kim kyle jare cynthia ann action,N
s one month heart break still doesn t feel real send love community toda,N
one month learn true sorrow fear heartbreak learn anger one,N
its month never forget ten innocent soul lose horrific day,N
still doesn t feel real month ago lose great person,N
crazy today rain,N
one month,N
gracious honorary captain star classic football game,Y
honestly stop nobody acting go high school girl actor,Y
region staff proudly wear shirt today support staff member picture,N
it still doesn t feel real month ago lose great person,N
go never forgotten fly high beautiful angle today marked whole month,N
nephew andrew cope grieve loss friend graduated year may,N
one month ago today thank santa fe student trusting past two day tel,N
i miss everything,N
sick tired us now will elect o,N
in one month learn true sorrow fear heartbreak learn anger,N
santa fe really proven strong,N
it s month since horrible tragedy,N
texas republican party platform plank school security,Y
want support make donation santa fe isd education foundation get awesome shirt come,N
it s month since life take away senseless act violence day go wh,N
it s one month heart break still doesn t feel real send love community t,N
very gracious honorary captain star classic football game,Y
want support make donation santa fe isd education foundation get awesome shir,N
support,N
showing support,N
sick tired us now will el,N
one month remain fight,N
its one month remain fight,N
it s month still haven t forgotten will fight,N
help support victim,N
show fun,N
baby cross summer summer job spot summer camp y,N
i go steer show new braunfel weekend friendly person ask proc,Y
begin paris st love yall safe travel,Y
speekle network people platform speekle network speak speekl,N
folk show logical way detect stop violence sort form aware,Y
