Web Split,"Web Split is the perfect companion to your preferred Web browser, especially for Split View and Slide Over users! Or, use it as an extremely simple stand-alone 2nd browser on your iPhone or iPod.

Web Split works with all existing Safari extensions, password managers, etc.

Improve your productivity on your pro devices with Web split today!

Note: Split View is currently only supported on iPad Pro, iPad Air 2 and iPad Mini 4 devices.",[[]],"[['managers', 'iPod', 'extensions', 'iPhone', 'password', 'browser', 'extremely', 'simple', 'stand-alone']]"
Forest Firefighters : Save the trees and Wildlife from Fire - Free Edition,"&#9733;&#9733;&#9733;&#9733;&#9733;TRY OUR FOREST FIREFIGHTERS :SAVE THE TREES AND WILDLIFE FROM FIRE &#9733;&#9733;&#9733;&#9733;&#9733;

A fire started in the forest and animals are trapped inside.
In forest, fire has spread faster with heavy smoke and animals are trying to escape and survive but they are stuck inside.
In this game, you will control forest fire fighters to save the animals who are in danger and try to extinguish trees on fire. Beware of the large flames because they are not easy to control, some of the flames could burn you.
But you have to try your best to save as much animals as possible and make sure they are safe.
The more lives you save the more levels you go up in game. This is the most addictive game ever and you will play for hour and hour.

&#9733;&#9733;&#9733;&#9733;&#9733; DOWNLOAD TODAY FOR FREE >>>  FOREST FIREFIGHTERS :SAVE THE TREES AND WILDLIFE FROM FIRE &#9733;&#9733;&#9733;&#9733;&#9733;","[['game'], ['control', 'flames', 'easy'], ['fighters'], ['started', 'forest'], ['animals'], ['play', 'hour']]","[['go', 'This', 'levels', 'addictive', 'lives', 'save', 'levels'], [], ['fire', 'save', 'animals', 'forest'], ['fire', 'animals', 'control', 'forest', 'fire'], ['heavy', 'save', 'much', 'smoke', 'animals', 'trying', 'escape'], ['ever', 'try', 'extinguish', 'trees']]"
Hotel in Fire Rescue Free – Help firefighter and police save people jumping off the hell tower,"★★★★★ TRY OUR FREE FIREFIGHTER GAME - HOURS OF FUN GUARANTEED ★★★★★ 

A fire a started on the biggest hotel in town, hundred of peoples are trapped inside.

The fire has spread fast and the smoke is intense, people are trying to survive by throwing garbage can, bricks or computer screen at the windows to have a chance to jump free and land on the net the firefighter had put out for them. 

This is a rescue mission, your friends will go inside to extinguish the fire, but you are there to save jumper from a certain death, save them while avoiding debris and everything falling from the building, stick to saving peoples, everything else will break your net.

Save enough people and you'll be able to unlock new items to rescue the jumpers, have a bit of fun while doing you're job in this Rescue Mission and become a hero!","[['windows', 'chance'], ['land'], ['throwing', 'garbage'], ['bricks', 'computer'], ['people'], ['avoiding', 'debris'], ['started', 'biggest'], ['jumper'], ['rescue'], ['fun'], ['building', 'falling'], ['saving', 'peoples']]","[['jump', 'screen'], ['jump', 'net', 'firefighter', 'free', 'else', 'break', 'net'], ['bricks', 'survive'], ['screen', 'garbage'], ['survive', 'trying', 'intense', 'smoke'], ['everything', 'save'], ['fire', 'hotel'], ['fire', 'certain', 'death', 'save'], ['This', 'put', 'jumpers', 'items', 'rescue', 'mission', 'friends'], ['job', ""'re"", 'bit', 'jumpers'], ['everything', 'stick'], ['everything', 'stick', 'town', 'hundred', 'peoples']]"
DISASTER RECOVERY DIRECTORY,"The DISASTER RECOVERY POCKET SOURCE™  is a unique compilation of specialty vendors in thousands of locations throughout North America, divided into hundreds of categories of hard-to-find disaster-recovery help - ranging from “document-drying” to “trauma-counselors,” “emergency computer repair,” “data-destruction,” “planning for pets,” “mobile kitchens,” ""crime-scene cleanup,"" “data recovery,” etc, etc.  
 
Clicking on a provider takes you their website, then you can return to the app.
 
It also includes tutorial sections on “getting started” and “have you forgotten,” covering many commonly-overlooked areas.
 
It is based on over 25 years’ experience in disaster recovery and business continuity with hundreds of clients in every industry by The Systems Audit Group, Inc.  (http://www.disaster-help.com/)","[['repair', 'computer'], ['website', 'takes'], ['vendors', 'specialty'], ['help'], ['categories'], ['pets'], ['cleanup', 'data'], ['disaster', 'recovery'], ['continuity', 'business']]","[['emergency', 'data-destruction', 'trauma-counselors', 'emergency', 'computer'], ['return', 'provider'], ['compilation', 'thousands', 'vendors', 'thousands', 'locations'], ['hard-to-find', 'disaster-recovery', 'ranging', 'document-drying', 'ranging', 'document-drying', 'trauma-counselors'], ['hard-to-find', 'disaster-recovery', 'divided', 'hundreds'], ['mobile', 'kitchens', 'planning', 'data-destruction'], ['recovery', 'crime-scene', 'kitchens', 'crime-scene', 'cleanup'], ['experience', 'business'], ['recovery', 'hundreds', 'continuity', 'hundreds', 'clients']]"
FireFighters Fighting Fire – The 911 Hotel Emergency Fireman and Police free game 3,"TRY OUR FIRE FIGHTERS FIGHTING FIRE – THE 911 EMERGENCY FIREMAN AND POLICE FREE GAME 3

A fire has started on the biggest hotel in town, hundred of peoples are trapped inside.

The fire has spread fast and the smoke is intense, people are trying to survive but the are stuck inside.

While other firefighters are outside rescuing jumpers from death, you decided to go inside to fight the fire and extinguish it !

You are in the hallway, there a lot of smoke and fire, your visibility is still good for now, so take your hose and spread water everywhere, some flames are easy to put out, some other will need a little more time to take out !!

Try to save as much people as possible, kids and adults needs your help, just pick them up to send them to safety.

The more lives you save, the more you'll go up in rank, unlock every firefighter equipment you can and become a hero !

Features:

- New Life System for a longer game experience, each character has his own life points
- 3 New Characters : The Volunteer Firefighters, The Vintage Fire fighters and the Fire Truck
- Putting out Fires give you points
- 3 New Building to save : The School, the Airport and the Hospital

DOWNLOAD TODAY FOR FREE >>> FIRE FIGHTERS FIGHTING FIRE – THE 911 EMERGENCY FIREMAN AND POLICE FREE GAME 3

We would love your comments ! Please send us your feedbacks.
Let us know at: support@infinitedreamfactory.com","[[], ['life', 'character'], ['kids', 'adults'], ['people'], ['started', 'biggest'], ['smoke'], []]","[['death', 'rescuing', 'rank', 'unlock', 'go', 'jumpers'], ['points', 'experience', 'game', 'experience', 'character'], ['needs', 'possible'], ['much', 'kids', 'possible', 'save', 'smoke', 'intense', 'people'], ['fire', 'hotel'], ['fire', 'hallway', 'visibility', 'lot'], ['town', 'hero', 'equipment', 'peoples', 'become', 'hundred']]"
