辣题库-让学习变得有味道,题库设计紧扣最新考试大纲，内容丰富，题量巨大，收录历年考试真题，囊括了目前所有的最新考试题型，并提供专业级的解题思路.,[],[]
La Senda Burgos,La Senda de los Elefantes. Tu plan de ocio en Burgos. ¿Qué hacer? ¿Dónde ir?. Disfruta y vive la ciudad.,[],[]
Segui La Terapia,Segui La Terapia è un'applicazione di notifica via voce e messaggi di testo sviluppato per aiutare i pazienti durante la loro terapia medica.,"[['e', 'messaggi'], ['testo', 'di']]","[['voce', 'di'], ['messaggi', 'sviluppato']]"
Wanda Rolon,"Bienvenido a nuestra Aplicación Oficial de Wanda Rolón  y Wanda Rolon Ministries. Mantente conectado con nuestra emisora de rádio ""Senda Radio Station"", Servicios pasados y ""En Vivos"", devocionales, eventos y todos los recursos de la Pastora Wanda Rolón. También puedes hacer tu aportación en la sección de ""sembrar"". Fotos y mucho más.

*This isn't related to beacon monitoring, and is only used for location monitoring.
**Continued use of GPS running in the background can dramatically decrease battery life.","[['battery', 'decrease'], ['hacer', 'tu'], []]","[['life', 'dramatically'], ['puedes', 'aportaci', 'n', 'puedes', 'hacer'], ['emisora', 'used', 'monitoring', 'nuestra', 'location', 'con']]"
