Body,"[0.0, 0.0]","[0.0, 1.0, 0.0]",2
"Love the concept and pc client is good, but android app keeps repeating messages sent, loosing connection, not showing a message which you can see on a lockscreen or top bar for ages and makes it seemingly load again in the app also joining channels doesn't always work. Thanks for the reply but alas it's not the case, I have used it and experienced the same across 3 different phones and it still happens across numerous wifi and cellular data connections. Would love to help in any way I can though :)","[0.3, 0.6022727272727273]","[0.192, 0.753, 0.055]",1
"You should be able to put your birthday, your mood, and a description on your profile. Also the leader of the group chat should NOT be able to change everyone else's names.","[0.5, 0.625]","[0.0, 1.0, 0.0]",3
Met a lot of people here. Worth a try,"[0.3, 0.1]","[0.241, 0.759, 0.0]",3
"I am enjoying this app, however the sound is really laggy and distorted sometimes. I don't know if it's too many people online or my connection. Or if it's the server.","[0.4, 0.425]","[0.102, 0.809, 0.089]",3
Doesn't always let me sign in and has crashed a few times,"[-0.2, 0.1]","[0.0, 1.0, 0.0]",1
Best chat app...I use it on my computer to chat while playing online...way better than using skype,"[0.75, 0.4]","[0.389, 0.611, 0.0]",3
But please give users the ability to edit the game they are playing manually on mobile like you can on pc,"[-0.4, 0.4]","[0.344, 0.656, 0.0]",1
its super cool and an easy way to text with friends its just awesome!,"[0.5291666666666667, 0.7875]","[0.648, 0.352, 0.0]",3
My boy and homie imdavisss brought me here this is a great app for gamers to get in contact with each other,"[0.3375, 0.5625]","[0.17, 0.83, 0.0]",3
"Random crashes, the ability to fully manage a server on the Android app still isn't a thing, random bugs, and the fact that there still isn't video calling makes this a downgrade of Skype in some ways. In my opinion the majority of people aren't going to just ""ditch Skype"" because in many ways there's no point unless it's for larger groups of people. Having to friend request people that you previously shared a group with just to pm them is dumb. And why can't people with ""manage roles"" edit their own role?","[-0.06309523809523808, 0.5238095238095238]","[0.081, 0.862, 0.056]",1
So nice,"[0.6, 1.0]","[0.756, 0.244, 0.0]",3
"Finally! Discord is awesome, I just wish I had heard about it sooner. Perfect especially for when I'm at my PC with no mic - just pop open the mobile app and away we go. Web browser support has many advantages as well! Keep it up!","[0.4635416666666667, 0.8333333333333334]","[0.319, 0.598, 0.084]",2
What the heck?,"[0.0, 0.0]","[0.0, 1.0, 0.0]",2
Its great all it needs are server settings snd its awesome.,"[0.9, 0.875]","[0.477, 0.523, 0.0]",1
Worthy of 5 🌟🌟,"[0.3333333333333333, 1.0]","[0.592, 0.408, 0.0]",-1
Why can't I connect it to twitch?,"[0.0, 0.0]","[0.0, 1.0, 0.0]",1
Server settings are not available,"[-0.2, 0.4]","[0.0, 1.0, 0.0]",1
Great competitor for team speak. It's android version is unbeatable. Gamers will love it,"[0.65, 0.675]","[0.409, 0.591, 0.0]",3
Very good...,"[0.9099999999999999, 0.7800000000000001]","[0.0, 1.0, 0.0]",3
"Sometimes I get bugs, but other than that it's my go to for in chat gaming. A way to bring friends together and just feel lthe synergy. The connection is awesome","[0.4375, 0.6875]","[0.266, 0.734, 0.0]",1
About time it supported server specific nicknames.,"[0.0, 0.125]","[0.277, 0.723, 0.0]",2
This is better than Skype,"[0.5, 0.5]","[0.42, 0.58, 0.0]",1
Easy to use and learn. Better quality. A lot better than Skype.,"[0.4777777777777778, 0.6111111111111112]","[0.521, 0.479, 0.0]",2
Amazing!,"[0.7500000000000001, 0.9]","[1.0, 0.0, 0.0]",4
Helps me stay connected with my guildmates.,"[0.0, 0.0]","[0.302, 0.698, 0.0]",2
"Love the design and functionality. Would appreciate if it could mute background sound when I speak, not just the other side.","[0.25833333333333336, 0.4583333333333333]","[0.277, 0.723, 0.0]",2
Love it.,"[0.5, 0.6]","[0.808, 0.192, 0.0]",3
"My clan uses this app for Clash of Clans and it is so helpful being able to use this for war calls, strategies, and getting to know my clanmates. Great job!","[0.75, 0.6875]","[0.201, 0.702, 0.098]",1
Works better than skype and team speak!,"[0.625, 0.5]","[0.347, 0.653, 0.0]",3
Can't manage server's settings yet it's a big turn off.,"[0.0, 0.1]","[0.0, 1.0, 0.0]",1
This app is the best. Great quality when you talk to friends. I really prefer this than skype,"[0.6666666666666666, 0.4166666666666667]","[0.449, 0.551, 0.0]",3
Such a hassle to go on pc just to edit roles and such :(,"[-0.25, 0.6666666666666666]","[0.0, 0.805, 0.195]",2
Its not working ever since update keeps disconnecting from chat,"[0.0, 0.0]","[0.0, 1.0, 0.0]",2
"Me and a friend tried to connect to each other using the app,  but despite then sending me friend requests, and me sending them back, neither of us got anything,  and my Direct messages doesn't work,  when I go into it,  nothing shows up.  I've tried reinstalling the app,  but it didn't work.","[-0.008333333333333331, 0.25833333333333336]","[0.116, 0.884, 0.0]",1
I was able to talk with my friends anytime i wanted.,"[0.5, 0.625]","[0.279, 0.721, 0.0]",3
Just pure awesome,"[0.6071428571428571, 0.75]","[0.672, 0.328, 0.0]",3
This app is fully loaded and filled with useful features. It also has a PC variant and one for friends on iOS. Great interface and VOIP.,"[0.5, 0.5499999999999999]","[0.315, 0.685, 0.0]",2
Mikor nem vagyok gépközelben láthatom ki van fent,"[0.0, 0.0]","[0.0, 1.0, 0.0]",-1
"I don't know how I survived without it. Great way to stay updated with your friends, or chat while in-game. Just wish it had things from pc version, such as the ability to to modify nicknames.","[0.4, 0.625]","[0.188, 0.673, 0.139]",1
Needs separate notifications for when someone mentions you.,"[0.0, 0.0]","[0.0, 1.0, 0.0]",1
Made my own group and now me and my friends can play and talk with is awesome,"[0.8, 1.0]","[0.407, 0.593, 0.0]",3
This app also has a pc version of it...So easy to create server..,"[0.43333333333333335, 0.8333333333333334]","[0.333, 0.667, 0.0]",3
it's a ready good gaming chat app!! And I really recommend it,"[0.4666666666666666, 0.43333333333333335]","[0.556, 0.444, 0.0]",2
It gave me no directions when i first installed it and i had no were to go although i have heard good things about it i don't understand. Fix it and i might reinstall it.,"[0.475, 0.4666666666666667]","[0.085, 0.787, 0.128]",1
I am randomly disconnecting from voice chat while playing games can you help me,"[-0.5, 0.5]","[0.29, 0.71, 0.0]",1
Thanks for making discord I made so my friends thanks,"[0.2, 0.2]","[0.551, 0.292, 0.158]",3
Met all my new friends here!,"[0.17045454545454544, 0.45454545454545453]","[0.404, 0.596, 0.0]",3
Best thing to use. No Skype.  No curse. No AIM. Use this instead,"[1.0, 0.3]","[0.188, 0.359, 0.453]",3
Just like the title says,"[0.0, 0.0]","[0.385, 0.615, 0.0]",2
Can post lewd stuff,"[0.0, 0.0]","[0.0, 1.0, 0.0]",2
It starts acting weird if you use it for a long time,"[-0.18333333333333335, 0.4666666666666666]","[0.0, 0.855, 0.145]",1
"Edge swipe is really difficult to use and makes it frustrating to use regularly.  Other than that, the mobile app always seems to be playing catch-up with the web browser and pc apps.  It works, though.","[-0.3416666666666666, 0.7583333333333333]","[0.044, 0.815, 0.141]",1
"Better then TeamSpeak, Skype and more!","[0.5625, 0.5]","[0.39, 0.61, 0.0]",3
Loving Discord so far. I hope a video call option would come soon.,"[0.35, 0.975]","[0.398, 0.45, 0.152]",2
"I liked the app when I had it on my nextbook tablet, so I thought I'd add it onto my older mobile device. Unfortunately it refuses to open so I can sign in.","[0.06666666666666665, 0.6583333333333333]","[0.087, 0.839, 0.075]",3
It just works,"[0.0, 0.0]","[0.0, 1.0, 0.0]",3
I was highly skeptical of this app at first. And i admit they really need to make the UI and navigating the app more user friendly. If it wasn't for my friends I would have uninstalled it the day I installed it. But now I absolutely love this app and being able to chat with my gaming friends ALL day is so awesome!!,"[0.353125, 0.5322916666666666]","[0.21, 0.686, 0.104]",1
Well made app.,"[0.0, 0.0]","[0.512, 0.488, 0.0]",2
Epic as heck I use it every day and gr8 communication,"[0.1, 0.4]","[0.291, 0.709, 0.0]",3
Booyah,"[0.0, 0.0]","[0.0, 1.0, 0.0]",2
it won't upload pictures on the model app but work well on everything else so far,"[0.1, 1.0]","[0.15, 0.85, 0.0]",3
"Once the developers add channel and server management on mobile, I'll give 5 stars. It would also be nice if they added proper Android Wear support. Otherwise, great app!","[0.5333333333333333, 0.6166666666666667]","[0.284, 0.716, 0.0]",3
I saw this post on Facebook well I was checking out discord and it said something about.....a rainbow color for roles and then an alternating color role where it goes red yellow green blue or something. I think that's an excellent idea. Also what if you could get a color code plug-in / update where you can do [(hex code)] (text) [(same hex)] I think it would be good for making text stand out when people are  spamming. But only high commanding roles can use it.  Like there would be a box that says enable hex,"[0.18444444444444444, 0.4072222222222222]","[0.112, 0.83, 0.058]",1
Hands down the smoothest and most feature rich. And free!,"[0.30486111111111114, 0.5847222222222223]","[0.483, 0.517, 0.0]",3
"""Manage server settings is coming soon"" its been months","[0.0, 0.0]","[0.0, 1.0, 0.0]",1
Seriously every other viop doesn't even compare. Skype is a poor excuse for a medium... honestly using Skype was like the caveman days of talking to your friends on voice. New Teamspeak and Curse.... no pls. There really is no alternative. Plus it works well on phone as well,"[-0.03885281385281387, 0.4637445887445888]","[0.254, 0.594, 0.152]",1
please. for android. THANK YOU FOR RESPONDING :),"[0.5, 1.0]","[0.631, 0.369, 0.0]",3
It says Android SDK doesnt support the discord. Android 4.3 jellybean,"[0.0, 0.0]","[0.167, 0.666, 0.167]",1
it keeps glitching and I can't see photos,"[0.0, 0.0]","[0.0, 1.0, 0.0]",3
Its a pretty cool app to use,"[0.3, 0.825]","[0.579, 0.421, 0.0]",3
Loving it,"[0.6, 0.95]","[0.796, 0.204, 0.0]",2
Is cool,"[0.35, 0.65]","[0.697, 0.303, 0.0]",2
I just forgot to check my spam mail^_^ runs perfectly and is surprisingly advanced and bugfree for a beta verison! Keep it up!,"[0.8125, 0.8]","[0.315, 0.597, 0.088]",3
I'm so happy so I can chat with my friends,"[0.8, 1.0]","[0.503, 0.497, 0.0]",3
Love this app,"[0.5, 0.6]","[0.677, 0.323, 0.0]",2
Awesone,"[0.0, 0.0]","[0.0, 1.0, 0.0]",2
Best chat \u0026amp; VoIP client!,"[1.0, 0.3]","[0.529, 0.471, 0.0]",3
Can't send pictures,"[0.0, 0.0]","[0.0, 1.0, 0.0]",2
"App keeps on crashing, still. And with new update i cant send any images/gifs  Im on HTC M9 android Pls fix","[0.13636363636363635, 0.45454545454545453]","[0.064, 0.936, 0.0]",3
I can't see the people on the list of my servers and it just keep saying connecting,"[0.0, 0.0]","[0.0, 1.0, 0.0]",3
Title says it all,"[0.0, 0.0]","[0.0, 1.0, 0.0]",2
"I use Discord often on my PC, and I do like it a lot; but the mobile app is very unstable on the Alcatel Onetouch Idol 3. It crashes roughly every 5-10 minutes.","[0.05, 0.35]","[0.051, 0.787, 0.162]",1
Fantastic app and fantastic devs who listen to their users,"[0.4, 0.9]","[0.474, 0.526, 0.0]",3
Really beautiful and slick app. Also it's completely free. I like it.,"[0.3333333333333333, 0.725]","[0.569, 0.431, 0.0]",3
This app been shirt late Lee wasn't like this before,"[-0.3, 0.6]","[0.0, 0.81, 0.19]",1
can be used mobile AND Pc. I use it to chat with friends and receive messages if they need me via tagging,"[0.0, 0.0]","[0.134, 0.866, 0.0]",1
Great idea. awesome app,"[0.9, 0.875]","[0.804, 0.196, 0.0]",3
"It's very nice. I also have a clan and with Discord, I can chat to the members at any time! The playing ""game"" status is very good! Just 1 thing, I can't connect to Discord while on PC and when I play Call of Duty Black Ops II, it shows playing ""Call of Duty Black ops"" only","[0.20694444444444446, 0.6744444444444445]","[0.207, 0.707, 0.087]",3
Hard to find logout button.,"[-0.2916666666666667, 0.5416666666666666]","[0.0, 0.741, 0.259]",1
Nothing to complain. Over all a very versatile connection app great way to communicate.,"[0.5, 0.525]","[0.233, 0.625, 0.142]",1
It's an awesome app to communicate with fellow teammates on the games you love :),"[0.6666666666666666, 0.8666666666666667]","[0.485, 0.515, 0.0]",3
I can now talk to friends and teammates across the world.,"[0.0, 0.0]","[0.256, 0.744, 0.0]",3
"I use this to play online games, and table top rpgs online. You can make a new server or multiple channels on that server with just a click of a button. You can add people who don't even have the program with a web link and it works for everything PC or mobile devices. Low PC resource cost, and zero cost to your wallet. GET IT!","[0.1590909090909091, 0.31363636363636366]","[0.07, 0.898, 0.033]",3
"Need a way to view profile/avatars larger, besides that it is smooth and fast, great notification options, picture loading is fast.","[0.32, 0.5900000000000001]","[0.177, 0.823, 0.0]",3
"You can't set custom games yet on mobile or make video calls yet, but those will come soon enough.","[0.0, 0.5]","[0.0, 1.0, 0.0]",2
Usable,"[0.0, 0.0]","[0.0, 1.0, 0.0]",2
I can talk to people just fine. Suck it Skype,"[0.4166666666666667, 0.5]","[0.154, 0.598, 0.248]",3
Works great.,"[0.8, 0.75]","[0.804, 0.196, 0.0]",3
"I installed this app to chat with my friends for a vacation since my pc was out of use, but it kept disconnection me. At some point it really was getting irritating. (im using the Samsung galaxy s3) if you guys could fix this problem its worth 5 stars. good luck devs!!!!","[0.275, 0.42500000000000004]","[0.206, 0.662, 0.132]",1
discord is easy to use but still misses features available on pc such as server settings.,"[0.2777777777777778, 0.5777777777777778]","[0.102, 0.679, 0.219]",1
I't just awesome,"[1.0, 1.0]","[0.672, 0.328, 0.0]",2
Use it on my pc for my wow guild it's awsome.,"[0.1, 1.0]","[0.275, 0.725, 0.0]",3
Great app,"[0.8, 0.75]","[0.804, 0.196, 0.0]",3
I'm not able to completely navigate the whole app. The upper right corner of the screen is not acceptable on my galaxy s4. I don't know if the problem is on my end since its an older galaxy.,"[0.08373015873015872, 0.3823412698412698]","[0.0, 0.882, 0.118]",1
"The ONLY advantage Skype has on this is video chat.  Otherwise, this beats Teamspeak, Mumble, Ventrilo, anything you can think of.","[0.0, 1.0]","[0.091, 0.909, 0.0]",1
"Currently an odd question though: why is the language option ""English, USA""  and not just ""English"" there is literally no difference in any of the English languages so you might as well not have USA there. Its stupid to rant about but always annoys me when people put USA as if it's any different to UK or other places.","[-0.15595238095238093, 0.3178571428571429]","[0.024, 0.81, 0.166]",1
"Love it, it is awesome, use it to chat all the times!","[0.75, 0.8]","[0.462, 0.538, 0.0]",2
It just works,"[0.0, 0.0]","[0.0, 1.0, 0.0]",3
This is better than TS and Skype! The only problem is no screen share or video chat. But still so good. I dont frequently write reviews but I got this app and thought it was so worth the review. A little weird getting used to tho.,"[0.14821428571428572, 0.5714285714285714]","[0.187, 0.713, 0.1]",4
Good,"[0.7, 0.6000000000000001]","[1.0, 0.0, 0.0]",3
Can't assign roles on the app,"[0.0, 0.0]","[0.0, 1.0, 0.0]",2
But it says my email does not exist.,"[0.0, 0.0]","[0.0, 1.0, 0.0]",1
NICE HAI BOSS,"[0.6, 1.0]","[0.583, 0.417, 0.0]",2
"I love using this to easily communicate with my friends and relatives, it's nice and somewhat simple. Most people are hectic to get this program due to it's layout which takes some getting used to, but it's well worth it.","[0.3154761904761904, 0.5379251700680273]","[0.272, 0.728, 0.0]",4
I try to save a picture but it doesn't show up,"[0.0, 0.0]","[0.208, 0.792, 0.0]",1
Top notch app! Use it for everyone who I game with :),"[0.24166666666666667, 0.6333333333333333]","[0.361, 0.639, 0.0]",3
"It's a very useful app. I would like to see managing server settings soon, but I'm sure that's going to be a big update when it happens.","[0.2966666666666667, 0.3296296296296296]","[0.245, 0.755, 0.0]",1
"It sometimes doesn't have any sound! Have to close the app completely multiple times for it to work! Other than that, it's fine.","[0.19791666666666669, 0.31875]","[0.098, 0.902, 0.0]",1
Pretty good,"[0.475, 0.8]","[1.0, 0.0, 0.0]",3
"Please add English United Kingdom because English, USA is completely different to UK English. Thanks","[0.04, 0.16]","[0.4, 0.6, 0.0]",1
Great app everything is fine if only there is a global chat rather than a ghost chat. Add this to the new update pls thanks ggwp :),"[0.29329004329004327, 0.5577922077922078]","[0.381, 0.552, 0.067]",3
It doesn't have a setting to delete or rename channels. Please add this and I'll give 5 stars :(,"[-0.75, 1.0]","[0.114, 0.743, 0.144]",1
"It's so much better than Skype, Teamspeak, and a whole lot of other programs who claim to be the best, yet aren't. I would trust Discord with my life.","[0.39375, 0.39375]","[0.273, 0.651, 0.076]",3
Julius malema would love this app.,"[0.5, 0.6]","[0.457, 0.543, 0.0]",1
"It's a lot better than Skype and I've showed it to all my friends! But I have one request, can it not show me as offline when I switch the app out? A lot of people complain about it","[0.625, 0.5]","[0.152, 0.751, 0.097]",4
"The flexibility and ease of use of Discord are unmatched and definitely outperform Teamspeak, Ventrillo, Skype and other community chat programs out there.","[-0.0625, 0.4375]","[0.257, 0.608, 0.135]",3
"I only have one complaint. When using a bluetooth keyboard, I would love it if there were an option to make enter send the text instead of dropping to the next line.","[0.05, 0.44999999999999996]","[0.126, 0.808, 0.066]",2
Cool,"[0.35, 0.65]","[1.0, 0.0, 0.0]",3
Issues with my profile pic not showing up after it was changed,"[0.0, 0.0]","[0.0, 1.0, 0.0]",2
Very easy to use very simple,"[0.2816666666666667, 0.7321428571428572]","[0.39, 0.61, 0.0]",3
LOVED IT!,"[0.875, 0.8]","[0.807, 0.193, 0.0]",2
"*//Edit 3* I see that most of the small ideas I had were already on the feedback page. Totally upvoted. Or at least tried to. I'll need some help getting something sorted, but until then. I can firmly say: This is one badass app. (So hyped for server settings on mobile.)","[-0.05, 0.48999999999999994]","[0.037, 0.925, 0.038]",3
this is great I use it every day and night I love this thing so much!!!!!!!!!!!!!!!,"[0.7666666666666666, 0.5166666666666667]","[0.441, 0.559, 0.0]",3
Have zero problems with this app and use it for a ark rp server,"[0.0, 0.0]","[0.0, 0.816, 0.184]",1
Best discord channel,"[1.0, 0.3]","[0.532, 0.127, 0.342]",2
"If you improve it more, it will be the new standard especially for computer games!","[0.1590909090909091, 0.48863636363636365]","[0.186, 0.814, 0.0]",3
10/10,"[0.0, 0.0]","[0.0, 1.0, 0.0]",2
Nice,"[0.6, 1.0]","[1.0, 0.0, 0.0]",2
G R E A T,"[0.0, 0.0]","[0.0, 0.0, 0.0]",2
"I haven't found any bugs, it's easier to use than Skype or TS once you adjust . Only down side is no video calls but that's okay.","[0.11481481481481481, 0.5962962962962963]","[0.124, 0.816, 0.059]",1
"Now, for some time, Discord has been very useful for me to talk with friends and what not. But, about a week ago, a few icons/avatars for some people became the standard one with the little controller thing with eyes. I didn't think much of it until one day almost ALL of the icons were the little controller thing, except for three or four people and two or three of the chatrooms I was in. I've tried everything to fix it, but to no avail. Other than this one problem, I've had almost no difficulties.","[-0.015714285714285712, 0.2392857142857143]","[0.041, 0.827, 0.132]",1
I can no longer talk on voice channel on mobile. Will give five stars if this is fixed.,"[0.1, 0.2]","[0.0, 0.879, 0.121]",1
People can hear me fine on my PC but the app they can barley hear me could use a booster other then that great app,"[0.36388888888888893, 0.5416666666666666]","[0.243, 0.757, 0.0]",2
"It's hard to believe that such an excellent application is free, but this really is the jackpot when it comes to voice chat.","[0.26166666666666666, 0.6083333333333334]","[0.175, 0.778, 0.047]",2
Love to talk to friends when they don't have enough money to buy an actual mic,"[0.16666666666666666, 0.4000000000000001]","[0.343, 0.657, 0.0]",2
"Having to go through menus to switch between different chat sessions, even worse with switching between direct message and ""server"" group chat. The notification icon I've dismissed several times because at a glance it looks exactly as the MOGA app icon. Speaking of notifications, if running the desktop app and mobile app, mobile won't get any notifications unless I shut down the desktop app. Defeats the purpose when I use Discord for casual chatting, have to leave and leave desktop running for updates.","[-0.10079365079365081, 0.42936507936507934]","[0.021, 0.857, 0.122]",1
I got this app b/c I use it on my pc for MC and csgo never failed me I love it and now can see messages and enter voice channels on the go,"[0.375, 0.44999999999999996]","[0.079, 0.822, 0.099]",1
If you need a chat app this is the one to get hands down. Easy to set up and use. Free. Just works. Goodbye ts3.,"[0.22592592592592595, 0.6407407407407407]","[0.22, 0.78, 0.0]",1
"It has so many great features, easy to use, and always connected. Something to get.","[0.5777777777777778, 0.6944444444444445]","[0.359, 0.641, 0.0]",4
ive noticed a number of times when i have dced in so many online games and when i uninstalled my connection got way better i dont reccamend this if u also play mobile online games at the same time,"[0.3333333333333333, 0.375]","[0.176, 0.824, 0.0]",1
great,"[0.8, 0.75]","[1.0, 0.0, 0.0]",4
"I have this on my PC and it's amazing to use for gaming and just general chatting. It's free with no catch. However, I have to say, the mobile version does lack certain features the PC version has (nicknaming, server settings etc.) but it still works.","[0.3160714285714286, 0.6928571428571428]","[0.126, 0.807, 0.067]",3
This goes for computer version and phone version.,"[0.0, 0.0]","[0.0, 1.0, 0.0]",2
Was working fine but began crashing on start after updating to v2.6.1 on my Marshmallow tab. Any updates since then hasn't resolved crash.  Reverted to v2.4.4 and its working. Please fix.,"[0.4166666666666667, 0.5]","[0.201, 0.75, 0.049]",2
Lavit,"[0.0, 0.0]","[0.0, 1.0, 0.0]",2
Love it,"[0.5, 0.6]","[0.808, 0.192, 0.0]",2
"It's hard to put in words. It just feels right. Sound keeps cutting out in voice channels every now and then though. Also, attachments take a bit too long to load. My experience has been good besides all that.","[0.07400793650793651, 0.5628968253968254]","[0.119, 0.811, 0.069]",1
"Everything was okay before the latest update. After the update, i can no longer see the server icon and player icon(aka profile picture) for whatever reason.","[0.5, 0.7]","[0.07, 0.849, 0.081]",2
Everything is Awesome!!,"[1.0, 1.0]","[0.701, 0.299, 0.0]",1
The best,"[1.0, 0.3]","[0.808, 0.192, 0.0]",3
Please give support for this device and i will give it 5 stars. Keep up the good work :D,"[0.85, 0.8]","[0.479, 0.521, 0.0]",2
When ever I press home button it shuts off!!!! I cant communicate with voice chat any more!!! It shuts down when ever I press my home button!,"[0.3910590277777778, 0.3944444444444445]","[0.0, 1.0, 0.0]",2
"Very sleek and stylish, but I'm experiencing a problem that only happens with my discord app on my phone. Whenever I'm in a voice chat with many people, my app crashes (sometimes the entire phone does). The app works fine with just two people, and it doesn't crash immediately. My phone is relatively new too. Hope you can fix this!","[0.2553030303030303, 0.6256493506493506]","[0.133, 0.764, 0.102]",3
Keeping up with your group in a cool UI. Love this,"[0.425, 0.625]","[0.448, 0.552, 0.0]",3
"Memory conscious, light on old and new phones, push notifications, reliable voice chatting even at 2G speeds, and loading past messages is fully optional. I love Discord so much, I don't regret abandoning Skype, a clunky, unoptimized old IM that heats up my Androids and PCs. Discord is up there with Telegram as my favorite way to chat at home or on the go!","[0.21237373737373738, 0.45606060606060617]","[0.171, 0.749, 0.081]",1
"Love this app, only thing that bugs me is I have to be on PC to do any admin stuff.  Otherwise its a great app. Will add more stars as features are added.","[0.45, 0.7125]","[0.223, 0.777, 0.0]",1
This app is great. I can chat with online creators on roblox all day. Its so addictiving. Thank you guys so much.,"[0.5, 0.475]","[0.266, 0.734, 0.0]",3
"The bot feature is wonderful, especially the cleverbots. I rated 4 stars because sometimes the experience can be a little clumsy, but all around pretty good.","[0.24375, 0.75]","[0.344, 0.656, 0.0]",4
Its amazing Better then everything on this plant except high noon,"[0.42, 0.6466666666666666]","[0.427, 0.573, 0.0]",3
"Unlike Skype, everything just works. I can use the mobile app seamlessly while I'm away from my desktop without any hassle, and all my notifications will appear. I haven't had a single problem using Discord on my desktop, nor my phone so far, and I'm honestly happy to have done away with Skype and Facebook, and the drained battery that resulted from both. Highly recommend.","[0.2177142857142857, 0.5708571428571428]","[0.161, 0.768, 0.071]",3
