Body,"[0.0, 0.0]","[0.0, 1.0, 0.0]",2
So easy to use and it's free! What else do you need?,"[0.4666666666666667, 0.8166666666666667]","[0.404, 0.596, 0.0]",3
"I love the app and using it on PC, but now im just waiting for server customations being allowed on the app so I can keep an eye on everything and make adjustments when im not at my computer!","[0.625, 0.6]","[0.074, 0.926, 0.0]",1
"My main issue currently is that since I updated the app, I haven't been able to upload any attachments at all! Other than that, I love using the mobile app.","[0.2333333333333333, 0.4666666666666667]","[0.209, 0.791, 0.0]",1
"ive been using this a while now, today it logged me off for no reason and wont log back on again. not impressed username and password are correct, it says network error but my internet connection is strong","[-0.022222222222222237, 0.5777777777777778]","[0.104, 0.773, 0.122]",1
Yes if u use gyzo it records and snaps pics and gives u a link. To paste into discord chat directly.,"[0.1, 0.4]","[0.126, 0.748, 0.126]",2
It keeps on saying network error even though I'm connected to internet,"[0.0, 0.0]","[0.0, 0.803, 0.197]",2
Works really well and is a useful alternative to other chats.,"[0.125, 0.19166666666666665]","[0.398, 0.602, 0.0]",3
"Discord had changed the way I game. No more multiple clunky interfaces, just one app / program to rule them all.","[-0.21666666666666667, 0.3]","[0.0, 0.776, 0.224]",2
Great because when you are gaming with your friends u get to talk and say stuff and its just great when talking and hearing,"[0.8, 0.75]","[0.361, 0.639, 0.0]",3
"Great app, but can't handle larger groups in voice chats without lag, stutter, or crashing. Needs streamlining.","[0.4, 0.625]","[0.34, 0.66, 0.0]",3
In multiple ways! Not only is it less resource demanding. But servers are great and it is a much more app AND computer program.,"[0.22666666666666666, 0.46333333333333326]","[0.163, 0.777, 0.06]",2
Good but missing a few vital features as a server owner,"[0.09999999999999998, 0.28750000000000003]","[0.351, 0.443, 0.207]",1
I don't see anything wrong with it. I get to chat/call my Elsword guildies. No problems here.,"[-0.5, 0.9]","[0.131, 0.617, 0.252]",1
Loved it,"[0.7, 0.8]","[0.796, 0.204, 0.0]",3
Needs camera access to load a local image. Bizarre. Also the log out button has no confirmation (and is a really odd icon choice) so you'll likely accidentally log out accidentally.,"[0.05833333333333334, 0.4625]","[0.0, 0.659, 0.341]",1
I'd really like to have access to a custom notification sound and server settings on the mobile app.,"[0.30000000000000004, 0.30000000000000004]","[0.149, 0.851, 0.0]",1
App,"[0.0, 0.0]","[0.0, 1.0, 0.0]",2
Drops connection some times and voice chat is just ok,"[0.5, 0.5]","[0.196, 0.804, 0.0]",1
I love it SO MUCH.. I can finally talk with friends as well as video chat..and meet new people!,"[0.21761363636363634, 0.5636363636363636]","[0.409, 0.591, 0.0]",3
One thing though: when is server management coming?,"[0.0, 0.0]","[0.0, 1.0, 0.0]",1
Meme,"[0.0, 0.0]","[0.0, 1.0, 0.0]",2
I had to come back and edit my comment because they definitely deserve it! I had a problem with my phone issue which I was told to contact an email which I didn't expect a actual person to talk to me about my issue which is one of the most amazing things ever for me but for them to constantly keep me up to date with what's going on is amazing as well! So much respect for the app and team members. (That's why there is so many exclamation marks) wish I could write more but just keep impressing me more.,"[0.32272727272727275, 0.4484848484848485]","[0.229, 0.754, 0.016]",1
Better then skype,"[0.5, 0.5]","[0.592, 0.408, 0.0]",3
"Voice channels are choppy, can't change notification sound, if you try to change certain settings (i.e. profile picture) it resets to default. I'll just stick with GroupMe and have a better experience","[0.22857142857142856, 0.41785714285714287]","[0.147, 0.853, 0.0]",0
"Any plans for these two awesome desktop features to come to mobile as well? We use pins extensively on my server and it's a shame that we can't yet view them on the go. Other than that, keep up the great work!!","[0.46875, 0.6145833333333333]","[0.213, 0.726, 0.061]",1
Good,"[0.7, 0.6000000000000001]","[1.0, 0.0, 0.0]",3
Idk it just feels like it needs something.,"[0.0, 0.0]","[0.253, 0.606, 0.141]",1
Now I can finally have an app to use since my mom said no kik IM FREEE,"[0.0, 1.0]","[0.0, 0.872, 0.128]",2
"While Discord is an amazing service that finally rivals Skype, that statement only works on desktop and browsers. The app is not as well designed, missing numerous features from the desktop client. It works, but I'll have to keep Skype on my phone for quite a while until Discord can update all of their clients and apps together.","[0.08000000000000002, 0.69]","[0.038, 0.828, 0.134]",1
Overall a splendid replacement to team speak and its free solo much better,"[0.43333333333333335, 0.575]","[0.526, 0.474, 0.0]",3
"Love the app, applied to get partnered and everything! But I can't manage my servers on my phone!!!!","[1.0, 0.6]","[0.251, 0.749, 0.0]",2
Easy to use for noobs like me,"[0.43333333333333335, 0.8333333333333334]","[0.519, 0.481, 0.0]",2
The time is glitching so hard hope it will be fixed,"[-0.09583333333333334, 0.37083333333333335]","[0.226, 0.641, 0.133]",3
Clean and fast.  Just need kick member and clear msg option will g8ve 5 stars,"[0.2222222222222222, 0.5611111111111111]","[0.306, 0.694, 0.0]",3
"Just needs tweaks: Online/offline/Do not disturb setting, the font size can't be adjusted on PCver and high res makes the PCver nearly unreadable, can't nickname users who constantly change their usernames (cant tell who is who sometimes esp when they change DPs too??) is there a data cap for the history of the chats too?","[0.08666666666666667, 0.4244444444444444]","[0.05, 0.95, 0.0]",1
Pretty good.,"[0.475, 0.8]","[1.0, 0.0, 0.0]",3
Best chatroom for gamers till date,"[1.0, 0.3]","[0.457, 0.543, 0.0]",2
"Ok first off, this app is great. Almost no complaints with quality. Although i have found a minor problem. When I receive a notification about a message and go to the app, the app seems to have a problem loading new messages. It took about 5 mins to update with new messages, even after I closed and relaunched it multiple times. I don't know if this is just me though. I'm currently using a Samsung Galaxy S7 EDGE.","[0.18585858585858583, 0.3547138047138047]","[0.081, 0.795, 0.125]",3
Excellent dev team. Responsive.,"[1.0, 1.0]","[0.756, 0.244, 0.0]",3
"This app is simple to use, and open to tons of customization through coding. Works very well for group chats. Would give 5 but there is that glitch where a sent message sends itself like 5 times.","[0.06666666666666667, 0.38571428571428573]","[0.134, 0.866, 0.0]",3
"With ***FREE PC/ Mac software, Android/IPhone apps and browser support how can you go wrong?  This is the best IM/ Mic chat service to date...  Very Plush with frequent updates!  I hope yall keep up the great work!","[0.37083333333333335, 0.5583333333333332]","[0.292, 0.645, 0.063]",1
Itz the best,"[1.0, 0.3]","[0.677, 0.323, 0.0]",3
Hate it now,"[-0.8, 0.9]","[0.0, 0.351, 0.649]",1
Nice app to chat qith your freinds,"[0.6, 1.0]","[0.318, 0.682, 0.0]",1
Make the invite easy,"[0.43333333333333335, 0.8333333333333334]","[0.692, 0.308, 0.0]",2
It will delete it but if you open the app back it will still be there,"[0.0, 0.25]","[0.0, 1.0, 0.0]",1
It's great,"[0.8, 0.75]","[0.804, 0.196, 0.0]",3
Best thing since wheel!!!,"[1.0, 0.3]","[0.629, 0.371, 0.0]",3
Best voip service out. Its about time something replaced Skype since Microsoft ruined it,"[1.0, 0.3]","[0.218, 0.622, 0.161]",3
I love this app you can easily find people that are very kind that help you with missions.,"[0.5711111111111111, 0.8111111111111112]","[0.505, 0.495, 0.0]",3
This app requires too many permissions on your phone.  Honestly is there no privacy?,"[0.55, 0.7]","[0.174, 0.698, 0.128]",1
Only thing that's bad.,"[-0.3499999999999999, 0.8333333333333333]","[0.0, 0.462, 0.538]",1
"Definitely better than Skype, Teamspeak, or Mumble. Best features of any voice chat.","[0.75, 0.4]","[0.495, 0.505, 0.0]",2
Simply perfect,"[1.0, 1.0]","[0.787, 0.213, 0.0]",3
Great app. Even more impressed with the community staff on Twitter. If there's ever a problem like a bug... They take every persons comment seriously and work on making their app better. Beautiful interface. Easy to use. Incredible.,"[0.58125, 0.7687499999999999]","[0.378, 0.538, 0.084]",3
"I would like it better if it would introduce you to new people, I guess thus app isn't for that. Edit: Thanks for reply, I didn't know.","[0.2787878787878788, 0.38484848484848483]","[0.283, 0.717, 0.0]",1
"Whenever I go to voice channel, it works sometimes. But after a while, it stops. My friends can't hear me while playing. Everytime this error happens, I keep reinstalling. Pls tell me how to fix it and I'll give you 5 stars.","[0.0, 0.0]","[0.143, 0.759, 0.099]",3
It's starting to get laggy though..Please fix!,"[0.0, 0.1]","[0.0, 1.0, 0.0]",2
Wish I could kick and ban people from the app like I can on the computer that would be awesome!,"[1.0, 1.0]","[0.353, 0.515, 0.132]",1
And it wouldn't open Please fix And I'll give 6 Stars,"[0.0, 0.5]","[0.0, 0.821, 0.179]",1
Kewl,"[0.0, 0.0]","[1.0, 0.0, 0.0]",2
"Great bunch of guys and gals willing to help out. Only used it for 2 days so far and im telling everyone about it. Only thing i will say it its a bit fiddly to get going, or at least i found it was but once your in the group you need to be in your gonna forget any issues you had.","[0.1416666666666667, 0.8166666666666668]","[0.071, 0.891, 0.038]",3
"Great chat apps for anything (not games only). Can be used in any platform (android apps, web browser, windows app)","[0.4, 0.875]","[0.177, 0.823, 0.0]",3
1) no send on enter on bluetooth keyboards 2) when a bot deletes a command they pool at the bottom of chat until the app is closed and reopened  3) code blocks formatting displays incorrectly,"[-0.1, 0.1]","[0.0, 0.883, 0.117]",1
Push notifications don't work,"[0.0, 0.0]","[0.0, 1.0, 0.0]",1
"The app is great. However, it's a bit annoying that because server settings aren't available on the phone app, I can't manage my own server.","[0.09999999999999999, 0.7625]","[0.147, 0.755, 0.097]",3
Hurry up with the server setting manager and you have a 5.,"[0.0, 0.0]","[0.0, 1.0, 0.0]",3
Book lag,"[0.0, 0.0]","[0.0, 0.294, 0.706]",2
Lovely app for everyone,"[0.5, 0.75]","[0.559, 0.441, 0.0]",3
"I first got this on pc yesterday, and the voice is SOOOOOO much clearer than Skype!","[0.25, 0.26666666666666666]","[0.0, 1.0, 0.0]",3
"Better than skype, teamspeak or whatever. I forgot the names after using this...","[0.5, 0.5]","[0.209, 0.791, 0.0]",3
I used Skype to chat with friends for years. Then I found Discord.,"[0.0, 0.0]","[0.209, 0.608, 0.182]",1
Works perfect,"[1.0, 1.0]","[0.787, 0.213, 0.0]",3
"This app was working fine until a couple days ago. Every time I close the app or my screen goes dark I can't hear the call and no one can hear me, but I'm still connected to the server. This is really a great app but it's super annoying to tap the screen every time from getting dark.","[0.07500000000000001, 0.6027777777777777]","[0.192, 0.731, 0.077]",3
I try to speak to my friends on Discord but they tell me I'm very quiet. I have tried different phone's and different headsets but I'm still really quiet. I'd really like this issue to be fixed. But everything else is fine.,"[0.10238095238095239, 0.4095238095238095]","[0.173, 0.786, 0.04]",1
"Add that in please? My voice is being projected really quiet. Also, it's uncomfortable to hold up my tablet in portrait mode.","[-0.25, 0.6666666666666666]","[0.092, 0.803, 0.104]",2
"Quite often messages dont send and i have to tap to retry a lot but, other than that its bloody marvellous. No issues with desktop version either","[-0.4625, 0.6375]","[0.0, 0.776, 0.224]",1
"""Would download again"" 12/10 -IGN","[0.0, 0.0]","[0.0, 1.0, 0.0]",2
Echos endlessly on andriod phone app. Unusable,"[-0.125, 0.75]","[0.0, 1.0, 0.0]",2
Knowing more about people,"[0.5, 0.5]","[0.0, 1.0, 0.0]",2
I absolutely love this app. Ita useful in so many ways. When I have a operation with my arma 3 realism or a training I get tagged and notified on my phone when the ops is starting. Voice and sound is amazing but barely use it on mobile just pc. Love the messaging system and I have no problems whats so ever,"[0.35625, 0.4]","[0.189, 0.718, 0.093]",3
Amazing app.,"[0.6000000000000001, 0.9]","[0.792, 0.208, 0.0]",3
Way better than Skype. My friend showed this to me awhile back and I haven't used Skype sense,"[0.25, 0.25]","[0.289, 0.711, 0.0]",3
Whenever I sent a friend invite to someone it doesn't show up in pending,"[0.0, 0.0]","[0.324, 0.676, 0.0]",1
Great app...new innovation,"[0.8, 0.75]","[0.87, 0.13, 0.0]",3
Anyone who plays minecraft want to be friends?,"[0.0, 0.0]","[0.561, 0.439, 0.0]",2
Its good and all but should add to where admins can kick assign roles ban etc.,"[0.7, 0.6000000000000001]","[0.094, 0.671, 0.235]",3
Friends can't hear me. I tried many different setting including resetting to default. I have a galaxy s7 and would be willing to test apk or beta files to get it working.,"[0.25, 0.6166666666666667]","[0.1, 0.9, 0.0]",2
"I honestly love the app. I run a group and love using it for my members, I do though have the issue of being on the run and need to update something on my server. As you know you haven't created the mobile server settings . I was hoping I could get a estimated time that will come out? Anyways thanks for tbe great app 99% satisfied","[0.5, 0.63]","[0.313, 0.665, 0.023]",3
Nothing else to say,"[0.0, 0.0]","[0.0, 1.0, 0.0]",2
Please make android can do the server setting. My server get raided by spammers and I can only access discord from my phone only. And I cant ban/kick them from my android. Please make the features.,"[0.0, 1.0]","[0.115, 0.752, 0.133]",2
Pretty and functional adaptation of the already great PC program,"[0.525, 0.875]","[0.477, 0.523, 0.0]",3
"Id like there to be a ability to have rainbow tag, and color chat text where u can switch the colors and stuff or set a certain color that will be the color of the text u texted, and what I mean for the rainbow nametag is that there's two different cycles the actual rainbow pattern for ur name and then the other one is where I'd like it to go all red then all green and then all blue... and so on","[-0.05290178571428572, 0.3417410714285714]","[0.113, 0.887, 0.0]",1
It's recently been taking about an hour to update the chat so that it's up to speed on mobile.  This has caused me to have issues communicating while playing games that require the entire screen on the PC.  Often it's been faster to just finish the match or round or to travel to a safe zone then bring up discord app on the computer.  It shouldn't have to be this way and it wasn't always so I hope this gets fixed.,"[0.08, 0.39499999999999996]","[0.098, 0.871, 0.031]",1
This app is beyond revolutionary. This thing can be used as the new email for keeping companies in contact or even customer support. This thing has completely replaced slow unresponsive forums and glitchy skype. I believe this program will be huge in no time. It is not jsut a chat server it is a tool.,"[0.0840909090909091, 0.5386363636363636]","[0.089, 0.872, 0.039]",3
We were subjected to abuse from a member of the Admin. They were present in every chat we made and we couldn't kick them.            Username: Panzzaboi.,"[0.0, 0.0]","[0.0, 0.851, 0.149]",1
Audio is bad,"[-0.6999999999999998, 0.6666666666666666]","[0.0, 0.364, 0.636]",1
Great Helpers,"[0.8, 0.75]","[1.0, 0.0, 0.0]",3
It always say ERROR and i dont like it i try to do the thing you guys ask me but it doesn't work so i rather go to skype and it shows me this //something//hwbzj. So plz fix this becuz ill be happy if you do . thank you discord in my pc and android,"[0.15000000000000002, 1.0]","[0.156, 0.675, 0.169]",1
Does what it does pretty well. New updates are great!,"[0.4621212121212121, 0.7348484848484849]","[0.581, 0.419, 0.0]",3
"I want to be on this app, but I can't sign in!😥","[0.0, 0.0]","[0.138, 0.862, 0.0]",-1
Better than ooVoo and Skype combined.  More options and access to app is easy.  Groups are great.  However t would be nice to add a call feature like Skype where u can just do private calls with one other person.  But I guess that's what group calls are for,"[0.3869047619047619, 0.6190476190476192]","[0.275, 0.725, 0.0]",3
"From some days me and somr of my friends keep on getting kicked from the server automatically. The time is close discord and come back, it happens!  The time I loose my connection for a while,  again it happenes! Its so annoying. Please solve this issue","[-0.2987179487179487, 0.38974358974358975]","[0.141, 0.693, 0.166]",1
Super glitchy if trying to use with Bluetooth audio and when it does work your voice sounds very far away,"[0.23166666666666666, 0.8333333333333333]","[0.17, 0.83, 0.0]",1
Skype kinda blows sometimes and I like push to talk on PC,"[0.0, 0.0]","[0.2, 0.8, 0.0]",2
The voice chat has one serious problem where you end up being unable to hear any audio,"[-0.41666666666666663, 0.5833333333333333]","[0.0, 0.789, 0.211]",1
"Doesn't glitch out, sends things through perfectly and rarely crashes. Would be great if you could send images from gallery though.","[0.7000000000000001, 0.8833333333333333]","[0.304, 0.696, 0.0]",1
"App is good, but too complex for just a party. Modchat is better.","[0.3, 0.5]","[0.51, 0.49, 0.0]",3
"i like the app, alot, but is it possible to have a Google calander integrated into the app? that should make it for gamers/streamers a lot easier to share their streaming agenda to other players😇","[-0.0625, 0.6875]","[0.221, 0.779, 0.0]",-1
"I've using it to connect my fellow gamers, this app is awesome","[1.0, 1.0]","[0.272, 0.728, 0.0]",1
"It's a really good app to use! The only thing is that admins on mobile cant ban or time out, or even edit ranks. Please give admin permissions for mobile","[0.4375, 0.8]","[0.251, 0.749, 0.0]",4
This is going to become better than Skype the next update,"[0.25, 0.25]","[0.225, 0.775, 0.0]",1
Better then skype,"[0.5, 0.5]","[0.592, 0.408, 0.0]",3
It really helps all of my freind and I talk and the voice chat is high quality,"[0.18, 0.37]","[0.162, 0.838, 0.0]",4
"Discord is in my opinion the best app for talking to your friends and your guilds. It has a great UI, is very easy to use and has a ton of awesome features. It simply is the best out there, but I would like to have one more feature on mobile: editing the server settings. If you tap ""edit server settings"" you only get a notification that tells you that it will come soon and I would like to know when I will be able to edit them on the go.","[0.595925925925926, 0.648015873015873]","[0.212, 0.769, 0.019]",3
"This app would be fantastic, but once I put headphones on, the audio from other people come out Through my back phone speaker, instead of my headphones, I tried messing with the settings but I couldn't didn't fix anything, please either fix or help me with this headphone audio problem.","[0.09166666666666667, 0.425]","[0.107, 0.784, 0.109]",0
"Chat doesn't load, I can't disconnect from voice chats. In useable atm,","[0.0, 0.0]","[0.0, 1.0, 0.0]",1
"Easy to use, easy set up, no video chat and ip protection for safety. Makes teamspeak look illy and makes Skype look stupid.","[0.022222222222222254, 0.888888888888889]","[0.267, 0.559, 0.174]",1
I'm always quiet in conversations so I can't use this app when playing with friends.,"[0.0, 0.3333333333333333]","[0.29, 0.71, 0.0]",1
"Superior in every way. No ads which is a huge plus, and better quality sound. All I miss is screen share and video calls, but it's worth it to have something that doesn't crash every five seconds.","[0.45999999999999996, 0.5599999999999999]","[0.298, 0.634, 0.068]",2
"Good app and clear team vioce. But if you play Overwatch I recommend Modchat, which has stronger community","[0.39999999999999997, 0.4916666666666667]","[0.52, 0.48, 0.0]",3
Yer,"[0.0, 0.0]","[0.0, 1.0, 0.0]",2
Love it a lot.,"[0.5, 0.6]","[0.677, 0.323, 0.0]",3
on the mobile version can you put that you can go out the app still talk to them.,"[0.0, 0.0]","[0.0, 1.0, 0.0]",3
Otan paizw lol apla kompoys,"[0.8, 0.7]","[0.412, 0.588, 0.0]",1
Best Gaming Chat Ever,"[1.0, 0.3]","[0.583, 0.417, 0.0]",3
Everytime I open app all I get is a black screen .,"[-0.08333333333333333, 0.4666666666666667]","[0.0, 1.0, 0.0]",1
Lots of options 5/10,"[0.0, 0.0]","[0.0, 1.0, 0.0]",2
"There are many great qualities and would be a 5 🌟 if the sound quality, balancing, and connections could be fixed","[0.45000000000000007, 0.46249999999999997]","[0.186, 0.814, 0.0]",-1
"Very good app, does it's purpose. I just wish it was a little more social, i.e. I could search up a game and find all chats for that game.","[0.07597222222222222, 0.4411111111111112]","[0.204, 0.796, 0.0]",3
Will not recognize my phone as an audio device ....,"[0.0, 0.0]","[0.0, 1.0, 0.0]",1
"I am ao sad that can't host my real own Server :/  I can only choose to let ""my Server"" run in Frankfurt, Amsterdam, London etc... But i want to run it from my own PC! Just like my Minecraft-, Mumble- and Webpage Server!","[0.21749999999999997, 1.0]","[0.081, 0.789, 0.13]",1
"So I downloaded the app and joined the game server and could hear my friends fine in the chat. But once I pressed the home button to go to the game I could no longer hear my friends and vise versa, I tried resintalling and nothint changed, I have a galaxy s7edge if that helps but can someone help me resolve this?","[-0.1277777777777778, 0.43333333333333335]","[0.22, 0.756, 0.025]",1
Very useful,"[0.39, 0.0]","[0.762, 0.238, 0.0]",2
SingLee and ready to MingLee,"[0.2, 0.5]","[0.385, 0.615, 0.0]",2
"NEVER MISS A MEME AGAIN! By far the best VOiP program out there for both mobile and desktops. Great quality, easy access when on the go, and extremely reliable. If you are having any doubts about leaving behind other VOiP programs, stop that now and get Discord™","[0.2404761904761905, 0.7083333333333333]","[0.197, 0.687, 0.116]",-1
I have a minor problem I don't get notification when I am mentioned somewhere and disconected from wifi. But still awesome!,"[0.475, 0.6]","[0.199, 0.679, 0.122]",1
Awesomly epic,"[0.1, 0.4]","[0.0, 1.0, 0.0]",3
"When I have mobile push notifications on, the notif appears for each message instead of just one. I prefer to have it only pop up once so that it doesn't block the top portion of my screen forever.","[0.25, 0.75]","[0.063, 0.895, 0.042]",1
"Well, I can't log in, when I type my gmail account and password it says that the email does not exist. And it worked before, heck it works just fine on my PC","[0.4166666666666667, 0.5]","[0.119, 0.881, 0.0]",1
If it wants to be great it needs a PTT button overlay so I can look at other stuff on my phone and maintain a conversation.,"[0.2916666666666667, 0.4083333333333334]","[0.157, 0.843, 0.0]",1
"This is the best app to use but is way too bugy, sometimes my messages wont load sometkmes it wont let me connect to the voice channel please fix this","[1.0, 0.3]","[0.165, 0.835, 0.0]",1
Dhd,"[0.0, 0.0]","[0.0, 1.0, 0.0]",2
Can't seem to find pinned messages on this app though. I'm sure it will come!,"[0.625, 0.8888888888888888]","[0.156, 0.844, 0.0]",1
"Not just an app, but an all around platform. Me and my friends were finally able to replace Skype with this, and it has almost any feature you could want.","[0.5, 0.625]","[0.167, 0.833, 0.0]",1
Awesome place for us gamer nerds,"[1.0, 1.0]","[0.451, 0.549, 0.0]",3
I have discord on my PC and this app is exactly like it,"[0.25, 0.25]","[0.164, 0.658, 0.178]",1
"It randomly freezes/crashes and has no text moderation, but that's really all it's missing.","[-0.16666666666666666, 0.25]","[0.0, 0.714, 0.286]",1
I'm Incapable of changing my profile picture. After saving the changes I made to my profile everything changes properly except for my profile picture. Update: Bug was fixed with astounding speed. Thank you,"[0.2333333333333333, 0.43333333333333335]","[0.144, 0.786, 0.07]",2
"I am really liking the layout, functionality and the app also syncs perfectly with the desktop version... but quite often when I send a message the app decides to send it multiple times in a row - mostly two, sometimes more.","[0.44000000000000006, 0.44000000000000006]","[0.119, 0.881, 0.0]",3
"it's nice, but it'd be better if we could kick/ban and remove problematic messages on the phone app","[0.55, 0.75]","[0.234, 0.61, 0.157]",2
It is amazing p.s. in not a bot,"[0.6000000000000001, 0.9]","[0.388, 0.612, 0.0]",3
Such a fun way to chat with my gamer pals.,"[0.15, 0.35]","[0.292, 0.708, 0.0]",3
I met so many new friends with this app,"[0.3181818181818182, 0.4772727272727273]","[0.325, 0.675, 0.0]",3
barely worKS and only plays sound through ear piece now no long through speaker. I can't hold my phone to my head while I'm using discord. that's garbage..and yes the option to play through speaker is selected.,"[0.11875000000000001, 0.475]","[0.165, 0.721, 0.114]",1
No problems with the application and great for gaming.,"[0.8, 0.75]","[0.273, 0.4, 0.327]",2
