Body,"[0.0, 0.0]","[0.0, 1.0, 0.0]",2
At no point was I informed by the app that using this app while driving is a bad idea. Now my car is totaled. I DEMAND SATISFACTION,"[-0.6999999999999998, 0.6666666666666666]","[0.115, 0.634, 0.251]",1
It's not detecting location,"[0.0, 0.0]","[0.0, 1.0, 0.0]",1
Nail Salon,"[0.0, 0.0]","[0.0, 1.0, 0.0]",2
This is a great app. Always helps me find great places to eat as I travel the country. Thank you for keeping  the app up to date.,"[0.8, 0.75]","[0.388, 0.612, 0.0]",3
Never disappointed,"[0.375, 0.75]","[0.0, 0.244, 0.756]",1
Most useful app on my phone. Love it!,"[0.47500000000000003, 0.3666666666666667]","[0.562, 0.438, 0.0]",1
I've discovered how helpful user and vendor photos are in deciding whether and what to eat. Also like the ease of use of map view.,"[0.0, 0.0]","[0.262, 0.738, 0.0]",1
There!,"[0.0, 0.0]","[0.0, 1.0, 0.0]",2
Love and use this app all the time. It's not just for food. I use it to find camp grounds and places to visit when I travel. It's a must have on your smart phone,"[0.35714285714285715, 0.6214285714285714]","[0.187, 0.813, 0.0]",3
They are awesome! I have been using them for at least 3 years. I don't have to worry when I call for a pick up. They are always on time.,"[0.35, 0.7]","[0.228, 0.772, 0.0]",3
It is to amazing to explain great app,"[0.7000000000000001, 0.825]","[0.568, 0.432, 0.0]",3
"Honestly i get that they want us to use the app but atleast when someone doesnt have space on their phone, the website should not PUSH people to use the app. Its stupid but this is a reason to kinda hate yelp","[-0.3333333333333333, 0.9333333333333332]","[0.065, 0.744, 0.19]",1
Points you in right direction,"[0.2857142857142857, 0.5357142857142857]","[0.0, 1.0, 0.0]",3
I hate being forced to install an app. Why can't I just read reviews on the mobile site? Why do I have to use your app? I don't appreciate it.,"[-0.55, 0.55]","[0.0, 0.712, 0.288]",1
\u0026amp;lt;3 Yelp. I try to report only the facts and this is a good  place to do so. Also I often plan how to chose an establishment based on reviews,"[0.35, 0.8]","[0.1, 0.9, 0.0]",1
Awesome!,"[1.0, 1.0]","[1.0, 0.0, 0.0]",3
Favorite,"[0.5, 1.0]","[1.0, 0.0, 0.0]",2
Why the hell I can't just utilize the mobile site is beyond me. Stupid.,"[-0.7999999999999999, 1.0]","[0.0, 0.579, 0.421]",1
"This is a great app!  However, the app does not recognize the GPS setting on the Samsung S7 Edge.  It worked on the S6.  Unfortunately, I receive an error stating my GPS setting is off, which it is not.  Google Maps works.","[0.25, 0.875]","[0.088, 0.796, 0.116]",4
Priscilla photography,"[0.0, 0.0]","[0.0, 1.0, 0.0]",2
You know it. It's useful.,"[0.3, 0.0]","[0.42, 0.58, 0.0]",2
They have the freshest food all the time. Salads are crisp \u0026amp; the food is all ways hot. All the people that work there are great / customer serv. Never pass this place up.,"[0.43333333333333335, 0.6722222222222222]","[0.114, 0.886, 0.0]",2
"Lovely clean atmosphere,rwlaxing.  Nice staff, no wait.  Good fill in","[0.5416666666666667, 0.7625000000000001]","[0.629, 0.258, 0.113]",3
All the information I need and the directions to get there.  Helps me make great consumer choices.,"[0.8, 0.75]","[0.324, 0.676, 0.0]",2
One of the best in Coral Gables,"[1.0, 0.3]","[0.412, 0.588, 0.0]",3
Knowledgeable and competent; my carpets look cleaner than I thought possible.. I would recommend this service to anyone looking for high    quality service at a very reasonable price.,"[0.23, 0.7466666666666666]","[0.228, 0.772, 0.0]",3
Was surprised to find some of the restaurants I found thru Yelp offered $ off offers with their Yelp  profile.,"[0.1, 0.45]","[0.101, 0.899, 0.0]",1
It's great!,"[1.0, 0.75]","[0.815, 0.185, 0.0]",3
Useful,"[0.3, 0.0]","[1.0, 0.0, 0.0]",2
"If you pay your fees - you will be 4 or 5 stars, if you dont - 3 or less. Its a game .","[-0.2833333333333333, 0.23333333333333334]","[0.0, 0.92, 0.08]",2
They forced me to download this app and it doesn't even really work. I'm not upset that it doesn't work (perhaps my internet is to blame) as much as I'm upset that they forced me to get it instead of allowing me to use their website. Wasted a good 10 minutes of my life and that's a 10 minutes that I'll never get back.,"[0.04285714285714284, 0.2]","[0.1, 0.773, 0.127]",1
Great information,"[0.8, 0.75]","[0.804, 0.196, 0.0]",3
Yelp is an awesome app I ❤ it,"[1.0, 1.0]","[0.406, 0.594, 0.0]",-1
"I heard about Yelp, but blew it off. If I wanted reviews on a place I just did a search. Until one of my searches had do many reviews on Yelp. I was blown away. The reviews were  (on that place) were ranging from 1 to 3 stars. One person said the smell was horrid the second you opened the door. Another stated the food was good but the vats need cleaned, because that is why the place smelled. (Rambling, sorry) This is one of those apps to have to get honest reviews on business.","[0.25999999999999995, 0.6]","[0.086, 0.866, 0.049]",1
"I literally use Yelp for everything. I've found some delicious treasures thanks to yelp. However, I REALLY wish there was an option to see if a place is dog friendly... like where it says if it's good for kids, if they take reservations, etc. So. They added a ""poke-stop"" option, but still no dog-friendly option.","[0.49499999999999994, 0.5]","[0.208, 0.745, 0.047]",1
Awesome and informative!,"[1.0, 1.0]","[0.687, 0.313, 0.0]",4
Helpful in finding good places to patronize. ...,"[0.7, 0.6000000000000001]","[0.487, 0.513, 0.0]",3
We call him on Saturday and he show up withing 15 minutes.  Very professional.,"[0.13, 0.13]","[0.0, 1.0, 0.0]",1
New relaxed security rules .  Dont pay premium  $480 for seats anymore.  For around a $100 you can stand up at the stage front just feet from your favorite stars without interference from security all day if you want.  I spent 4 days in front row seats looking at nothing but  butts.,"[0.1787878787878788, 0.5181818181818182]","[0.167, 0.81, 0.023]",2
I have some trouble at times with my location. Apparently I am a ninja. I've uninstalled and reinstalled. It works for a bit and then I have to do it again. However it could be my phone. When it's working we have found some really cool places.,"[0.06666666666666665, 0.4000000000000001]","[0.057, 0.883, 0.06]",1
Very helpful,"[0.2, 0.3]","[0.756, 0.244, 0.0]",3
Server,"[0.0, 0.0]","[0.0, 1.0, 0.0]",2
Super helpful,"[0.3333333333333333, 0.6666666666666666]","[1.0, 0.0, 0.0]",2
"Loved the Pommery Shrimp, Dipping the bread in the sauce. OMG! Service amazing, staff, including Jorge the manager and Gina the hostess (with the cool hair), so fun and hip! We will be back!","[0.44000000000000006, 0.51]","[0.325, 0.675, 0.0]",3
"When I'm searching for a business in the mobile browser and try to click a review, the stupid website forces me to view it though the app instead of loading it in the browser. Even worse, when I click to view it in the app, it takes me to the 'open yelp' screen even when the app is already open. I play along and click open, but it doesn't open the review/s. It's enraging. I have to manually select to use the desktop version of the site on my phone if I want to use yelp beyond seeing how many stars there are","[-0.09999999999999999, 0.5857142857142856]","[0.03, 0.88, 0.09]",1
"Food was expensive, small portions, it was hot and service was poor. Dont waste your time or money","[-0.22000000000000003, 0.51]","[0.0, 0.731, 0.269]",1
Just let me use the site. Don't hide reviews. Your app does not work well on my device.,"[0.0, 0.0]","[0.079, 0.828, 0.094]",1
Love it,"[0.5, 0.6]","[0.808, 0.192, 0.0]",2
Auto repair,"[0.0, 0.0]","[0.0, 1.0, 0.0]",2
Post your experiences,"[0.0, 0.0]","[0.0, 1.0, 0.0]",2
"Easy to use, relevant notifications. Love Yelp and this app!","[0.48611111111111116, 0.7777777777777778]","[0.48, 0.52, 0.0]",3
Helpful resource and perceived as user friendly.,"[0.375, 0.5]","[0.545, 0.455, 0.0]",1
"Tells more than one opinion,  like to here the bad with the good","[0.1666666666666667, 0.5888888888888889]","[0.286, 0.529, 0.185]",1
Don't want app but can't read reviews and other info unless you have it.. would just talk up space on my phone but I'd rarely use it.,"[0.0875, 0.6375]","[0.0, 0.959, 0.041]",1
Very difficult to find items I need,"[-0.65, 1.0]","[0.0, 0.642, 0.358]",1
Yelp seems to delete positive reviews unless the business owner pays them to keep the good reviews. Highly unethical and makes the reviews biased and unbalanced. I'm deleting the app and going to Google reviews or Urban Spoon.,"[0.2718181818181818, 0.4213636363636364]","[0.141, 0.736, 0.123]",1
VC,"[0.0, 0.0]","[0.0, 1.0, 0.0]",2
The good to complain about bad service. The bad businesses are able to put fraudulent reviews.,"[-0.04999999999999993, 0.6395833333333333]","[0.109, 0.414, 0.477]",3
Its really really helpful.,"[0.2, 0.2]","[0.529, 0.471, 0.0]",4
Love this app.  Its easy to use and I love reading the other reviews before patronizing a business.  I really do think that one improvement can be made to the app though.  You really shouldn't be forced into giving a business a star if they do not warrant that star at all.  There should be an option to leave 0 stars because some places do deserve it.,"[0.20119047619047617, 0.42976190476190484]","[0.26, 0.723, 0.016]",2
This is an awsome app must get if you travel,"[0.0, 0.0]","[0.0, 1.0, 0.0]",1
Se recomienda muy amables y saben lo que hasen.,"[0.0, 0.0]","[0.0, 1.0, 0.0]",1
I don't always trust the star rating and look at the reviews by date order to figure out quality. It's great that so much information is available to review. Thanks to everyone who participates  :),"[0.41999999999999993, 0.51]","[0.234, 0.703, 0.063]",1
I wish I could just go straight to their website without installing an app,"[0.2, 0.4]","[0.315, 0.685, 0.0]",1
But why isn't there any resent post they are always old post,"[0.1, 0.2]","[0.121, 0.879, 0.0]",1
"I've been going to best nails for years. My experience yesterday was not good,  they were not even running the Soakers. The service was not up to par!","[0.28125, 0.45000000000000007]","[0.137, 0.79, 0.073]",3
Great app if you want to read old reviews from years ago.  Not so much if you want to know how the place is know.,"[0.3666666666666667, 0.3833333333333333]","[0.233, 0.767, 0.0]",3
Always helps us find the good food we're looking for.,"[0.7, 0.6000000000000001]","[0.407, 0.593, 0.0]",3
I love this app it is very helpful,"[0.35, 0.44999999999999996]","[0.593, 0.407, 0.0]",2
"I regularly depend Yelp for assistance in finding nearby restaurants, coffee shops and a variety of services. The reviews are important as to how businesses satisfy customers.  It's my ""go to"" app when I'm on the go.","[0.2, 0.5384615384615384]","[0.127, 0.873, 0.0]",1
"This is a great forum for information to be passed on by consumers about businesses, goods, services, and places.  I am a huge fan of Yelp Check-In Special Offers!","[0.42053571428571435, 0.5553571428571429]","[0.347, 0.653, 0.0]",3
"Fails to recognize my location or zip code consistently, opens slowly and often crashes. Unlike other apps, if you're looking for yelp services you're better off on their mobile site. (Which still sucks, but at least works on Nexus 6 devices)","[-0.11071428571428572, 0.3607142857142857]","[0.046, 0.869, 0.086]",1
This app is a great review app I love reading the reviews about places and I will recommend this app to my family and friends,"[0.65, 0.675]","[0.436, 0.564, 0.0]",3
The best authentic huge taco salad!,"[0.6666666666666666, 0.65]","[0.629, 0.371, 0.0]",3
Yelp reviews arent too trustworthy for low traffic businesses since they'll hide negative reviews.,"[-0.15, 0.35]","[0.0, 0.49, 0.51]",1
"Yep is a good application for what it's supposed to do. Although it doesn't work well with all Android devices. At times when I try to sign in at a restaurant, the app finds it hard to determine my location. But other than that everything works fine.","[0.175, 0.5041666666666667]","[0.14, 0.794, 0.065]",2
Love learning what locals love? Use yelp.,"[0.5, 0.6]","[0.627, 0.373, 0.0]",2
Keeps getting better \u0026amp; better,"[0.5, 0.5]","[0.659, 0.341, 0.0]",1
So far I find I enjoy using the application.,"[0.25, 0.75]","[0.366, 0.634, 0.0]",3
😠,"[0.0, 0.0]","[0.0, 1.0, 0.0]",-1
I used to love going there but the lady they have in the kitchen now is very nasty. I watched her picked up fries with her hand and then she tried to say she didnt and she still tried to sell it to me. How nasty is that. She had her hand in her hair and all. Of coarse her son was defending her which i didnt care but she was nast and rude.She wasn't wearing any gloves or anything. Disappointed  and disgusted. Doesn't make any sense. I  argued with her and then left that food right there. I won't be going bac,"[-0.3705357142857143, 0.6732142857142857]","[0.089, 0.705, 0.207]",1
Works great,"[0.8, 0.75]","[0.804, 0.196, 0.0]",3
This app not only gives you the best recommendations but helps you send mulutple requests with the touch of a button. Great idea for requesting estimates.,"[0.6, 0.6833333333333332]","[0.314, 0.686, 0.0]",3
Useful,"[0.3, 0.0]","[1.0, 0.0, 0.0]",2
Very helpful....especially when trying to find a restaurant in an unknown area.,"[0.05, 0.44999999999999996]","[0.0, 1.0, 0.0]",3
Formal dress. Ready in no time.,"[0.2, 0.5]","[0.287, 0.46, 0.253]",2
Everyone knows what it is and what is for.,"[0.0, 0.0]","[0.0, 1.0, 0.0]",3
"Love this App.  Its reviews of almost everything, especially restaurants, is extremely useful.  Definitely recommend this app to anyone.","[0.2, 0.525]","[0.467, 0.533, 0.0]",2
Don't like being forced to download it.,"[-0.30000000000000004, 0.2]","[0.259, 0.521, 0.22]",1
"Started advertising places  in notifications, bye.","[0.0, 0.0]","[0.0, 1.0, 0.0]",1
"How relieved we were not to have to schlep souvenirs from Manhattan up to our hotel in White Plains!  Great selection, wonderful service. Crown Plaza, White Plains NY gift shoppe.","[0.45, 0.4375]","[0.343, 0.657, 0.0]",1
"They have every business on here to review, the best place for service jobs and restaurants","[1.0, 0.3]","[0.219, 0.781, 0.0]",3
Stupid effing app is garbage.,"[-0.6499999999999999, 0.85]","[0.0, 0.541, 0.459]",1
"Their food is fresh,  service if friendly and SO worth the 35 mile drive!","[0.35000000000000003, 0.3666666666666667]","[0.442, 0.558, 0.0]",4
Can't believe I have to download this stupid app just to read reviews.,"[-0.7999999999999999, 1.0]","[0.0, 0.733, 0.267]",1
I use this app for everything!!,"[0.0, 0.0]","[0.0, 1.0, 0.0]",2
Very helpful :),"[0.35, 0.65]","[0.864, 0.136, 0.0]",2
Force you to download it to leave a review. I DON'T WANT TO DOWNLOAD IT ON MY MOBIL.,"[0.0, 0.0]","[0.118, 0.812, 0.07]",2
"Review by Carlos S.  Project: Clean House Interior (Maid Service)  She is a good lady, She does excellent","[0.85, 0.8]","[0.337, 0.663, 0.0]",-1
"Waste of time, just want to read reviews, use to be easy, search on Google and done, you guys have forced us into this ridiculous process and still can't see the all the reviews that are shown by yelp under Google, says I have to open the app to see more and then half of them magically dissapear.","[0.05416666666666667, 0.5249999999999999]","[0.065, 0.802, 0.134]",0
Browsing,"[0.0, 0.0]","[0.0, 1.0, 0.0]",2
"I heavily rely on Yelp before trying a new place. Surprisingly, the reviews are pretty accurate.","[0.25727272727272726, 0.6175757575757576]","[0.31, 0.69, 0.0]",1
Shouldn't have to be forced to log in to an app (or create a fake account) to be able to use it.,"[-0.10000000000000002, 0.6083333333333333]","[0.08, 0.687, 0.233]",1
I was born and raised in NY and I was willing to pay for a slice of home but not the 5th grade Friday pizza they serve at the  lunchroom cafeteria. The sauce wasn't homemade marinara and the crust seemed to be prepackaged. The people were pleasant and the small arcade is great for kids but I would never buy the pizza again.,"[0.3833333333333333, 0.7166666666666667]","[0.15, 0.832, 0.018]",1
Love it,"[0.5, 0.6]","[0.808, 0.192, 0.0]",2
Usually the chicken dumpling soup is number 1 today was really watered down not good for business the boss if he knew about it he would not be happy. :-(,"[-0.1579365079365079, 0.6126984126984126]","[0.141, 0.701, 0.158]",1
Great app.,"[0.8, 0.75]","[0.804, 0.196, 0.0]",3
Love how easy it is to use without having pop up adds. And it's easy to use with android.,"[0.45555555555555555, 0.7555555555555555]","[0.385, 0.615, 0.0]",3
Very helpful!,"[0.25, 0.3]","[0.772, 0.228, 0.0]",3
I love this app. Very useful. ..,"[0.445, 0.3]","[0.649, 0.351, 0.0]",3
Mr Ross did an awesome job with my DirecTV Repair in my Apartments!! Please use His Services! Excellent Character!,"[1.0, 1.0]","[0.413, 0.587, 0.0]",2
So helpful and I live honest reviews! : ) Thanks yelp!,"[0.40909090909090906, 0.65]","[0.664, 0.336, 0.0]",3
"Any review I put in only becomes a ""tip""","[0.0, 1.0]","[0.0, 1.0, 0.0]",1
Good,"[0.7, 0.6000000000000001]","[1.0, 0.0, 0.0]",3
"I check yelp on local, and travel plans re: close to home or otherwise, and its spot on so far! Superior app!","[0.3333333333333333, 0.6333333333333333]","[0.179, 0.821, 0.0]",4
We love it \u0026amp; the pics we get!!,"[0.78125, 0.6]","[0.406, 0.594, 0.0]",2
"Very helpful, and easy to use.","[0.31666666666666665, 0.5666666666666667]","[0.61, 0.39, 0.0]",3
A great way to get the real scoop on a lot of local locations! I love this app,"[0.375, 0.4125]","[0.459, 0.541, 0.0]",3
"Has gaps in information, people fill them in sometimes. But not always.","[0.0, 0.0]","[0.0, 1.0, 0.0]",1
Constant notifications and worthless interruptions,"[-0.4, 0.6166666666666667]","[0.0, 0.349, 0.651]",1
"Very informative, I highly recommend getting this app. My daughter and I found a local  place for breakfast. Way better than the chain restaurants","[0.215, 0.33499999999999996]","[0.239, 0.761, 0.0]",4
Now it will stop bugging me to rate it,"[0.0, 0.0]","[0.0, 0.784, 0.216]",1
"This place is Amazing!! Great staff, the food is fantastic and the owner is one of the best guys you will ever meet!! Would definitely recommend this place to anyone looking for a great place to eat, drink and hang out!! Will definitely be coming back again!!","[0.5171875, 0.575]","[0.432, 0.568, 0.0]",3
"My whole family love the ""tamales de elote"" I recommend it!!!","[0.58828125, 0.5]","[0.486, 0.514, 0.0]",3
"Use this app constantly around town and while travelling. So, so useful","[0.15, 0.16666666666666666]","[0.271, 0.729, 0.0]",1
Excellent food...Retro vibe...great portions! We loved it! Yummm 😋,"[0.9375, 0.9]","[0.539, 0.461, 0.0]",-1
I love this app helps me with what stores and restaurants are good to go at,"[0.6, 0.6000000000000001]","[0.447, 0.553, 0.0]",3
I love this app. It's helped me when I have traveled!!!,"[0.9765625, 0.6]","[0.388, 0.612, 0.0]",3
Just terrible. Don't need an app to check out a website.,"[-1.0, 1.0]","[0.0, 0.744, 0.256]",1
"I love this app, it helped me a lot in my Toronto trip","[0.5, 0.6]","[0.296, 0.704, 0.0]",3
One XI Salon is the perfect place! Grisel has been cutting my curly hair for 3 years!  I love her dearly!  Extremely talented and always does a perfect job! Crazy about my stylist! 😚👍💖💖💖,"[0.3041666666666667, 0.8833333333333334]","[0.407, 0.51, 0.083]",-1
I should not have to download an app to use what is otherwise a functional website. Even on mobile.,"[0.0, 0.0]","[0.0, 1.0, 0.0]",1
Hid all of my 8 good reviews over the past two years and put 2 negative ones right at top.,"[0.18714285714285714, 0.45714285714285713]","[0.197, 0.588, 0.214]",3
"If you say ANYTHING against yelp, or any company that they favor,  consider it removed. Yelp is extremely biased. In fact, read this rating quickly, because yelp will be removing it soon...","[0.10416666666666666, 0.75]","[0.077, 0.855, 0.068]",1
"They closed an hour and a half before they were supposed to claiming it was ""subway closes early today holiday"". Very unprofessional behavior. Not a happy mom. I just wanted to get my kid a sandwich.","[-0.07333333333333333, 0.37333333333333335]","[0.099, 0.804, 0.096]",2
"I did not want to use this app, but was unable to view more reviews of an apartment building on my browser. Now that I've downloaded it and searched, the search engine cannot locate the same building! I already resent the fact that they force you to download the app, but to add insult to injury it doesn't even function well. Sad face - One star. EDIT I went back and found where I could remove the ad for the app, so I'll give them back .1 stars. Still a garbage search engine.","[-0.08333333333333333, 0.3541666666666667]","[0.0, 0.818, 0.182]",1
Good for finding businesses you usually wouldn't have found.  I try to leave reviews for everything good and bad.  Just so people know where to go and where not to waist your time.,"[0.11250000000000002, 0.5291666666666667]","[0.151, 0.727, 0.122]",1
They are forcing the app on us. Ridiculous!,"[-0.41666666666666663, 1.0]","[0.0, 0.715, 0.285]",1
Great,"[0.8, 0.75]","[1.0, 0.0, 0.0]",4
"It has been many years but I cannot forget that their partner Scott Easter lied on his arbitration application and helped out a former client of theirs who was a convicted felon. No discipline ever took place. No. I am not happy. They did make $16,000.00 back then I believe....but he attempted to destroy my company. I have all the records...sad for them...sad for the profession.","[0.024999999999999994, 0.375]","[0.027, 0.732, 0.241]",1
One stop convenience,"[0.0, 0.0]","[0.0, 0.476, 0.524]",2
"Great app, I always check before I go anywhere.","[0.8, 0.75]","[0.406, 0.594, 0.0]",3
Love it,"[0.5, 0.6]","[0.808, 0.192, 0.0]",2
"Clerk was hard to hear and understand. Mgr. was at best, not attending to customers very well. Coffee was the most watered down . I have ever tasted. Threw it in trash can as I exited the resturant. Star Bucks here I come. Taking this Mc Donald's off stop list going south in the future","[0.20879629629629626, 0.34259259259259256]","[0.115, 0.822, 0.063]",1
Location,"[0.0, 0.0]","[0.0, 1.0, 0.0]",2
"Every time I'd go to Google looking for information about a place it'd pull up the yelp reviews. Every time. So I figured I'll just needed to download the app and save myself a step. As a lifestyle blogger, I eat out ALL the time. I take pictures of my food and post them across at least 4 of my social channels. So why not take the next step to yelp a review so that others might be able to enjoy the same luxuries as I so for that reason, I had to download the app. And it works phenomenally.","[0.1619047619047619, 0.3166666666666667]","[0.068, 0.932, 0.0]",1
"Richard was our sales guys great guy listen to what we wanted, we went with a posture pediatric hybrid. Price great went with a king size lots of extras to add on for pennies. Memory foam pillows mattress cover and sheets under $200. Definitely recommended. Oh and same day delivery.","[0.4, 0.53125]","[0.224, 0.776, 0.0]",3
great variety of watches found my Omega  good price too. Great service,"[0.7666666666666666, 0.7000000000000001]","[0.552, 0.448, 0.0]",3
Excellent advise so far.,"[0.55, 1.0]","[0.552, 0.448, 0.0]",3
Like the new updates and information technology that you've added to this last packet.  Smoother functionality and user experience.  Thanks,"[0.11212121212121212, 0.2404040404040404]","[0.231, 0.769, 0.0]",1
horrible,"[-1.0, 1.0]","[0.0, 0.0, 1.0]",0
Loved it,"[0.7, 0.8]","[0.796, 0.204, 0.0]",3
Doesn't let me log in so I had to uninstall,"[0.0, 0.0]","[0.0, 1.0, 0.0]",1
Crap,"[-0.8, 0.8]","[0.0, 0.0, 1.0]",2
"Great music , drinks are fantastic. Stop by.","[0.6000000000000001, 0.825]","[0.554, 0.288, 0.158]",4
I can always rely on yelp. I just made a move to a new state and used yelp constantly :),"[0.21212121212121213, 0.5959595959595959]","[0.167, 0.833, 0.0]",3
I use this everytime I go out if town. Very decent and useful,"[0.2583333333333333, 0.43333333333333335]","[0.24, 0.76, 0.0]",1
"Residential and commercial window cleaning,gutters and power washing, in the district of Columbia Maryland and Virginia.","[0.0, 0.0]","[0.0, 1.0, 0.0]",3
Yup,"[0.0, 0.0]","[0.0, 1.0, 0.0]",2
Always fills me up with the best information for finding good grub in range of me.,"[0.85, 0.45000000000000007]","[0.336, 0.664, 0.0]",3
"Location's not working, also, it's annoying me with reminders to rate it.","[-0.8, 0.9]","[0.0, 0.803, 0.197]",1
Stupid that u need the app to do anything. Y can't I just use the browser?,"[-0.7999999999999999, 1.0]","[0.0, 0.779, 0.221]",1
"Waste of space, have to download to leave a review? What a pain...","[-0.2, 0.0]","[0.0, 0.692, 0.308]",1
"Ive had empire maybe 50 times with the old owners...new owners get everthing opposite of your order...lightly toasted to them means black edges..i have pics to show...go to a newly found BEST PIZZA if you want great food..and affordable. I was in awe after 2seperate chkn parm grinders w/xtra sauce.l.we got NONE. Lightly toasted..i took pics of the black edges..AGAIN!! I asked for homeade blue cheese for my salad..no.got pkg. He says ok.i owe u 2 blue cheese..i was mad n said...no, u owe us 2 grinders. F it.","[0.12584366391184576, 0.406473829201102]","[0.121, 0.843, 0.036]",1
"Had new toilet installed very efficient, and very fast left no mess..definitely recommend.","[0.1126060606060606, 0.3069090909090909]","[0.31, 0.554, 0.136]",0
Love it when looking for a place to eat,"[0.5, 0.6]","[0.375, 0.625, 0.0]",2
i hate it,"[-0.8, 0.9]","[0.0, 0.213, 0.787]",2
Bloatware installed by phone manufacturers taking up space on my Phone,"[0.0, 0.0]","[0.0, 1.0, 0.0]",2
great app!,"[1.0, 0.75]","[0.815, 0.185, 0.0]",3
Cool app very helpful😎,"[0.275, 0.475]","[0.434, 0.566, 0.0]",-1
