Body,"[0.0, 0.0]","[0.0, 1.0, 0.0]",2
"I don't dislike the app, what I dislike is the fact that I wasn't allowed to use the website on my phone and instead it repeatedly forced me to go to this store until I downloaded the app. That's just unreasonable to their clientele","[-0.30000000000000004, 0.2]","[0.098, 0.834, 0.068]",1
Works good,"[0.7, 0.6000000000000001]","[0.744, 0.256, 0.0]",3
I cannot tell you how many times I use this app.  Cannot imagine not having it. Especially in a new city!,"[0.4204545454545454, 0.7045454545454546]","[0.0, 1.0, 0.0]",1
Good App,"[0.7, 0.6000000000000001]","[0.744, 0.256, 0.0]",3
"It's a pretty great app for everything you need like restaurant places,renting a place to going out","[0.525, 0.875]","[0.45, 0.55, 0.0]",1
Very informative .,"[0.2, 0.3]","[0.0, 1.0, 0.0]",3
Respectful nice love the food and milkshake and the service is wonderful,"[0.65, 0.825]","[0.631, 0.369, 0.0]",4
Fo real tho,"[0.2, 0.30000000000000004]","[0.0, 1.0, 0.0]",2
Nice app,"[0.6, 1.0]","[0.737, 0.263, 0.0]",2
Good one,"[0.7, 0.6000000000000001]","[0.744, 0.256, 0.0]",3
Early morning service on Sunday to replace the condenser fan motor! We are in town from Colorado visiting our Grandma and the air conditioning went out last night around 830pm. We called 4 companies and these guys are the only ones that called us back. It's 10:05am and Clayton already has us back up and running! Excellent service! Thank you!,"[0.1875, 0.39444444444444443]","[0.147, 0.853, 0.0]",3
Great descriptions,"[0.8, 0.75]","[0.804, 0.196, 0.0]",3
Yelp is am awesome app! I love that I can read other people's reviews before deciding to try out a place. I also love the fact that I can share my opinion with others about places I've been.,"[0.46875, 0.64375]","[0.341, 0.659, 0.0]",1
Very informative,"[0.2, 0.3]","[0.0, 1.0, 0.0]",3
I love yelp.,"[0.5, 0.6]","[0.808, 0.192, 0.0]",3
One star because it keeps asking for me to rate the app.,"[0.0, 0.0]","[0.0, 1.0, 0.0]",3
Always makes good recommendations for food and services when I'm traveling or at home,"[0.7, 0.6000000000000001]","[0.182, 0.818, 0.0]",3
"All l can say is, whose the cook? Food is a little high but it is worth it every bite","[0.09083333333333332, 0.38000000000000006]","[0.121, 0.879, 0.0]",1
I always use Yelp to find good businesses,"[0.7, 0.6000000000000001]","[0.326, 0.674, 0.0]",3
The app is flakey about finding my location. Give me an old fashion phone book and it would be faster.,"[0.1, 0.2]","[0.0, 1.0, 0.0]",2
They wanted me to pay $70.00 for 4 people at lunch.  Menu states $8.69 ea.  Rip off!  Walked out.,"[0.0, 0.0]","[0.0, 0.909, 0.091]",2
Why can't I sort reviews?,"[0.0, 0.0]","[0.0, 1.0, 0.0]",1
"I like to rate businesses and staff. The family and I like to get off the beaten path a bit, Yelp helps 😆","[0.0, 0.0]","[0.288, 0.606, 0.106]",-1
"Got back from arches around 2:00. The room had not been cleaned so I called the front desk and asked if they could please clean the room so we could take a nap. The gentleman at the front desk said he would let housecleaning know. A minute later the phone rang, it was the hotel manager. She told me they would get there when they get there. I asked if she would please let housekeeping know since they were next door... her response ""they will get there when they get there"". I was very offended,","[0.11333333333333333, 0.2]","[0.076, 0.9, 0.024]",2
Awesome,"[1.0, 1.0]","[1.0, 0.0, 0.0]",3
So on the website I was looking at a camp site but then I went to open it in the app but it says not found it was so frustrating because on the website it said view in the Yelp app because I was looking at the pictures and then I went to the app and it wasn't there it said not found so I also put in the address and it said not found which was stupid because they had it on their website I'm never using Yelp ever again,"[-0.39999999999999997, 0.7999999999999999]","[0.0, 0.895, 0.105]",0
Foodies paradise,"[0.0, 0.0]","[0.808, 0.192, 0.0]",2
I really don't like that I had to download the mobile app to finish reading a review.,"[-0.1, 0.2]","[0.0, 0.845, 0.155]",1
I enjoyed my first massage at massage green in Westland Michigan,"[0.18333333333333335, 0.4444444444444444]","[0.268, 0.732, 0.0]",3
Those odd jobs etc....,"[-0.16666666666666666, 0.25]","[0.0, 0.566, 0.434]",2
Had a Darden gift card so we decided to try the Yard House. Duck wings on point. Juicy and tender. Cilantro and jalapeño salad hot but the fresh mint helped cool my palate. Also delicious. My hubby said the turkey melt was the best sandwhich he's ever had! Would have given it 5 stars but the butterscotch pudding had an off flavor as if it was mixed with some type of liquor. I had to scoop it out in order to enjoy it.,"[0.4714285714285714, 0.5785714285714285]","[0.257, 0.743, 0.0]",-1
Tire service......only came here to get 1 tire replaced....waited for 3 hours...I left but I think they took other people ahead of me since I wasnt here....very short handed....dont think Lex would have operated this way....dont think Ill be back unless I have no choice their prices are also higher than Sams club ...Verchelle Heyward trying to help but in my opinion its way too long for 1 tire..very dissapointed....,"[-0.060714285714285714, 0.3678571428571428]","[0.05, 0.859, 0.091]",0
Works as good as you'd expect a rating app to.,"[0.7, 0.6000000000000001]","[0.266, 0.734, 0.0]",3
"Best Poker dishes and other items Venice, CA on the Beach.","[0.4375, 0.3375]","[0.296, 0.704, 0.0]",3
I paint everything from a to z and from Mild to Wild,"[0.21666666666666667, 0.45]","[0.0, 1.0, 0.0]",2
UBER Promo Code i0tuzh,"[0.0, 0.0]","[0.0, 1.0, 0.0]",2
Very  helpful,"[0.2, 0.3]","[0.756, 0.244, 0.0]",3
Awesome,"[1.0, 1.0]","[1.0, 0.0, 0.0]",3
Bi weekly monthly weekly. One time. Move outs move in call us you won't be disappointed,"[-0.75, 0.75]","[0.145, 0.855, 0.0]",2
"If you love to tear businesses down and get scammed by yelps 'business plan' where business have to pay to 'survive' yelp reviews and only the crappy reviews are saved, if you like to feed on people's  criticism and judgmental attitudes this is the app for you!! Have a nice life of more of the same.","[0.24074074074074073, 0.5856481481481481]","[0.187, 0.698, 0.115]",1
"Great location, wait staff were patient as we were a rowdy group. They even took time to take some pictures for us as most of us were from out of town. Decor is to die for esp bathroom. Crab cakes And beet salad yummiest.","[0.65, 0.625]","[0.084, 0.837, 0.08]",1
"I prefer to use Yelp, it would be great if they had a community version of this app (as it's currently for businesses) - to be what Swarm failed to be. I love the new crowns that's given for regular check ins.","[0.15606060606060607, 0.43024475524475525]","[0.178, 0.751, 0.071]",1
Really handy app!,"[0.75, 0.9]","[0.0, 1.0, 0.0]",3
Salon,"[0.0, 0.0]","[0.0, 1.0, 0.0]",2
Absolutely Beautiful Pieces. Amazing Customer Serivce. Great Deals. Highly Recommend.,"[0.6025, 0.7975]","[0.716, 0.284, 0.0]",3
Servco,"[0.0, 0.0]","[0.0, 1.0, 0.0]",2
The food was so good hands down. And the waitress Jessica was the best waitress I have ever had and I use to work in the server industry! She had a great personality not just with us but with every table she serviced. Aside from the food she really made the experience of eating here the best ever.,"[0.5907407407407407, 0.4064814814814815]","[0.211, 0.789, 0.0]",3
"We stop by our first night in tampa and had a great time. We decided to spend our last night here and the drinks cost 4x as much as the first night. The first night, I got one sex on the beach drink cost me $3. The last night I got one sex on the beach and one long island. The girl told me it cost $18 for both drink. I asked why so much and she said it just is. I think it is a rip off, no drink can jump price rhat much. Florida is nice in general but the drinks and casino suck big time compare to Colorado.","[0.21153846153846154, 0.34487179487179487]","[0.04, 0.897, 0.063]",3
Cindy is hands down the best in phoenix metro.,"[0.4222222222222222, 0.29444444444444445]","[0.344, 0.656, 0.0]",3
"Meh, keeps freezing up and closing","[0.0, 0.0]","[0.0, 0.597, 0.403]",2
Trash. Yelp will get rid of poor reviews or drop them to the bottom if you pay them.,"[-0.4, 0.6]","[0.0, 0.694, 0.306]",2
Works great \u0026amp; simple to use! I like being able to easily check a place out before I go there.,"[0.43333333333333335, 0.6413690476190477]","[0.399, 0.601, 0.0]",4
We could use the ability to sort reviews by date just like the website.  I like to read reviews from most recent.,"[0.25, 0.375]","[0.289, 0.711, 0.0]",1
This is the place to go to find a great restaurant or anything else you're looking for!,"[1.0, 0.75]","[0.226, 0.774, 0.0]",1
Not_for_profit training volunteers in making seniors lives more golden. Referring young adults to completion of GED to qualify for student loan to further their education.,"[0.225, 0.475]","[0.0, 1.0, 0.0]",1
Really appreciate the local reviews and the sponsors.,"[0.1, 0.1]","[0.3, 0.7, 0.0]",3
Started using this app just to find local resteraunts and businesses never would of thought I'd end up making yelp elite. Fun app,"[0.15, 0.1]","[0.13, 0.87, 0.0]",1
I use this app for everything! Looking for a dog groomer now lol.,"[0.8, 0.7]","[0.236, 0.764, 0.0]",2
Love it,"[0.5, 0.6]","[0.808, 0.192, 0.0]",2
The only problem is that more users should write reviews.,"[0.25, 0.75]","[0.0, 0.769, 0.231]",1
Can't believe there are not more apps like this because this app really isn't very good.  Please bring back Urbanspoon.,"[-0.235, 0.42666666666666675]","[0.0, 0.698, 0.302]",1
Great App,"[0.8, 0.75]","[0.804, 0.196, 0.0]",3
"Everything you need/want to know all in one place!  Love this app. Easy to navigate, not glitchy like some apps.","[0.4666666666666667, 0.7166666666666667]","[0.279, 0.641, 0.08]",1
First bartender $15.00.        Second bartender $20.50.   Third bartender $18.50.    Same drinks. Plus tip.        They all insisted their price was the correct one. How come? Beware...,"[0.0625, 0.11458333333333333]","[0.0, 1.0, 0.0]",2
Almost perfect,"[1.0, 1.0]","[0.773, 0.227, 0.0]",2
"Yeah, I love this thing","[0.5, 0.6]","[0.762, 0.238, 0.0]",3
dont let me look for the restaurant that i want,"[0.0, 0.0]","[0.14, 0.86, 0.0]",2
Easy to locate locations,"[0.43333333333333335, 0.8333333333333334]","[0.492, 0.508, 0.0]",2
Great selection of children's clothing at a great price,"[0.8, 0.75]","[0.577, 0.423, 0.0]",3
I received 2 reviews from independent  customers and yelp won't allow them to be published. Why ???????,"[0.0, 0.125]","[0.0, 0.842, 0.158]",3
Force me to install your app. Links from Web version of Yelp takes me to the play store instead of opening the yelp app.,"[0.0, 0.0]","[0.094, 0.906, 0.0]",1
"Yelp! Doesn't miss,a beat...if u can't find thelace uour looking for on yelp...it must not exsist in this demensional plane....","[0.0, 0.0]","[0.0, 1.0, 0.0]",2
high reviews are reliable,"[0.16, 0.5399999999999999]","[0.0, 1.0, 0.0]",3
This company is extorting small businesses.  They take good reviews off and leave the bad ones until the small business pays for advertising.  Do not believe the reviews you see on it.,"[-0.12499999999999997, 0.5166666666666666]","[0.079, 0.792, 0.128]",1
Love it,"[0.5, 0.6]","[0.808, 0.192, 0.0]",2
Very helpful.,"[0.2, 0.3]","[0.756, 0.244, 0.0]",3
Love this app to find what I need,"[0.5, 0.6]","[0.412, 0.588, 0.0]",2
"Looking forward to a great food experience as seen on TV Show Lucky Show...highly disappointed. Sitting at food bar had to look at the dish station, a dirty and disorganized kitchen and 10 feet of junk on a counter. Miso noodles good but all very over priced, especially the pickle plate which that size would normally be free for the table. People next to me laughed a little when arrived. Nice wait staff but when finished waited for my to go leftovers...never came back. Spent $20 for half a bowl of noodles.","[0.1286111111111111, 0.52]","[0.178, 0.767, 0.055]",1
"Very good, works most everywhere","[0.705, 0.6400000000000001]","[0.444, 0.556, 0.0]",3
Awful slow service.  I have had to leave numerous times often standing in line for 20 minutes at a time.  So ridiculous,"[-0.4083333333333333, 0.725]","[0.0, 0.709, 0.291]",1
I hate that you insist I downloaded your app to read reviews.,"[-0.8, 0.9]","[0.0, 0.709, 0.291]",1
Just average.,"[-0.15, 0.39999999999999997]","[0.0, 1.0, 0.0]",2
Can't wait to come back! Try the wings!,"[0.0, 0.0]","[0.0, 1.0, 0.0]",1
Perfect,"[1.0, 1.0]","[1.0, 0.0, 0.0]",2
Does exactly what it needs to but has some rather horrendous performance issues on certain screens,"[0.23214285714285715, 0.4107142857142857]","[0.121, 0.641, 0.238]",1
Lifesaver app!,"[0.0, 0.0]","[0.804, 0.196, 0.0]",2
Taco bell is better.,"[0.5, 0.5]","[0.492, 0.508, 0.0]",3
Muddy Paws gave excellent service to my senior pets.,"[1.0, 1.0]","[0.316, 0.684, 0.0]",3
"As said, very happy","[1.0, 1.0]","[0.571, 0.429, 0.0]",3
Left me sitting on the side of the road for nearly 4 hours in 95° heat. Never let me know they weren't coming until I ask them how much longer and was told they were to busy to help me. I had to find someone else.,"[0.1, 0.22500000000000003]","[0.06, 0.94, 0.0]",-1
Hair salon and it gives me restaurant options. Slows down my device which is a pain.,"[-0.15555555555555559, 0.2888888888888889]","[0.0, 0.809, 0.191]",3
"In the mood for Picasso showed up 15 min before they closed no lights no  cashier...crickets...someone walked out and we asked if they were still open to hear ""well technically""...Well no thanks we will go to Potbelly.","[-0.06666666666666667, 0.26666666666666666]","[0.115, 0.734, 0.151]",0
Dive dive dive filthy \u0026amp; dirty,"[-0.7, 0.9]","[0.0, 0.633, 0.367]",1
"Only used it for restaurants so far, but the recommendations are spot on!","[0.0625, 1.0]","[0.0, 1.0, 0.0]",1
"Too restrictive for the uber yelper.  I move fast.  ""EASY TIGER""  Honey Badger...","[0.31666666666666665, 0.7166666666666667]","[0.248, 0.752, 0.0]",1
I use Yelp to check out a lot of businesses before I use them.,"[0.0, 0.0]","[0.0, 1.0, 0.0]",1
More food,"[0.5, 0.5]","[0.0, 1.0, 0.0]",2
Love. It,"[0.5, 0.6]","[0.808, 0.192, 0.0]",2
"I've had many massages different styles and Daniel has been the best so far! Will always get work done with him! Give him a try you won't regret, promise.","[0.4140625, 0.6000000000000001]","[0.209, 0.734, 0.058]",3
I have had  very positive expierianceses with yelp on both sides. Good reviews and bad. I also look to yelp for good sound advice.,"[0.2790909090909091, 0.5951515151515151]","[0.311, 0.577, 0.112]",3
"Awesome Awesome Awesome...staff rocks, Problem oriented, budget friendly...Dr Bay is gifted and Cares for his patients","[0.8333333333333334, 1.0]","[0.432, 0.463, 0.104]",3
Find places to eat,"[0.0, 0.0]","[0.0, 1.0, 0.0]",2
Seems a viable option if you didn't have to pay to avoid negative opinions.,"[-0.3, 0.4]","[0.075, 0.582, 0.343]",1
Sometimes I just want to read reviews. Stop trying to turn my location on for no good reason. Stop being bossy.,"[-0.35, 0.6000000000000001]","[0.163, 0.581, 0.256]",2
"One time i loved this, after update , it's asking for login .. and can't  login from any account .. shame on you yelp","[0.7, 0.8]","[0.144, 0.741, 0.115]",3
Whenever or wherever I'm looking for something in particular yelp has always helped me out. Love the app it's very simple to use.,"[0.2222222222222222, 0.4658730158730158]","[0.16, 0.84, 0.0]",2
Gets me where i want to go and easy for my to look up businesses,"[0.43333333333333335, 0.8333333333333334]","[0.259, 0.741, 0.0]",1
1st technician lied and had us in the heat for 6 days.  Appointment 5 days later with Second technician who came 40 mins after window of 1 to 5 pm.  Invoice says one thing and when you call it is something totally different.  I need honest technicians that educate me on heating and cooling issues.   Spoke with owner who would not listen nor allow me to talk then disconnected call.  I was not rude. But he hung up in my face.,"[0.15, 0.42000000000000004]","[0.093, 0.875, 0.032]",1
"Reviews, tips and photos are very helpful as are menus and website links.","[0.2, 0.3]","[0.205, 0.795, 0.0]",1
Love using this app to find unique places.,"[0.4375, 0.8]","[0.375, 0.625, 0.0]",2
I find this app to be super helpful. Especially when I go out of town with the family and I'm trying to find a cool place to go. If I want to find a restaurant with good reviews I always turn to Yelp,"[0.3458333333333333, 0.7291666666666666]","[0.292, 0.708, 0.0]",1
No thanks,"[-0.1, 0.2]","[0.569, 0.0, 0.431]",1
Dr. took his time to explain my prescription and Claudia the sales    person super helpful and informative.  She helped me choose the best plan and the best fitting frames. Will definitely recommend this store to everybody,"[0.5666666666666667, 0.4533333333333333]","[0.404, 0.596, 0.0]",2
Great app overall. Primarily use it to find restaurants or bars.,"[0.4000000000000001, 0.4166666666666667]","[0.291, 0.709, 0.0]",3
New to Yelp \u0026amp; so far it has really made life easier! Thanks Yelp! And thanks to the people who take the time to rate and leave comments. I'm going to return the favor!,"[0.19727272727272727, 0.41090909090909095]","[0.292, 0.68, 0.028]",3
U have to pay them 300 dollars a month for a business or else they are gonna flag the review,"[0.0, 0.0]","[0.0, 0.92, 0.08]",2
The app crashes whenever I click on a business. Not functional,"[0.0, 0.0]","[0.0, 1.0, 0.0]",1
This is my new place. They went above and beyond.,"[0.06818181818181818, 0.2772727272727273]","[0.0, 1.0, 0.0]",3
Better then nothing,"[0.5, 0.5]","[0.592, 0.408, 0.0]",2
"I resent the fact I have to download an APP to write, update, or even SEE reviews instead of using my phone browser.  Shame on you Yelp.  To top it off, the damn app didn't even work.","[0.5, 0.5]","[0.045, 0.769, 0.186]",1
"Wanna give i Big shot out to Anival and team for the great tasting Pizza, there working hard to get the pizzas done manually there pressing machine won't be fixed till Monday,  great job Anival","[0.2816666666666666, 0.4683333333333334]","[0.202, 0.764, 0.034]",1
Como me encanta los sándwiches Cubanos mmmmmm,"[0.0, 0.0]","[0.0, 1.0, 0.0]",-1
Works great but notifications are really annoying,"[0.0, 0.825]","[0.221, 0.433, 0.346]",1
"It hasn't been long that I've started using this, but I dig it so far - no issues yet","[0.025, 0.7]","[0.0, 0.833, 0.167]",1
Great app,"[0.8, 0.75]","[0.804, 0.196, 0.0]",3
"Yep. Yelp is yelpalicious. Just made up that word. You like it? You can use it. Anyway, great app.","[0.8, 0.75]","[0.355, 0.645, 0.0]",2
I like reading the reviews before I visit new places.,"[0.13636363636363635, 0.45454545454545453]","[0.263, 0.737, 0.0]",1
"Very strong smell of cigarette smoke. Filthy bathroom. Old soap residue on soap dishes, sticky residue on tables. Worst of all window air unit kept freezing up.","[-0.2841666666666667, 0.7883333333333333]","[0.109, 0.725, 0.166]",3
"Great information, accurate and up-to-date app!","[0.6500000000000001, 0.6916666666666667]","[0.468, 0.532, 0.0]",4
Now i won't go to any establishment without checking in on my other half. It's you Yelp. I need you in my life now and forever.,"[-0.14583333333333331, 0.2708333333333333]","[0.0, 1.0, 0.0]",2
"They do not verify authenticity of any of their reviews. Anyone can post any lies they want.  Positive or negative. There are no accountability. There is no reason for some reviews to be ""recommended"" or ""not recommended"". The whole Yelp business is based on extortion.","[0.04242424242424243, 0.4484848484848485]","[0.089, 0.712, 0.199]",1
moving company,"[0.0, 0.0]","[0.0, 1.0, 0.0]",2
Great to have handy reviews of local businesses!,"[0.4666666666666666, 0.5499999999999999]","[0.386, 0.614, 0.0]",3
Doesn't work as well as other apps.,"[-0.125, 0.375]","[0.0, 0.768, 0.232]",1
Helps a lot when trying to find something cool in the area,"[0.35, 0.65]","[0.353, 0.647, 0.0]",2
"Cant look up any thing near me or where i want to go, garbage!","[0.125, 0.4]","[0.117, 0.883, 0.0]",1
"Today I arrived promptly at 11:30. Chef didnt come to table until 12:40! At about 12:35 I searched for waiter to complain as I saw the Chef's cart coming out (still took another five minutes- guess he forgot something)! Waiter apologized \u0026amp; stated he would tell his manager. About 1:05pm lunch was finally done, but i had to immediately pack my food togo and ask for check. Manager called me a liar (basically) and said i was only there for 25mins! Wth! On top of that i was charged incorrectly.","[0.16666666666666666, 0.8333333333333334]","[0.041, 0.81, 0.149]",1
"I could have become a yelp user but a review that I believe was fair and took me quite a bit of thought and planning was ""not recommended."" So that is how yelp deals with reviews that criticize their valued clients.  I'm done with this app.","[0.7, 0.9]","[0.141, 0.788, 0.071]",1
I use this all the time to get an understanding of a business. Find the reviews useful and helpful.,"[0.3, 0.0]","[0.275, 0.725, 0.0]",2
Great app,"[0.8, 0.75]","[0.804, 0.196, 0.0]",3
Great local navigator,"[0.4, 0.375]","[0.672, 0.328, 0.0]",3
"All in one stop for my oil change at  reasonable price \u0026amp; very convenient location, I will 100%  recommend to my family, relatives \u0026amp; friends.","[0.2, 0.44999999999999996]","[0.194, 0.729, 0.076]",1
Never leave home with out it.,"[0.0, 0.0]","[0.0, 0.806, 0.194]",1
Pretty cool app.,"[0.3, 0.825]","[0.846, 0.154, 0.0]",3
A really useful app..,"[0.3, 0.0]","[0.615, 0.385, 0.0]",1
I love amazing food \u0026amp;  just the right atmosphere to enjoy it. Yelp is just the right place to go to find what I'm looking for. Thank you Yelp your app has proven to be very useful.,"[0.41023809523809524, 0.5119047619047619]","[0.353, 0.647, 0.0]",4
I downloaded the yelp app just for this review because my service was so awful,"[-1.0, 1.0]","[0.0, 0.771, 0.229]",1
Reviews are always helpful,"[0.0, 0.0]","[0.483, 0.517, 0.0]",3
I turn to Yelp to locate almost any kind of businesses and services in my area. It's very helpful.,"[0.4, 0.6]","[0.154, 0.846, 0.0]",1
Great app but sometimes I think yelp should add a breathalyzer before commenting.,"[0.8, 0.75]","[0.203, 0.797, 0.0]",1
It is a good,"[0.7, 0.6000000000000001]","[0.592, 0.408, 0.0]",3
Fun and great info,"[0.55, 0.475]","[0.787, 0.213, 0.0]",3
Filters \u0026amp; comments are helpful when trying to find something good.,"[0.7, 0.6000000000000001]","[0.388, 0.612, 0.0]",1
"Use to be heavily invested in Foursqure until they ruined the fun by creating Swarm and making two apps. Yelp does it for me these days, very nicely. More functionality than 4SQ too!","[0.24166666666666667, 0.39999999999999997]","[0.219, 0.706, 0.075]",1
Accurate reviews,"[0.4000000000000001, 0.6333333333333334]","[0.0, 1.0, 0.0]",2
"Yelp, wants people to lie about the bad service you receive at restaurants","[-0.24999999999999992, 0.3833333333333333]","[0.0, 0.774, 0.226]",2
Extremely helpful,"[-0.125, 1.0]","[0.756, 0.244, 0.0]",1
It has all the informative prospect that you need before heading out the door to me one of the best app. Love it.,"[0.75, 0.44999999999999996]","[0.346, 0.654, 0.0]",3
"Never eat or use services without consulting yelp first, .. the app makes it easy !","[0.39583333333333337, 0.5833333333333334]","[0.186, 0.814, 0.0]",1
I use it vetting potential business and contribute to help others.,"[0.0, 1.0]","[0.231, 0.769, 0.0]",3
"Wanted to conveniently check a review and it wouldn't let me without the app. I don't want the app I don't need the app now I have to install it just to Uninstall is since I don't use it enough to justify cluttering up my phone. Can I yelp, yelp and warn people to look elsewhere for reviews","[0.0, 0.5]","[0.0, 0.95, 0.05]",1
No connection Occasionally,"[0.0, 0.125]","[0.0, 0.476, 0.524]",2
"I travel for work and yelp is my ""go to"" app to find good eating spots. Most times it is extremely accurate.","[0.5333333333333333, 0.5777777777777778]","[0.127, 0.873, 0.0]",3
The app helps my girlfriend decide what she wants to eat,"[0.2, 0.1]","[0.206, 0.794, 0.0]",1
Yelp does no work to ensure reviews are accurate. They allow slander and it's shamful.,"[0.4000000000000001, 0.6333333333333334]","[0.241, 0.642, 0.118]",1
Always helpful when looking for food options when in areas you are not familiar with.,"[-0.1875, 0.5]","[0.167, 0.833, 0.0]",1
"Dont come, the waitress and waiter are rude and yell at me when I walk in..food is average n cachapas were uncook..yaquii","[-0.22499999999999998, 0.5]","[0.0, 0.864, 0.136]",1
I use it a lot and find it very quick and helpful!,"[0.5416666666666667, 0.65]","[0.272, 0.728, 0.0]",3
To hard to navigate messed with it for about 15 minutes and still couldn't get it to do what I wanted Google is much more user friendly and has a lot bigger database I will remove this from my phone,"[0.14583333333333331, 0.5104166666666666]","[0.084, 0.824, 0.092]",1
Very cheap and thin gold accents. Only wore few times before need re-plate. WOULD LIKE TO KNOW HOW REMI RECTIFY THIS VERY POOR QUALITY,"[-0.12000000000000002, 0.728]","[0.107, 0.731, 0.161]",0
LOVE!!,"[0.78125, 0.6]","[1.0, 0.0, 0.0]",2
Helpful,"[0.0, 0.0]","[1.0, 0.0, 0.0]",2
Wants my location all the  time,"[0.2, 0.1]","[0.0, 1.0, 0.0]",2
Love it. I don't eat out less I check it out first.,"[0.19444444444444445, 0.3333333333333333]","[0.318, 0.682, 0.0]",3
"Won't allow access from my phone, as the email address is already in use.  Guess who is using it? ME; ""x#*%\u0026amp;*x"". I've had an account on my home computer, IT geniuses!!","[0.0, 0.0]","[0.0, 0.93, 0.07]",1
Could be more intuitive.,"[0.5, 0.5]","[0.0, 1.0, 0.0]",2
Love the service and the food is perfect!,"[0.75, 0.8]","[0.577, 0.423, 0.0]",4
