Body,"[0.0, 0.0]","[0.0, 1.0, 0.0]",2
"So happy you finally made a version for android. So easy to use, and as a beginner, I really appreciate ur classes, I can feel my body improve every session.","[0.35833333333333334, 0.7583333333333334]","[0.373, 0.627, 0.0]",3
I don't often do yoga as I don't like the meditating part of it. But this one is relaxing without weird stuff :-)) easy app to use and easy to follow,"[0.21666666666666667, 0.9166666666666667]","[0.272, 0.594, 0.134]",1
"I really love the choice of lessons, from beginners to advanced, the choice of style of yoga and duration of class... it's a lovely pace, not rushed, well explained and even a choice of background music. I'm back into my yoga and wanting to find the time to do it...excellent app!! Thank you!","[0.35, 0.4875]","[0.226, 0.744, 0.03]",4
This is an amazing app and is worth much more than the price.  Thank you so much Gaiam .,"[0.4, 0.425]","[0.353, 0.647, 0.0]",4
Amazing for all levels and great that you can customise too!,"[0.8, 0.825]","[0.477, 0.523, 0.0]",3
"Please fix this volume issue sometimes teachers voice is disable and not sync with the exercise. Video takes 10 minutes to start. Sometimes it won't play at all, I used to simply stare at phone with my yoga mat ready and fall asleep.","[0.1, 0.4285714285714286]","[0.105, 0.851, 0.044]",1
Great for someone looking to begin or jump back jnto yoga!!,"[0.4, 0.375]","[0.319, 0.681, 0.0]",3
Had this years ago and it's better than I remembered.,"[0.5, 0.5]","[0.266, 0.734, 0.0]",3
"Lot of varied time and pose sequences. Good for whether you practice vinyasa, bikram, or any other yoga. Keeps you motivated to come back and do more.","[0.26875, 0.36875]","[0.191, 0.809, 0.0]",2
Amazing app for only $1.,"[0.30000000000000004, 0.95]","[0.487, 0.513, 0.0]",3
I've only followed a few classes so far but this yoga app is certainly proving to be worth every penny and better than others I've tried :),"[0.2020408163265306, 0.6102040816326532]","[0.377, 0.623, 0.0]",2
Having been an ex yoga practitioner I am liking that I can easy myself back into the practice at my own pace. No Pressure No Judgement. Have yet to explore the rest of the videos but certainly looking forward to it.,"[0.31190476190476185, 0.6011904761904763]","[0.154, 0.738, 0.107]",1
Nice flow of routines and a wide variety to choose from.,"[0.25, 0.7]","[0.237, 0.763, 0.0]",3
"I've been using this app for a couple weeks now, and I absolutely love it. It's soothing, and guides you step by step, and I've enjoyed every class.","[0.5, 0.6499999999999999]","[0.305, 0.695, 0.0]",3
"I'm fairly new to yoga and this app guides you threw it brilliantly and at a steady pace, with plenty of classes at higher levels if your more experienced.","[0.4588383838383838, 0.6424242424242425]","[0.129, 0.871, 0.0]",3
For sure worth the money. I like the variety of classes and the ability to make your own practice. The app has the classes arranged according to your goals for your class.,"[0.4666666666666666, 0.662962962962963]","[0.25, 0.75, 0.0]",3
Loved the routines I am on beginners now; super routines...,"[0.5166666666666666, 0.7333333333333334]","[0.527, 0.473, 0.0]",3
Done several classes so far and loved them all!  Best yoga app I've found!,"[0.49375, 0.525]","[0.427, 0.573, 0.0]",3
After various injuries and a loss of discipline i ended up gaining 50 pounds. During the binge i developed all the flexibility of a 1980s action figure. This app allows me to bend my body like a german torture porn with the added benefit that no one but me can hear me cry.,"[0.05, 0.225]","[0.128, 0.699, 0.172]",1
"I am a beginner to yoga. I feel great after doing one of these classes! They explain everything so well, I love how they let you learn about specific poses, I love how you can schedule in a class into your calendar... much more. I really am enjoying using this daily!","[0.42857142857142855, 0.4535714285714286]","[0.343, 0.657, 0.0]",1
I have been doing yoga for over 50 years and this is the best yoga resource I have found. There is a large number of classes covering different areas of the body and offering different levels to suit beginner to advanced. The instruction is presented in a very soft clear voice with nice background music giving lots of tips for correct technique.,"[0.3055357142857143, 0.5458630952380952]","[0.231, 0.769, 0.0]",3
"Its everything I looked for in a yoga app. There is a human doing the poses so you can tell exactly how you should look, let's you go into poses without starting exercise to see how they are done, has pre-made classes and let's you customize your own uses poses you like. I'm so glad I made the purchase.","[0.27, 0.49000000000000005]","[0.099, 0.901, 0.0]",1
Love that you can create your own sequence!,"[0.625, 0.8]","[0.524, 0.476, 0.0]",2
This app is exactly what I've been looking for in a yoga app. I love that the classes are divided into difficulty plus have different lengths of time for most of them. I barely use it with my chromecast. I find myself just playing the class videos right off my phone.,"[0.2642857142857143, 0.4309523809523809]","[0.115, 0.84, 0.046]",1
Great for beginner of yoga to get started.,"[0.8, 0.75]","[0.369, 0.631, 0.0]",3
Love love love it!! Why paying lots of money for yoga classes is you can do all of that in your own room / backyard / wherever for $2?!,"[0.6328125, 0.7]","[0.36, 0.64, 0.0]",2
"I have just completed my first class and I am already in love! The pace is perfect, love that you can edit the volume of the music and the teacher independently from each other. I am looking forward to creating custom classes for myself. Thank you for such an amazing app! ♡","[0.375, 0.5541666666666667]","[0.33, 0.67, 0.0]",-1
Excellent!!! This app includes all of the difficult poses I'm currently attempting to master!,"[0.16666666666666666, 0.7999999999999999]","[0.251, 0.62, 0.129]",3
Best yoga app in market,"[1.0, 0.3]","[0.512, 0.488, 0.0]",2
"This was recommended to me by a friend and I love it! Very easy for beginners to follow and I love that I can do 10/15 minute sessions for when I have no time, well done, best yoga app by far, videos flow brilliantly.","[0.6147222222222223, 0.75]","[0.458, 0.505, 0.037]",4
Have used this app for several years now but just changed my phone to android and was a pain to use my old phone for the app. Thank you! Love this app and there is something for everyone and if you're feeling a bit lazy there's something for that too!,"[0.078125, 0.45]","[0.183, 0.693, 0.124]",1
"I absolutely loved this app on iPhone and was so upset when I switched to Android and it wasn't available. No other yoga app compares. The soothing voiceover, the customizable classes, the scheduling, the pose dictionary ... This app is amazing.","[0.290625, 0.61875]","[0.246, 0.686, 0.068]",3
"Splendid app: everything you could want in a yoga app and more. You can customise routines, the background music/ sound effects and more. Definitely worth a buy!","[0.5216666666666667, 0.5]","[0.335, 0.665, 0.0]",1
"I'm in yoga teacher training. I love this app so far, and I've only used the beginner videos. I just wish savasana could be a little longer! 😭 and maybe the music could fade out instead of abruptly stopping - it kind of takes away from the mood of finishing a good yoga sesh. Overall though, I love the app!","[0.24062499999999998, 0.6888888888888888]","[0.224, 0.752, 0.025]",-1
"The best yoga app on any app store. There are loads of classes, all very well put together and you can create your own. The classes cater to different goals and ability levels. The community is great as well, the FB page is always active. The yoga teacher from the app responds to queries and has brought together a great community you can feel part of. Highly recommended.","[0.42833333333333334, 0.6050000000000001]","[0.313, 0.687, 0.0]",3
"All the other yoga apps are horrible you have to keep selecting what move you wanna do theres no flow to em. This one has that, it has flow. Its very instructive for those who have never done yoga and a hell off a lot cheaper then a real yoga class. Plus woth the benefits of work out in the comfort of my own home. I love it i would five 10 stars if i could","[0.06249999999999998, 0.5958333333333333]","[0.111, 0.766, 0.123]",1
I'm a user of both OS systems (iOS \u0026amp; Android). This is by far the most useful app in the stores. You can chose follows the classes or build your own. Kudos,"[0.375, 0.625]","[0.183, 0.817, 0.0]",1
I trained as a yoga instructor but this wonderful app let's me enjoy being a student again. Namaste.,"[0.7, 0.75]","[0.444, 0.556, 0.0]",3
