latest update concern mount nasty weekend weather make thing worse,
teen spend summer fire prevention work ashcroft burning min away,
feel stress evacuation take care family tip,
wow great get knife sharpen proceed go,
fort mac crew shoulder shoulder story,
today join thank deployed personnel support effort,
please share map show highway closure update daily,
urge british columbian stay back country weekend due,
say wind speed will variable will likely last around day,
say broadly suggest person stay back country,
re support community affect community effort donation https,
reminder due many trail remain close detail safety info,
rd day clear sky kamloop big thank emergency crew safe http,
crew prepare windy weekend,
the latest go thank,
retweet bcrcmp work rcmp police officer patrol,
work rcmp police officer patrol,
alberta government create website inform albertan ongoing situation,
find dbcs list emergency resource industry,
this weekend perfect time bring knife sharpen contribute good cause,
mt volunteer support evacuee w en route,
due albertan travel bc check travel advisory road information depart https,
state emergency continue affect interior,
burn metro vancouver approximate area lose far h,
help us spread word assistance donation related info retweeting sharing post w,
beautiful site come helpless feeling,
spotted poor badger area please watch wildlife highway theyre escap,
thank caf personnel deploy assist effort always ready,
bentley sell toy raise money,
smoke arrive deteriorate air quality moderate health risk latest,
the latest kevin daily thank,
please donate can effort weve team w bc raise fund,
radio matter proud team,
forest fire season bc please extinguish cigarette smoking kiosk campus https,
news update resource share friend family may impact ht,
list close due severe hazard include info camper reserva,
donate recovery effort,
since start human-caus responsible summer,
future forest fire will frequent bigger harder control http,
special weather statement effect throughout much b c wind lightning expect brace,
turner say evacuation centre able handle donation drop,
saturday rap battle will forwarding proceed,
b c wildfire status friday strong wind expect weekend worsen fire condition,
say morning volunteer every evacuee,
please serve bcer new ad-hoc cabinet cmte w colleague coordinate federal effort relief,
look way help affect situation,
the latest kate news thank,
send firefighter equipment,
youve evacuate sure register,
current condition william lake bc little smoke,
icymi want help evacuee via,
number register wildfire evacuee approach pg adult child,
as say morning volunteer every evacuee,
fire aircraft will ground fly airspace leave home https,
will family communicate evacuate b c check tip,
situation like really serve reminder kind person eager help willing contribute,
quickly register volunteer number evacuee near,
can help british columbian affect donate canadian red cross,
more help way send firefighter equipment,
here make news industry week cca headline,
future forest fire will frequent bigger harder control,
honour serve bcer new ad-hoc cabinet committee coordinate federal effort relief https,
prepared unexpected power outage due need know,
respond claim,
trailer fill,
first nation health information wildfire evacuee,
evacuation alert place week,
apocalypse now b c s william lake airport p m video courtesy bryan johns,
love person displace year,
nova scotia firefighter join battle b c wildfire,
for example campfire bonfire open burning information,
bmo whitehorse selling cupcake today provide assistance victim,
want help evacuee thompson-nicola regional district set group connect person,
thank crew tackle today s brush fire sooke road report new near call -,
the latest oi twitterverse thank,
today join thank deployed personnel support,
prepare windy weekend forecast cold front w wind,
doug evacuate home day ago live truck ever since,
essential link resource resident evacuee traveler online hub,
kamloop prince george ready help affect location listed site http,
fear start enough deterrent maybe will,
what control burn save ranch look like thankyou,
lose count many burned car come across haunt sure,
firefighter prepare gusty wind saturday make guard line secure possible,
robert turner say everyone bc need prepared emergency esp pend wea,
home burn ashcroft indian band reserve,
evacuee need medication can use pharmacy near vi,
map tool bring together info,
why year s wildfire severe can do stop future,
thank,
the nvancouver westside daily story via,
icymi ask refund vacation booking near area depend part,
ask evacuee want know,
david fang volunteer time help feed thousand evacuee,
evacuation alert william lake last week official warn,
if fear start enough deterrent maybe will,
almost volunteer sign help evacuee,
icymi information wildfire smoke,
instated ad hoc cabinet committee coordinate recovery rebuilding effort victim,
stay safe thank hard work patrol area,
claim team readily avail family evacuate here help https,
weather update strong wind interior bc special weather advisory,
its afternoon drive show w come hwy closure mountie death sentencing update,
landlord tenant encouraged work together keep everyone safe,
be kamloops prince george ready help affect location listed site,
this work rcmp police officer patrol,
skrepnek say hard get person back country fire start spread,
grass water livestock ep ranch whispering pine kamloop,
need,
lesson ash expert learn fire,
certainly see wonder used happen now ht,
the latest cindy andrie report thank,
report via toll-free current fire bans restriction,
ibc encourage discuss policy limit insurer re via,
know anyone affect huge amount forest fire burning british columbia https,
ashcroft food bank operation,
prince george food bank help evacuee,
want help evacuee donate samaritan purse salvation army kamloop food bank spca legacy place https,
the latest bernard hellen daily thank,
resiliency face evacuee give perspective,
harjitsajjan thank caf personnel deploy assist effort canadium,
now close wb traffic little fort eb still open mile,
honour serve bcer new ad-hoc cabinet committee coordinate federal effort relief,
pharmacist natural that become pharmacist help person pharmacist role,
robert turner say now evacuee across bc far register fo,
evacuation safety start checkout practical tip reminder just case,
thank caf personnel deploy assist effort always,
say currently evacuee,
david fleck year food industry he help lead volunteer feed evacuee,
rhonda busse work sh teach volunteer use dishwasher,
latest update current evacuation order,
cad still roughly usd anyone wonder,
believe receive resource decision probably accurate,
say see repeat last weekend quickly evolve situation ov,
folk fire claim can call us - help affected top priority,
part customer affect launching assistance program program evacuee,
senior pregnant woman person respiratory condition risk wildfire smoke,
say wildfire burn throughout province new yesterday,
ve change damage pole far damage still found access new area available,
new evacuee assistance program automatic credit account power consume away https,
city stranger evacuation timely assistance other join mayor welcome evacue,
dep min robert turner say total evacuee far,
skrepnek say see last weekend quickly thing evolve see weekend,
mail delivery alert certain region british columbia,
mail delivery alert certain region,
rcmp report break-and-enter community clear,
the latest marv beer daily,
fire evacuation can trigger revictimiaztion tramatic harm cause residential school,
evacuee get free sailing detail,
graph area burn last season data annual mof report,
the latest hawthorne ridge daily thank,
say person arrest july th evacuation area apparent break enter tool vehicle,
emergency operation centre expect help person day ahead,
alberta rcmp fire crew arrive bc week assist,
say see repeat last weekend quickly evolve situation next hour,
the latest daily thank,
podcast sherrie fraser,
light question weather province will tackle https,
say lightning big concern driver new start wind arri,
create problem can fix say fire ecologist via,
new helpful essential link resource online hub,
say broadly encourage person stay back country due risk,
evacuee wont hook power used theyre home,
location w direction link icon appear city level,
latest number re active fire now cost now -million dollar,
if see fall line stay back metre live keep other away dial,
robert turner say everyone bc need prepared emergency esp pend weather event,
planning plan trip quesnel know go,
oh dear good situation,
turner say receive claim linked fire create separate claim line fire related issue,
every donation make difference relief join us bc raise fund help,
dont forget also latest situation,
robert turner say now evacuee across bc far register assistance,
spotted poor badger watch wildlife hwys theyre escap via,
alkali lake bc evacuation alert,
say lightning big concern driver new start wind arrive saturday aft,
say weather forecast weekend cooler temps wind concern term fire growth,
prevent soil dry risk add now water hold moisture long,
say near hectare contain person fighting fire bc,
province say fire burning across bc right now new fire since yesterday cost far mil,
great job editorial forest fire fighting enjoy,
the emergency operation centre expect help person day ahead,
must watch video fantastic update,
fire aircraft will ground fly airspace leave home,
pm today,
looter take advantage b c fire typical natural disaster expert,
individual evacuation centre can visit service canada table daily,
nova scotia firefighter set head b c help battle wildfire,
pharmacist can help provide continuity care patient affect,
important information indigenous person community impact interior wildfire,
grateful hundred volunteer show support evacuee,
affect please visit insurance info page h,
affect please visit insurance info page share info sheet http,
in serindipitous turn event now full staff come week greenkeeper evacuee help,
impoant stay away active area wherever crew need room work safely,
banking centre across canada accept donation help affect,
evacuate cow love back,
youre camping weekend five tip camping without campfire https,
security one main role,
[please share]one stop impact help,
want help family affect donate,
two person arrest possession steal item evacuate home,
emergency mail forwarding service evacuee great job,
williams lake wildfire burn british columbia credit chri,
nd consecutive day clear sky yay feel hopeful kamloop b c,
affected provide free counselling referral service via lifework,
come together badger wildlife need space adapt natural human-,
the latest briteland holding herald,
new help w recovery,
fundraising event cancel artist will perform vancouver,
the latest maryinvancitys daily dish thank,
tireless still support evacuee en route,
wildfire british columbia still grow evacuee count,
the latest gylliayn restaurant management daily thank,
update highway closure map now available update review daily please share,
smoke forecast map help predict smoke wildfire expect travel http,
keep up-to-date goc s response wildfire british columbia,
work good friend jd,
anyone know close s come kinder morgan pipeline pump station,
wish assist british columbian can donate appeal,
news update resource share friend family may impact,
issue bc every summer every year blow budget perhaps incr,
fire near now contain hectare,
loss loss cost broad pls part open https,
officer lower mainland van island now help,
a really nice feature airtanker crew,
twenty firefighter nova scotia will fly bc monday help w crew alta ont sask nb,
from alberta love cl- s arrive kamloop help,
support bc evacuee bc strong decal now available online pay want,
nows time develop household plan put together emergency kit,
current condition william lake bc,
church reserve untouched,
team manitoba arrive prince george destine william lake help fight fire http,
these teen spend summer fire prevention work ashcroft burning m,
contribute disaster response emerjis helpful,
experience stress time disaster normal tip cope crisis,
watch alert community risk dense smoke,
help serve per day that lot pot pan dish,
how will family communicate evacuate b c check tip,
latest princeton-area fire,
heartfelt thank firefighter emergency service personnel working tirelessly help keep person community safe,
natural part many ecosystem need prepare esp wildland-urban interface,
the latest daniele buzzurro daily thank,
bill glasgow say emotional toll start show story evacuee strike chord,
will join pt discuss new federal cabinet response,
bcnu donate k red cross wildfire relief text fire donate cdn red cross bc,
give situation couldnt use couple adorable alpacas life,
look help affect can donate british columbia fire appeal,
status friday strong wind expect weekend worsen fire condition,
the latest just list daily thank,
latest fire burn around bc right now,
speaking volunteer firefighter,
an escape plan will help family get house quickly safely case,
facebook group set help evacuee livestock,
always car ready case must evacuate quickly,
service canada old main today assist evacuee,
ncda bc wildfire relief fund dealership affect want support learn,
provincial policy vs federal land,
the latest ram computer daily thank,
firefighter prepare another long day,
thank work together situation great see cooperation,
friend bc need help have donate can theyre help victim https,
please visit website information,
city prince george urgently need volunteer wildfire evacuee arrive,
step,
higher wind expect saturday wildfire b c s interior,
youve impact here need know please share ht,
good info folk may affect area,
st move order obey law stop threaten fn govts exercise la,
fire spark secwepemc call pipeline shutdown,
great see incubate grad putt tech,
erdo assist bc wildfire victim partnership paocs bc yukon district office,
in light question weather province will tackle,
our crew work hard,
follow,
wed like thank friend donate food essential first responder,
update food bank help evacuee find closest one go,
wfr team happy packing donation supply firefighter bc h,
chef volunteer hard work fee evacuee expect go full throttle week,
here fire burn bc right now,
chef volunteer hard work fee evacuee expect go full throttle mo,
come together badger wildlife need space adapt natural hu,
stay safe weekend crew official will work hard keep family community safe htt,
forecast issue twice day current condition update hourly https,
our claim team readily avail family evacuate here help,
lunch prep underway salvation army volunteer feed breakfast lunch dinner,
the latest loud gorilla voice thank,
we spot poor badger area please watch wildlife highway theyre escap,
important information evacuate resident,
know there campfire ban bc follow info update,
wildfire british columbia government canada web resource,
send thought gratitude fighting fire behind scene support th,
rain rain go away go need,
free lunch today evacuee just bring id get cover,
donate recovery,
hgtv show devastate,
support first nation defend land response,
it get much much worse weather exacerbate b c wildfire situation,
how donate recovery,
the latest carshare central ledger thank,
mayor chair john ranta tell real challenge h,
map current travel impact please share,
map current travel impact please share click larger version h,
first nation land issue weekly story via,
meeting evacuee volunteer relief centre,
how donate recovery effort,
prevent soil dry risk add now water hold moisture longer -,
time help affect fire,
send thought gratitude fighting fire behind scene suppor,
video pharmacist can help evacuee medication bc pharmacy can help,
keep bc safe careful discarding cigarette dry condition,
arrive kamloop ess reception centre evacuee thompson river university,
meet cache creek mayor john ranta tru talk evacuee challenge ne,
update insurance service credit union now open business fully operational,
mayor chair john ranta tell real challenge,
tour relief centre,
see hero action take much need item supply food bank help,
need-to-know terminology b cs wildfire season,
as pharmacist natural that become pharmacist help person pharmacist role,
donate bc fire appeal,
view interactive map fire name estimated size source containment level,
the effort continue help person community impact proud team putt,
for affected provide free counselling referral service via lifework,
mfi policyholder affected can call report claim,
mfi policyholder impact here need know,
help other good health consider donate red cross help affect,
minister national defence just arrived visit relief centre,
im pretty sure eddy girl pied piper sheep htt,
day wildfire,
our food bank help evacuee find nearest food bank check website,
want help evacuee donate samaritan purse salvation army kamloop food bank spca legacy place,
we re support community affect community effort donation,
the latest rural hasting daily,
princeton-area fire now contain progress will test weekend due high wind forecast https,
room trailer rvs tent southern yellowhead hwy kamloop bcfree food evacuee supporter,
lower mainland head deliver supply expect major delay,
air,
from air,
ice now allow job propaganda lover even ny siime know,
thank cheryl evacuee let us tell story,
now housing evacuee,
resiliency face disaster one evacuee share experience inspiring perspective,
the latest ready thank,
prime example member give back proud youre area help donate formula diaper,
evacuee pour thank friend pg food bank fill much need item,
in lower mainland head deliver supply expect major dela,
stay safe weekend crew official will work hard keep family community safe,
tune tell make map help evacuee,
now impact half province force person evacuate help provide emergency relief,
message dr evan adam fnha cmo,
betty white next guest special bc interior,
update july saturday potential high wind weather forecast update,
say help evacuee offer financial relief wildfire evacuee assistance program,
this mapping tool bring together info,
senior pregnant woman person respiratory condition risk wildfire smoke via aline c,
windy weekend worsening condition ahead k person displace k evacuation alert,
no home burn,
wildfire smoke toxic watch helpful video via,
wildfire smoke toxic watch helpful video,
from insurance perspective state emergency,
its forest fire season bc please extinguish cigarette smoking kiosk campus,
list close due severe hazard include info camper reservation,
just famous osoyoos butt bottle drop go talon lowton,
evacuee need medication can use pharmacy near via ac,
evacuee need medication can use pharmacy near via,
evacuee need medication can use pharmacy near,
the latest fire burn around bc right now,
im pretty sure eddy girl pied piper sheep,
home burn ashcroft indian band reserve via ac,
update,
the grateful hundred volunteer show support evacuee,
use forecast understand impact smoke may health,
say help evacuee offer financial relief wildfire evacuee assistance prog,
live across bc interior update,
court registry close today anahim lake circuit court sit july h,
do part customer affect launching assistance program program evacuee,
pic able take still lot hot spot yes wind can change thing quickly,
here look -or-so wildfire burning across b c flame fire note red dot new fire,
midst response effort local emergency response unit offer support abbotsford barn fire,
main library will host service canada clinic fire evacuee today pm,
service canada will set main library tru campus today,
morning update,
truck arrive w donation one first today,
new smoke burnoff operation mile house fire,
bc fire crew brace windy weekend potentially worsening condition,
one-third contain crew concern weekend,
deep sigh map still look nasty crossingfinger doesnt get worse ovr weekend,
say item will deliver forest grove near today,
glad youre feel better president carter dont overdo heat take care tho,
princeton-area fire now contain progress will test weekend due high wind forecast,
despite heavy situation bc womens u softball team forge ahead,
image show just much damage b c s wildfire left behind http,
be head back day wildfire coverage ess ask volunteer food bank donation,
several evacuee iron horse pub lone butte become home away home,
progress make week will test weekend high wind,
science logistic battle b c s wildfire,
devastate photo aftermath ashcroft reserve,
gr comm spirit can get coast will host u ur rv u,
there now significant wildfire burn bc many william lake area interactive map,
its morning update,
wildfire crew prepare worsen weekend weather across southern b c,
wildfire note,
the science logistic battle b c s wildfire,
official say expect rainy weather may fuel flame via,
firefighter cut stump prevent fire spread princeton-area fire,
the news story via,
help support first responder deployed one national incident management team htt,
another day overwhelming support evacuee volunteer sort donation,
the latest marv beer daily thank,
canada post offering mo free mail forwarding service evacuate bc resident,
due albertan travel bc check travel advisory road information depart,
start load thank christopher spring water pacific bottle work skid water,
animal shelter overwhelmed need volunteer,
cu donation effort now total k w fire still burn bc need help donate,
b c wildfire evacuee fall victim rental scam,
say truck rolled morning donation another expect today,
we create problem can fix say fire ecologist via,
first nation evacuation complicated legacy residential school expert say good work ht,
evacuate pharmacist mile house step help evacuee,
save s forest don t discard smoking material vehicle http,
youd like help affect accept donation register behalf,
fire towards dunn lake rd near clearwater bc,
help support affected text fire donate relief effort,
video open door evacuee human pet alike report,
more person home result catastrophic,
the latest paul cubbon daily thank,
person evacuate across british columbia,
court registry close today anahim lake circuit court sit july,
help domestic animal emergency,
impact question general information misconception,
animal cared love volunteer quesnel,
price see big jump,
flee mile house wildfire tell cheryls story life like pa,
new evacuee assistance program automatic credit account power consume away,
check firesmoke ca smoke forecast area,
ground ready help customer b c stay safe,
okanagan fire department send resource wildfire threatened area,
cruel welcome back ashcroft indian band reserve evacuee,
the latest much okanagan daily thank,
latest rapid time daily tri-city edition r,
significant amount human carelessness say,
evacuation man push button,
fight serious thank good folk sign add little levity break,
july afternoon loo,
continue monitor situation please take advantage flexible re-book policy af https,
thought prayer victim emergency response personnel,
minute b c wildfire medium update listen pleasure,
july afternoon,
once youve evacuate sure register,
send e-mail join us mon talk terry mercury,
saturday weather forecast spell trouble fight front,
even smoke forest fire dangerous explain health risk h,
know offer help domestic animal emergency learn htt,
this doug evacuate home day ago live truck ever since,
km ne princeton fire info update pdt see tweet fire near ur city,
customer impact sonnet claim team available support please call,
audio provide update situation,
want info wildfire condition across canada click,
phsa working tirelessly support affected resident community,
update radio listen live online,
kudo hometown kamloop refuge many,
we continue monitor situation please take advantage flexible re-book policy af,
customer can call visit us am- pm mstsat-sun am- pm,
mountain back,
love vintage picture city come together help evacuee feel htt,
courtesy post friendly dog tuff miss swept area burn home,
if youre camping weekend five tip camping without campfire,
bc request albertan avoid send material donation time info financial donation https,
the latest rapid time daily okanagan edition thank,
twenty firefighter nova scotia will fly bc monday help w crew alta ont sask nb already,
where will next hit matter re prepare via,
prince george eoc shut evening everyone stay safe,
martin mar pricey symbol hope wildfire armchair mayor https,
reminder c o give legitimate charity tip avoid scam,
where there smoke there expert mike flannigan read sky,
mercy weatherman still alert still anxious mayor tell ready,
podcast dr tim takaro michael brauer steve raper https,
podcast dr tim takaro michael brauer steve raper,
while many person head away william lake stay feed left include cafe owner sue lachance,
firefighter work tirelessly dispatcher also hour day,
per situation remain unchanged evacuation alert still place weather concern w,
we grind ready help customer b c stay safe,
fire now around hectare size fire contain detail,
post photo detail miss animal pet facebook page,
i certainly see wonder used happen n,
rd day clear sky kamloop big thank emergency crew sa,
that anchor whole family home mile house destroy,
team get much need item evacuee ashcroft,
area around boston flat ashcroft cache creek look black space,
recognize resolve trauma child disaster,
just left animal care,
please help evacuee donate please,
agropur help victim thought,
