dedicate help canadian need re donate k relief effort https,
team person displace provide dinner sunday july th cn ce,
smoke forecast map help predict smoke wildfire expect travel,
expert say scattered shower wont help bc wildfire wind may fuel flame,
scattered shower wont help wind may fuel flame crew prepare worst,
customer impact can contact us day night call us -,
do know anyone affect huge amount forest fire burning british columbia,
another tragic fire know anyone affect,
out-of-province firefighting personnel start arrive assist situation,
state emergency continue wildfire affect via,
the latest missy today thank,
main library host service canada clinic fire evacuee friday july th pm,
update burn hectare across province here new perspective https,
imperial metal continue mining midst local community way,
hold fundraiser july relief show eat,
s become pharmacist help person say kamloops pharmacist mike huitema,
our family friend evacuate mile house--thank responder donor help,
hrs bc cus raise nearly k relief effort let keep go https,
latest number registrant group lodging rv parking alt accomm,
july evening band look e km e wlib hw,
why allow talk climate change b c fire alberta burning,
good morning beautiful kamloop live coordination,
kamloop therapy dog provide hug laughter emergency service evacuation centre,
for customer impact sonnet claim team available support please cal,
help support affected text fire donate relief effort htt,
know go follow info latest info h,
help us make difference donate will match first raise,
good morning beautiful kamloop live coor,
charity scam rise crisis donate relief watch fake group aid initiative rese,
forecast issue twice day current condition update hourly,
thought first responder healthcare staff resident affect stay strong,
one firefighter little brother thank everyone help think everyone affect th,
submitted photo area around,
ndn band,
pls donate,
weekend wind spread b c wildfire new area official warn,
columbia fire horrific eerily beautiful,
bc open door person impact location detail address,
evacuee displace fight blaze continue weekend via live g,
update fire burn province-wide start yest since april fire burned h,
evacuee displace fight blaze continue weekend via li,
martin mar pricey symbol hope wildfire armchair mayor,
thought family impact help visit teck help https,
since friday hectare burn,
the latest animal watch daily thank,
add donation right cell bill easy fast make difference,
say friday million spend far year expect number climb,
get new free per day pu,
can never prepare especially worsen weather expect weekend https,
official aren t liking weekend forecast wind expect pick u,
the latest breaking kelowna news thank,
panel talk omar khadr bc wildfire,
roundup latest news,
jamie traveled delta provide free meal evacuee pow wow ground,
cc- globemaster cfb comox provide airlift support province bc,
man cook free meal wildfire evacuee watch,
see smoke flame pen fire violation call,
coulson aviation continue sideline bc liberal just post,
gotta check video,
willow eyford pet safe coalition society canada,
that anchor whole family home mile house destroy wildfire,
how many dead goat rain dance will take bring rain interior,
premier-designate make second trip interior observe damage,
listen update july,
say hes authorize out-of-province rcmp come deal w bad actor http,
ashcroft reserve fire remain uncontained burning away cache creek watch,
flame also swept cemetery reserve,
ive come realize far away vancouver make wonder know exist,
the latest marie bartlett daily,
dont need addl assistance evacuee still register w let ppl know youre safe,
patient displace can visit pharmacy access emergency supply med,
sure either reply,
be new one put,
you can never prepare especially worsen weather expect weekend,
resident anxious return home water hasnt test today crew work around clock rest,
most home insurance one insured content home say chief,
meeting listen live facebook link pm mtg mins,
video evacuation alert order,
start will likely several week unprecedented let statement sink,
but church reserve untouched,
smoke air calgary ne shut window even though sultry hot cant imagine affect live,
i lose count many burned car come across haunt sure,
send cell phone charge station pg kamloop evacuee,
please spread word partner bc created directory available support,
the latest mogulatus daily thank,
donate horse council bc s animal disaster relief fund,
evacuee brei andrew coax horse trailer youngest refusedshe leave behind,
hes also care cat cat paw fur burn,
summary,
sun struggle shine smokey sky kamloop b c prayer return sky blue h,
the latest firebreak daily,
he fought flame hour used garden hose sprinkler also used spray duri,
sokil transport help london drug transport emergency supply evacuee,
the fire discover july still control though remnant firefighting effort remain,
sat snob hill race bottom event turn design fire assault unit,
establish -hr day health clinic shuttle bus evacuee,
day drive indian reserve meet wonderful soul devastate circu,
manitoba firefighter head british columbia battle wildfire,
last minute town hall evacuee prince george william lake resident ask much longer alert will,
small army prince george resident line sign volunteer effort help evacuee,
fnlc update july stay safe,
affected qs home insurance policy advise help contact us,
cariboo fire update give townhall,
volunteer unload huge donation evacuee,
thread,
fort st john come today filled trailer bc fire evacuee plus k,
wow show support friend huge trailer supply evacuee arrive,
tkemlup pow wow ground welcome evacuee shower camping food,
evacuate due fire welcome b,
video continue open arm evacuee human animal,
say pair suspect loot evacs prolific property criminal one man woman,
notice donation pint sell brewery appeal,
first nation evacuation complicated legacy residential school expert say,
wl airport tonite see helicopter dale,
experience impact system due fire damage update,
weve reached point season firefighter call smoke actually dust dirt roa,
love vintage picture city come together help evacuee feel,
rcmp say arrest william lake connection break enter evacuate home,
constantly impressed social conscience,
just participated fundraiser family pack take order place online sooo go,
be wl airport tonite see helicopter dale,
figure many can process per hour give number assign time come back,
risk evacuation prince george high cariboo apparently,
cariboo regional update wildfire evacuation alert order http,
public weather service satellite key help service identify,
what risk evacuation prince george high cariboo apparently,
thank bc university help affected campuse,
boater block air tanker fighting b c wildfire say official,
drone video show devastation boston flat wildfire rips region,
icymi dont fly drone near get way first responder job,
the beautiful site come helpless feeling,
evacuee now register prince george-- roughly eight per cent citys population,
mean seek donation victim pay lobbyist donation mean peopl,
send thought prayer barrie marj today,
youve evacuate call - register ask banking info phone whe,
incredible story talented tonight give us better idea guy gal deali,
think today stay safe barry marj,
cariboo regional update wildfire evacuation alert order,
karen powell say fireguard establish along highway,
clear evening hover around celsiusthink hard working crew,
happen now townhall evacuee,
say active fire new fire worry cold front w heavy wind come weekend,
also cant get haircut william lake right now-- hes try,
chat one many prince george resident offer bedroom laundry evacuee http,
bc business build spectacular log home tv show devastated story,
need relocate livestock due thing consider https,
q long b folk william lake can return there nothing say cant go back except hwy close,
follow thread evacuee townhall prince george good summary past hour https,
map show highway closure,
follow thread evacuee townhall prince george good summary past hour,
can donate texting fire megan,
tv s timber king fight save log home b c wildfire destroy construction site,
al richmond -- good news havent receive call,
the latest bruce claggett daily thank jone ns okwinefest jonbrown,
the latest bruce claggett daily thank,
tree planter remind keep guard crisis detail,
forecast smoke william lake bluesky,
a friendly reminder creston review via careful weekend folk,
cariboo mp say new ppl sign volunteer volunteer centre today,
unbelievable footage cariboo region warning language,
able please consider donation help relief fund,
ill never forget ninth push button,
thousand force evacuate wildfires rage across b c latest,
mile house mayor mitch campsall start ive hour sleep last eight day tear carry,
bit blue sky nothing compare morning can breathe,
warm heart person kamloops prince george barriere etc really step help evacuee,
shelby thank great unbiased reporting missezula lake,
wildfire near community here can,
richmond say signed new evacuation order within last hour still website social medium,
need massively increase fire attack resource order save home period,
begin meeting evacuee attendance approx ppl theatre,
richmond visibly emotional say one take lightly knock door say gotta get out-- now,
can help evacuee current,
location indicate red triangle see additional detail,
richmond didnt get call house fine speak eight person today hous,
the person b c far kindest generous self sacrifice person world honour serve,
ceo message provincial state emergency wildfire,
satellite image show just much damage left behind,
good information wildfire,
question evacuee future possible disaster,
we start will likely several week unprecedented let statement sink,
update highway closure map now available,
climate change scientist tell us expect will see year like future,
really unprecedented event just overwhelmed,
before image show just much damage b c s wildfire left behind,
information bc evacuee,
when evacuate cow love back,
last minute town hall evacuee prince george william lake resident ask much longer alert,
whoa william lake evac alert likely place least several week order nearby wk long-haul,
employee affect want support learn,
yesterday good day fighting fire good burnoff fire contain,
fire threatening william lake contain crew ontario help it- threat west wind,
hamm really dry lightning will give us trouble say evac alert order good reason,
bui build index numeric rating total amount fuel available combustion,
what need know red line show bad yr wildfire risk red line yr- muc,
signing twitter tonight will return morning leave tonight photo,
joke aside speak neighbour back bc nothing much better also worse that huge plus book,
impact evacuate prepare evacuate find safety tip,
say hes authorize out-of-province rcmp come deal w bad actor,
throw challenge craft beer brewery,
bc animal shelter overwhelm evacuate pet,
cattle threaten,
if able please consider donation help relief fund,
begin meeting evacuee attendance approx ppl,
cancel due current situation,
town hall meeting tonight evacuee pm canfor theatre watch live,
tour command node centre tirelessly coordinate response,
and employee affect want support learn,
the latest diyyinah jamora daily thank,
start minute town hall meeting -- livestream available,
court registry will close monday case schedule friday july,
little video take beautiful evening last night,
support community affect donation canadian red cross,
icymi feel good story,
bird eye view yesterday,
reminder will active fri sit,
scale tip lb hygiene product donate part relief event evacuee l,
s try time mp lend hand sympathetic ear victim https,
rescind alert eulatazella naltesby lake detail,
go help get help working frequently asked question,
ashcroft reserve fire km centre kamloop bc pdt jul,
we just participated fundraiser family pack take order place online sooo good,
thank hard work dedication putt together need,
some evacuee tire re-register every three day story,
garage filled joy donation area need formula diaper message us,
the latest kellys water store thank,
icymi road block via,
there concern safety tree planter crisis detail,
status thursday new evacuation order place fire crew make progress,
resident mile house win t allow home least another week,
dark red area active burning hanceville,
important now ever prepare,
firefighter across canada come help fight,
mt individual affected need help w prescription may visit pharmacy,
affected bcaa prince george office hrs extend sun pm call visit us re help,
ghost town luckily unscathed massive,
amazing photo instagram,
nb v -redcross say give w cash donation dont send stuff sort etc labour intensi,
know someone housing evacuee bring love grocery pet food bake cookies,
icymi evacuee welcome,
give live update situation right now ht,
the latest southeast false creek daily thank,
packed ready go join team help evacuee w insuran,
although smoke seem clearing area situation still evolve cont follow instruction fr,
video lori daniel what fuel via,
say pair suspect loot evacs prolific property criminal one man,
highway fire water congestion plenty reason get road fix,
team working w support evacuee short long-term explain https,
sky smokey beautiful kelowna bc take picture sunset,
fun fact one premier july let agree keep politic,
report via cellphone toll-free current fire bans restriction,
the latest surrey real estate daily thank,
know go follow info latest info,
say person arrest possession steal item evacuate home -y-o man -y-o woman,
wow dealer across donate distribute evacuee,
work help affect,
can help evacuee donation,
attention boater bc state emergency due wildfire see smoke water bomber stay way,
if evacuate due fire welcome,
several community response unit standby respond potential influx evacuee,
team working w support evacuee short long-term explain,
the latest situation,
find safe sound thank two amazing delta police officer horse miss mile house,
fyi rec site trail fire centre close notice,
send staff first responder assist relief effort,
thank stay safe,
in midst response effort local emergency response unit offer support abbotsford barn fire,
thought go affected hope everyone stay safe here can help http,
you can donate texting fire megan,
wish support evacuee donate bc fire appeal,
evacuee settle in,
anahim lake court schedule july cancel contact william lake jcm new court date,
remember every burger platter white spot triple os go help relief today,
anahim lake court schedule july cancel contact william lake jcm new court dat,
evacuee resiliency centre island parkway mcarthur island park informati,
the latest queen jean daily thank,
they every right better trained deal thousand year,
hey guy awful job support british columbian affect,
client please know re help emergency financing relief advice stay safe,
resiliency centre provide insurance advice need assessment evacuee video,
everyone need financial plan daily,
listen chief hurst day drive home t magnitude amount help site totally amazing,
support evacuee complimentary prearrange travel wsj,
current condition william lake,
more important now ever prepare,
hearing radio looter rob neighbor william lake deplorable truly lowest low,
firefighter spraying water ensure ember dont cause flare up princeton-area fire now hectare h,
rdo expect evacuation order alert hold afew day reassess situation,
evacuee call temporary home,
multiple hillside fire near,
set clinic evacuation centre,
hanceville fire fire info update pdt see tweet fire near ur city,
bc business build spectacular log home tv show devastated story wit,
stop today get platter will go,
insurance info affect please share,
our city stranger evacuation timely assistance other join mayor welcome e,
yes ess reception center icon map look slightly like,
the latest select medium daily thank,
burn near grow hectare caveat,
man snap image firefighter bonfire speak detail http,
icymi evacuee offering cover fare,
aerial footage siphon creek may latest update,
go fuel helicopter,
icymi highway closure map update,
the latest living like boss thank,
help evacuee text fire will thank,
now person evacuate shelter preparation gym prince george,
the latest c stewart daily thank,
the latest cybele negris daily thank,
give live update situation right now,
a message dr evan adam fnha cmo,
everything need know b c wildfire,
read latest communique current situation,
come hour update horgan fire tsb report fatal crash more,
