Name,Package Name,Description,Rating,Rating Count
Teacher Rush: School Homework!,com.bf.teacher.rush.school,"Welcome to the best school with the coolest teacher ever! Start now a funny classroom adventure full of surprises!

It is hard to become children's best teacher... but it is worth a try! Get ready and prepare yourself for an amazing school day with your students!
Dress up with some cool school clothes and get the classroom ready for the lesson: Clean up the mess and leave it shining as if it were new! Do not forget to decorate using all your creativity and imagination turning an old classroom into a friendly and welcoming environment!

New students are arriving...let's welcome them and show them how cool is this school adventure! Help them to solve our mini-games and do not forget to take a picture with the funniest class ever!

It's time to teach: Make class lessons fun and do not let students get bored! Teach art, how to take care of class pets or write notes on the board! And the best part... Supervise and direct the school rock band! Isn't it amazing to have all these activities at school?

- Clean up the mess of the classroom and leave it ready to start the lesson!
- Prepare and distribute the meal at lunchtime with delicious food!
- Lead and direct the school rock band!
- Take care of the class pets!
- Enjoy teaching classes making it funny and entertaining!
- Mini-games included: Solve puzzles, matching games and much more in this educational game

Have you ever thought of improving your school! Get some ideas in this crazy classroom adventure! Become the kids’ favorite new teacher! You will love to go to school!",,
Escort School 1.03,escort.fe-school-1,"Non sông Việt Nam có trở lên tươi đẹp hay không, dân tộc Việt Nam có bước tới đài vinh quang để sánh vai với các cường quốc năm châu được hay không chính là nhờ một phần lớn ở công học tập của các cháu.
Ứng dụng kết nối trường học với phụ huynh. Giúp phụ huynh quan sát con em ở trường.",,
Virtual School Girl Simulator,com.fgs.virtual.highschool.girl.simulator,"Welcome to the most amazing and thrilling missions of Virtual school life simulator where you enjoy and learn about different quizzes. Enjoy your back to school days when your mom and dad leaves you to your school life on the first scholar’s days. Indulge with the student and make new friends in this Virtual School Simulator game.
This Virtual school life simulator game is basically designed for kids to learn spelling as well as many math items. If kid enter wrong spelling or option it will display it in red with sound. This Virtual school simulator is the perfect introduction to the basics of counting, spelling, and things recognition. It will teach your toddler many logical skills along with early mathematics, giving them the perfect foundation for a lifetime of learning.
Download fun for free!",,
